,Dataline,Play,PlayerLinenumber,ActSceneLine,Player,PlayerLine
42402,42403,Henry VIII,110.0,3.2.527,CARDINAL WOLSEY,"To the last penny, 'tis the king's: my robe,"
42403,42404,Henry VIII,110.0,3.2.528,CARDINAL WOLSEY,"And my integrity to heaven, is all"
42404,42405,Henry VIII,110.0,3.2.529,CARDINAL WOLSEY,"I dare now call mine own. O Cromwell, Cromwell!"
42405,42406,Henry VIII,110.0,3.2.530,CARDINAL WOLSEY,Had I but served my God with half the zeal
42406,42407,Henry VIII,110.0,3.2.531,CARDINAL WOLSEY,"I served my king, he would not in mine age"
42407,42408,Henry VIII,110.0,3.2.532,CARDINAL WOLSEY,Have left me naked to mine enemies.
42408,42409,Henry VIII,111.0,3.2.533,CROMWELL,"Good sir, have patience."
42409,42410,Henry VIII,112.0,3.2.534,CARDINAL WOLSEY,So I have. Farewell
42410,42411,Henry VIII,112.0,3.2.535,CARDINAL WOLSEY,The hopes of court! my hopes in heaven do dwell.
42411,42412,Henry VIII,112.0,,CARDINAL WOLSEY,Exeunt
42412,42413,Henry VIII,112.0,,CARDINAL WOLSEY,ACT IV
42413,42414,Henry VIII,112.0,,CARDINAL WOLSEY,SCENE I. A street in Westminster.
42414,42415,Henry VIII,112.0,,CARDINAL WOLSEY,"Enter two Gentlemen, meeting one another"
42415,42416,Henry VIII,1.0,4.1.1,First Gentleman,You're well met once again.
42416,42417,Henry VIII,2.0,4.1.2,Second Gentleman,So are you.
42417,42418,Henry VIII,3.0,4.1.3,First Gentleman,"You come to take your stand here, and behold"
42418,42419,Henry VIII,3.0,4.1.4,First Gentleman,The Lady Anne pass from her coronation?
42419,42420,Henry VIII,4.0,4.1.5,Second Gentleman,"'Tis all my business. At our last encounter,"
42420,42421,Henry VIII,4.0,4.1.6,Second Gentleman,The Duke of Buckingham came from his trial.
42421,42422,Henry VIII,5.0,4.1.7,First Gentleman,"'Tis very true: but that time offer'd sorrow,"
42422,42423,Henry VIII,5.0,4.1.8,First Gentleman,"This, general joy."
42423,42424,Henry VIII,6.0,4.1.9,Second Gentleman,"'Tis well: the citizens,"
42424,42425,Henry VIII,6.0,4.1.10,Second Gentleman,"I am sure, have shown at full their royal minds--"
42425,42426,Henry VIII,6.0,4.1.11,Second Gentleman,"As, let 'em have their rights, they are ever forward--"
42426,42427,Henry VIII,6.0,4.1.12,Second Gentleman,"In celebration of this day with shows,"
42427,42428,Henry VIII,6.0,4.1.13,Second Gentleman,Pageants and sights of honour.
42428,42429,Henry VIII,7.0,4.1.14,First Gentleman,"Never greater,"
42429,42430,Henry VIII,7.0,4.1.15,First Gentleman,"Nor, I'll assure you, better taken, sir."
42430,42431,Henry VIII,8.0,4.1.16,Second Gentleman,"May I be bold to ask at what that contains,"
42431,42432,Henry VIII,8.0,4.1.17,Second Gentleman,That paper in your hand?
42432,42433,Henry VIII,9.0,4.1.18,First Gentleman,"Yes, 'tis the list"
42433,42434,Henry VIII,9.0,4.1.19,First Gentleman,Of those that claim their offices this day
42434,42435,Henry VIII,9.0,4.1.20,First Gentleman,By custom of the coronation.
42435,42436,Henry VIII,9.0,4.1.21,First Gentleman,"The Duke of Suffolk is the first, and claims"
42436,42437,Henry VIII,9.0,4.1.22,First Gentleman,"To be high-steward, next, the Duke of Norfolk,"
42437,42438,Henry VIII,9.0,4.1.23,First Gentleman,He to be earl marshal: you may read the rest.
42438,42439,Henry VIII,10.0,4.1.24,Second Gentleman,"I thank you, sir: had I not known those customs,"
42439,42440,Henry VIII,10.0,4.1.25,Second Gentleman,I should have been beholding to your paper.
42440,42441,Henry VIII,10.0,4.1.26,Second Gentleman,"But, I beseech you, what's become of Katharine,"
42441,42442,Henry VIII,10.0,4.1.27,Second Gentleman,The princess dowager? how goes her business?
42442,42443,Henry VIII,11.0,4.1.28,First Gentleman,That I can tell you too. The Archbishop
42443,42444,Henry VIII,11.0,4.1.29,First Gentleman,"Of Canterbury, accompanied with other"
42444,42445,Henry VIII,11.0,4.1.30,First Gentleman,"Learned and reverend fathers of his order,"
42445,42446,Henry VIII,11.0,4.1.31,First Gentleman,"Held a late court at Dunstable, six miles off"
42446,42447,Henry VIII,11.0,4.1.32,First Gentleman,"From Ampthill where the princess lay, to which"
42447,42448,Henry VIII,11.0,4.1.33,First Gentleman,"She was often cited by them, but appear'd not:"
42448,42449,Henry VIII,11.0,4.1.34,First Gentleman,"And, to be short, for not appearance and"
42449,42450,Henry VIII,11.0,4.1.35,First Gentleman,"The king's late scruple, by the main assent"
42450,42451,Henry VIII,11.0,4.1.36,First Gentleman,"Of all these learned men she was divorced,"
42451,42452,Henry VIII,11.0,4.1.37,First Gentleman,And the late marriage made of none effect
42452,42453,Henry VIII,11.0,4.1.38,First Gentleman,"Since which she was removed to Kimbolton,"
42453,42454,Henry VIII,11.0,4.1.39,First Gentleman,Where she remains now sick.
42454,42455,Henry VIII,12.0,4.1.40,Second Gentleman,"Alas, good lady!"
42455,42456,Henry VIII,12.0,,Second Gentleman,Trumpets
42456,42457,Henry VIII,12.0,4.1.41,Second Gentleman,"The trumpets sound: stand close, the queen is coming."
42457,42458,Henry VIII,12.0,,Second Gentleman,Hautboys
42458,42459,Henry VIII,12.0,,Second Gentleman,THE ORDER OF THE CORONATION
42459,42460,Henry VIII,12.0,4.1.42,Second Gentleman,1. A lively flourish of Trumpets.
42460,42461,Henry VIII,12.0,4.1.43,Second Gentleman,"2. Then, two Judges."
42461,42462,Henry VIII,12.0,4.1.44,Second Gentleman,"3. Lord Chancellor, with the purse and mace"
42462,42463,Henry VIII,12.0,4.1.45,Second Gentleman,before him.
42463,42464,Henry VIII,12.0,4.1.46,Second Gentleman,"4. Choristers, singing."
42464,42465,Henry VIII,12.0,,Second Gentleman,Music
42465,42466,Henry VIII,12.0,4.1.47,Second Gentleman,"5. Mayor of London, bearing the mace. Then"
42466,42467,Henry VIII,12.0,4.1.48,Second Gentleman,"Garter, in his coat of arms, and on his"
42467,42468,Henry VIII,12.0,4.1.49,Second Gentleman,head a gilt copper crown.
42468,42469,Henry VIII,12.0,4.1.50,Second Gentleman,"6. Marquess Dorset, bearing a sceptre of gold,"
42469,42470,Henry VIII,12.0,4.1.51,Second Gentleman,on his head a demi-coronal of gold. With
42470,42471,Henry VIII,12.0,4.1.52,Second Gentleman,"him, SURREY, bearing the rod of silver with"
42471,42472,Henry VIII,12.0,4.1.53,Second Gentleman,"the dove, crowned with an earl's coronet."
42472,42473,Henry VIII,12.0,4.1.54,Second Gentleman,Collars of SS.
42473,42474,Henry VIII,12.0,4.1.55,Second Gentleman,"7. SUFFOLK, in his robe of estate, his coronet"
42474,42475,Henry VIII,12.0,4.1.56,Second Gentleman,"on his head, bearing a long white wand, as"
42475,42476,Henry VIII,12.0,4.1.57,Second Gentleman,"high-steward. With him, NORFOLK, with the"
42476,42477,Henry VIII,12.0,4.1.58,Second Gentleman,"rod of marshalship, a coronet on his head."
42477,42478,Henry VIII,12.0,4.1.59,Second Gentleman,Collars of SS.
42478,42479,Henry VIII,12.0,4.1.60,Second Gentleman,"8. A canopy borne by four of the Cinque-ports,"
42479,42480,Henry VIII,12.0,4.1.61,Second Gentleman,"under it, QUEEN ANNE in her robe, in her hair"
42480,42481,Henry VIII,12.0,4.1.62,Second Gentleman,"richly adorned with pearl, crowned. On each"
42481,42482,Henry VIII,12.0,4.1.63,Second Gentleman,"side her, the Bishops of London and"
42482,42483,Henry VIII,12.0,4.1.64,Second Gentleman,Winchester.
42483,42484,Henry VIII,12.0,4.1.65,Second Gentleman,"9. The old Duchess of Norfolk, in a coronal of"
42484,42485,Henry VIII,12.0,4.1.66,Second Gentleman,"gold, wrought with flowers, bearing QUEEN"
42485,42486,Henry VIII,12.0,4.1.67,Second Gentleman,ANNE's train.
42486,42487,Henry VIII,12.0,4.1.68,Second Gentleman,"10. Certain Ladies or Countesses, with plain"
42487,42488,Henry VIII,12.0,4.1.69,Second Gentleman,circlets of gold without flowers.
42488,42489,Henry VIII,12.0,,Second Gentleman,They pass over the stage in order and state
42489,42490,Henry VIII,13.0,4.1.70,Second Gentleman,"A royal train, believe me. These I know:"
42490,42491,Henry VIII,13.0,4.1.71,Second Gentleman,Who's that that bears the sceptre?
42491,42492,Henry VIII,14.0,4.1.72,First Gentleman,Marquess Dorset:
42492,42493,Henry VIII,14.0,4.1.73,First Gentleman,"And that the Earl of Surrey, with the rod."
42493,42494,Henry VIII,15.0,4.1.74,Second Gentleman,A bold brave gentleman. That should be
42494,42495,Henry VIII,15.0,4.1.75,Second Gentleman,The Duke of Suffolk?
42495,42496,Henry VIII,16.0,4.1.76,First Gentleman,'Tis the same: high-steward.
42496,42497,Henry VIII,17.0,4.1.77,Second Gentleman,And that my Lord of Norfolk?
42497,42498,Henry VIII,18.0,4.1.78,First Gentleman,"Yes,"
42498,42499,Henry VIII,19.0,4.1.79,Second Gentleman,Heaven bless thee!
42499,42500,Henry VIII,19.0,,Second Gentleman,Looking on QUEEN ANNE
42500,42501,Henry VIII,19.0,4.1.80,Second Gentleman,Thou hast the sweetest face I ever look'd on.
42501,42502,Henry VIII,19.0,4.1.81,Second Gentleman,"Sir, as I have a soul, she is an angel,"
42502,42503,Henry VIII,19.0,4.1.82,Second Gentleman,"Our king has all the Indies in his arms,"
42503,42504,Henry VIII,19.0,4.1.83,Second Gentleman,"And more and richer, when he strains that lady:"
42504,42505,Henry VIII,19.0,4.1.84,Second Gentleman,I cannot blame his conscience.
42505,42506,Henry VIII,20.0,4.1.85,First Gentleman,They that bear
42506,42507,Henry VIII,20.0,4.1.86,First Gentleman,"The cloth of honour over her, are four barons"
42507,42508,Henry VIII,20.0,4.1.87,First Gentleman,Of the Cinque-ports.
42508,42509,Henry VIII,21.0,4.1.88,Second Gentleman,"Those men are happy, and so are all are near her."
42509,42510,Henry VIII,21.0,4.1.89,Second Gentleman,"I take it, she that carries up the train"
42510,42511,Henry VIII,21.0,4.1.90,Second Gentleman,"Is that old noble lady, Duchess of Norfolk."
42511,42512,Henry VIII,22.0,4.1.91,First Gentleman,"It is, and all the rest are countesses."
42512,42513,Henry VIII,23.0,4.1.92,Second Gentleman,"Their coronets say so. These are stars indeed,"
42513,42514,Henry VIII,23.0,4.1.93,Second Gentleman,And sometimes falling ones.
42514,42515,Henry VIII,24.0,4.1.94,First Gentleman,No more of that.
42515,42516,Henry VIII,24.0,,First Gentleman,"Exit procession, and then a great flourish of trumpets"
42516,42517,Henry VIII,24.0,,First Gentleman,Enter a third Gentleman
42517,42518,Henry VIII,25.0,4.1.95,First Gentleman,"God save you, sir! where have you been broiling?"
42518,42519,Henry VIII,26.0,4.1.96,Third Gentleman,"Among the crowd i' the Abbey, where a finger"
42519,42520,Henry VIII,26.0,4.1.97,Third Gentleman,Could not be wedged in more: I am stifled
42520,42521,Henry VIII,26.0,4.1.98,Third Gentleman,With the mere rankness of their joy.
42521,42522,Henry VIII,27.0,4.1.99,Second Gentleman,You saw
42522,42523,Henry VIII,27.0,4.1.100,Second Gentleman,The ceremony?
42523,42524,Henry VIII,28.0,4.1.101,Third Gentleman,That I did.
42524,42525,Henry VIII,29.0,4.1.102,First Gentleman,How was it?
42525,42526,Henry VIII,30.0,4.1.103,Third Gentleman,Well worth the seeing.
42526,42527,Henry VIII,31.0,4.1.104,Second Gentleman,"Good sir, speak it to us."
42527,42528,Henry VIII,32.0,4.1.105,Third Gentleman,As well as I am able. The rich stream
42528,42529,Henry VIII,32.0,4.1.106,Third Gentleman,"Of lords and ladies, having brought the queen"
42529,42530,Henry VIII,32.0,4.1.107,Third Gentleman,"To a prepared place in the choir, fell off"
42530,42531,Henry VIII,32.0,4.1.108,Third Gentleman,"A distance from her, while her grace sat down"
42531,42532,Henry VIII,32.0,4.1.109,Third Gentleman,"To rest awhile, some half an hour or so,"
42532,42533,Henry VIII,32.0,4.1.110,Third Gentleman,"In a rich chair of state, opposing freely"
42533,42534,Henry VIII,32.0,4.1.111,Third Gentleman,The beauty of her person to the people.
42534,42535,Henry VIII,32.0,4.1.112,Third Gentleman,"Believe me, sir, she is the goodliest woman"
42535,42536,Henry VIII,32.0,4.1.113,Third Gentleman,That ever lay by man: which when the people
42536,42537,Henry VIII,32.0,4.1.114,Third Gentleman,"Had the full view of, such a noise arose"
42537,42538,Henry VIII,32.0,4.1.115,Third Gentleman,"As the shrouds make at sea in a stiff tempest,"
42538,42539,Henry VIII,32.0,4.1.116,Third Gentleman,"As loud, and to as many tunes: hats, cloaks--"
42539,42540,Henry VIII,32.0,4.1.117,Third Gentleman,"Doublets, I think,--flew up, and had their faces"
42540,42541,Henry VIII,32.0,4.1.118,Third Gentleman,"Been loose, this day they had been lost. Such joy"
42541,42542,Henry VIII,32.0,4.1.119,Third Gentleman,"I never saw before. Great-bellied women,"
42542,42543,Henry VIII,32.0,4.1.120,Third Gentleman,"That had not half a week to go, like rams"
42543,42544,Henry VIII,32.0,4.1.121,Third Gentleman,"In the old time of war, would shake the press,"
42544,42545,Henry VIII,32.0,4.1.122,Third Gentleman,And make 'em reel before 'em. No man living
42545,42546,Henry VIII,32.0,4.1.123,Third Gentleman,"Could say 'This is my wife' there, all were woven"
42546,42547,Henry VIII,32.0,4.1.124,Third Gentleman,So strangely in one piece.
42547,42548,Henry VIII,33.0,4.1.125,Second Gentleman,"But, what follow'd?"
42548,42549,Henry VIII,34.0,4.1.126,Third Gentleman,"At length her grace rose, and with modest paces"
42549,42550,Henry VIII,34.0,4.1.127,Third Gentleman,"Came to the altar, where she kneel'd, and saint-like"
42550,42551,Henry VIII,34.0,4.1.128,Third Gentleman,Cast her fair eyes to heaven and pray'd devoutly.
42551,42552,Henry VIII,34.0,4.1.129,Third Gentleman,Then rose again and bow'd her to the people:
42552,42553,Henry VIII,34.0,4.1.130,Third Gentleman,When by the Archbishop of Canterbury
42553,42554,Henry VIII,34.0,4.1.131,Third Gentleman,"She had all the royal makings of a queen,"
42554,42555,Henry VIII,34.0,4.1.132,Third Gentleman,"As holy oil, Edward Confessor's crown,"
42555,42556,Henry VIII,34.0,4.1.133,Third Gentleman,"The rod, and bird of peace, and all such emblems"
42556,42557,Henry VIII,34.0,4.1.134,Third Gentleman,"Laid nobly on her: which perform'd, the choir,"
42557,42558,Henry VIII,34.0,4.1.135,Third Gentleman,"With all the choicest music of the kingdom,"
42558,42559,Henry VIII,34.0,4.1.136,Third Gentleman,"Together sung 'Te Deum.' So she parted,"
42559,42560,Henry VIII,34.0,4.1.137,Third Gentleman,And with the same full state paced back again
42560,42561,Henry VIII,34.0,4.1.138,Third Gentleman,"To York-place, where the feast is held."
42561,42562,Henry VIII,35.0,4.1.139,First Gentleman,"Sir,"
42562,42563,Henry VIII,35.0,4.1.140,First Gentleman,"You must no more call it York-place, that's past,"
42563,42564,Henry VIII,35.0,4.1.141,First Gentleman,"For, since the cardinal fell, that title's lost:"
42564,42565,Henry VIII,35.0,4.1.142,First Gentleman,"'Tis now the king's, and call'd Whitehall."
42565,42566,Henry VIII,36.0,4.1.143,Third Gentleman,"I know it,"
42566,42567,Henry VIII,36.0,4.1.144,Third Gentleman,"But 'tis so lately alter'd, that the old name"
42567,42568,Henry VIII,36.0,4.1.145,Third Gentleman,Is fresh about me.
42568,42569,Henry VIII,37.0,4.1.146,Second Gentleman,What two reverend bishops
42569,42570,Henry VIII,37.0,4.1.147,Second Gentleman,Were those that went on each side of the queen?
42570,42571,Henry VIII,38.0,4.1.148,Third Gentleman,"Stokesly and Gardiner, the one of Winchester,"
42571,42572,Henry VIII,38.0,4.1.149,Third Gentleman,"Newly preferr'd from the king's secretary,"
42572,42573,Henry VIII,38.0,4.1.150,Third Gentleman,"The other, London."
42573,42574,Henry VIII,39.0,4.1.151,Second Gentleman,He of Winchester
42574,42575,Henry VIII,39.0,4.1.152,Second Gentleman,"Is held no great good lover of the archbishop's,"
42575,42576,Henry VIII,39.0,4.1.153,Second Gentleman,The virtuous Cranmer.
42576,42577,Henry VIII,40.0,4.1.154,Third Gentleman,All the land knows that:
42577,42578,Henry VIII,40.0,4.1.155,Third Gentleman,"However, yet there is no great breach, when it comes,"
42578,42579,Henry VIII,40.0,4.1.156,Third Gentleman,Cranmer will find a friend will not shrink from him.
42579,42580,Henry VIII,41.0,4.1.157,Second Gentleman,"Who may that be, I pray you?"
42580,42581,Henry VIII,42.0,4.1.158,Third Gentleman,"Thomas Cromwell,"
42581,42582,Henry VIII,42.0,4.1.159,Third Gentleman,"A man in much esteem with the king, and truly"
42582,42583,Henry VIII,42.0,4.1.160,Third Gentleman,A worthy friend. The king has made him master
42583,42584,Henry VIII,42.0,4.1.161,Third Gentleman,"O' the jewel house,"
42584,42585,Henry VIII,42.0,4.1.162,Third Gentleman,"And one, already, of the privy council."
42585,42586,Henry VIII,43.0,4.1.163,Second Gentleman,He will deserve more.
42586,42587,Henry VIII,44.0,4.1.164,Third Gentleman,"Yes, without all doubt."
42587,42588,Henry VIII,44.0,4.1.165,Third Gentleman,"Come, gentlemen, ye shall go my way, which"
42588,42589,Henry VIII,44.0,4.1.166,Third Gentleman,"Is to the court, and there ye shall be my guests:"
42589,42590,Henry VIII,44.0,4.1.167,Third Gentleman,"Something I can command. As I walk thither,"
42590,42591,Henry VIII,44.0,4.1.168,Third Gentleman,I'll tell ye more.
42591,42592,Henry VIII,45.0,4.1.169,Both,"You may command us, sir."
42592,42593,Henry VIII,45.0,,Both,Exeunt
42593,42594,Henry VIII,45.0,,Both,SCENE II. Kimbolton.
42594,42595,Henry VIII,45.0,,Both,"Enter KATHARINE, Dowager, sick, led between GRIFFITH, her gentleman usher, and PATIENCE, her woman"
42595,42596,Henry VIII,1.0,4.2.1,GRIFFITH,How does your grace?
42596,42597,Henry VIII,2.0,4.2.2,KATHARINE,"O Griffith, sick to death!"
42597,42598,Henry VIII,2.0,4.2.3,KATHARINE,"My legs, like loaden branches, bow to the earth,"
42598,42599,Henry VIII,2.0,4.2.4,KATHARINE,Willing to leave their burthen. Reach a chair:
42599,42600,Henry VIII,2.0,4.2.5,KATHARINE,"So, now, methinks, I feel a little ease."
42600,42601,Henry VIII,2.0,4.2.6,KATHARINE,"Didst thou not tell me, Griffith, as thou led'st me,"
42601,42602,Henry VIII,2.0,4.2.7,KATHARINE,"That the great child of honour, Cardinal Wolsey, Was dead?"
42602,42603,Henry VIII,3.0,4.2.8,GRIFFITH,"Yes, madam, but I think your grace,"
42603,42604,Henry VIII,3.0,4.2.9,GRIFFITH,"Out of the pain you suffer'd, gave no ear to't."
42604,42605,Henry VIII,4.0,4.2.10,KATHARINE,"Prithee, good Griffith, tell me how he died:"
42605,42606,Henry VIII,4.0,4.2.11,KATHARINE,"If well, he stepp'd before me, happily"
42606,42607,Henry VIII,4.0,4.2.12,KATHARINE,For my example.
42607,42608,Henry VIII,5.0,4.2.13,GRIFFITH,"Well, the voice goes, madam:"
42608,42609,Henry VIII,5.0,4.2.14,GRIFFITH,For after the stout Earl Northumberland
42609,42610,Henry VIII,5.0,4.2.15,GRIFFITH,"Arrested him at York, and brought him forward,"
42610,42611,Henry VIII,5.0,4.2.16,GRIFFITH,"As a man sorely tainted, to his answer,"
42611,42612,Henry VIII,5.0,4.2.17,GRIFFITH,"He fell sick suddenly, and grew so ill"
42612,42613,Henry VIII,5.0,4.2.18,GRIFFITH,He could not sit his mule.
42613,42614,Henry VIII,6.0,4.2.19,KATHARINE,"Alas, poor man!"
42614,42615,Henry VIII,7.0,4.2.20,GRIFFITH,"At last, with easy roads, he came to Leicester,"
42615,42616,Henry VIII,7.0,4.2.21,GRIFFITH,"Lodged in the abbey, where the reverend abbot,"
42616,42617,Henry VIII,7.0,4.2.22,GRIFFITH,"With all his covent, honourably received him,"
42617,42618,Henry VIII,7.0,4.2.23,GRIFFITH,"To whom he gave these words, 'O, father abbot,"
42618,42619,Henry VIII,7.0,4.2.24,GRIFFITH,"An old man, broken with the storms of state,"
42619,42620,Henry VIII,7.0,4.2.25,GRIFFITH,"Is come to lay his weary bones among ye,"
42620,42621,Henry VIII,7.0,4.2.26,GRIFFITH,Give him a little earth for charity!'
42621,42622,Henry VIII,7.0,4.2.27,GRIFFITH,"So went to bed, where eagerly his sickness"
42622,42623,Henry VIII,7.0,4.2.28,GRIFFITH,"Pursued him still: and, three nights after this,"
42623,42624,Henry VIII,7.0,4.2.29,GRIFFITH,"About the hour of eight, which he himself"
42624,42625,Henry VIII,7.0,4.2.30,GRIFFITH,"Foretold should be his last, full of repentance,"
42625,42626,Henry VIII,7.0,4.2.31,GRIFFITH,"Continual meditations, tears, and sorrows,"
42626,42627,Henry VIII,7.0,4.2.32,GRIFFITH,"He gave his honours to the world again,"
42627,42628,Henry VIII,7.0,4.2.33,GRIFFITH,"His blessed part to heaven, and slept in peace."
42628,42629,Henry VIII,8.0,4.2.34,KATHARINE,"So may he rest, his faults lie gently on him!"
42629,42630,Henry VIII,8.0,4.2.35,KATHARINE,"Yet thus far, Griffith, give me leave to speak him,"
42630,42631,Henry VIII,8.0,4.2.36,KATHARINE,And yet with charity. He was a man
42631,42632,Henry VIII,8.0,4.2.37,KATHARINE,"Of an unbounded stomach, ever ranking"
42632,42633,Henry VIII,8.0,4.2.38,KATHARINE,"Himself with princes, one that, by suggestion,"
42633,42634,Henry VIII,8.0,4.2.39,KATHARINE,"Tied all the kingdom: simony was fair-play,"
42634,42635,Henry VIII,8.0,4.2.40,KATHARINE,His own opinion was his law: i' the presence
42635,42636,Henry VIII,8.0,4.2.41,KATHARINE,"He would say untruths, and be ever double"
42636,42637,Henry VIII,8.0,4.2.42,KATHARINE,"Both in his words and meaning: he was never,"
42637,42638,Henry VIII,8.0,4.2.43,KATHARINE,"But where he meant to ruin, pitiful:"
42638,42639,Henry VIII,8.0,4.2.44,KATHARINE,"His promises were, as he then was, mighty,"
42639,42640,Henry VIII,8.0,4.2.45,KATHARINE,"But his performance, as he is now, nothing:"
42640,42641,Henry VIII,8.0,4.2.46,KATHARINE,"Of his own body he was ill, and gave"
42641,42642,Henry VIII,8.0,4.2.47,KATHARINE,The clergy in example.
42642,42643,Henry VIII,9.0,4.2.48,GRIFFITH,"Noble madam,"
42643,42644,Henry VIII,9.0,4.2.49,GRIFFITH,"Men's evil manners live in brass, their virtues"
42644,42645,Henry VIII,9.0,4.2.50,GRIFFITH,We write in water. May it please your highness
42645,42646,Henry VIII,9.0,4.2.51,GRIFFITH,To hear me speak his good now?
42646,42647,Henry VIII,10.0,4.2.52,KATHARINE,"Yes, good Griffith,"
42647,42648,Henry VIII,10.0,4.2.53,KATHARINE,I were malicious else.
42648,42649,Henry VIII,11.0,4.2.54,GRIFFITH,"This cardinal,"
42649,42650,Henry VIII,11.0,4.2.55,GRIFFITH,"Though from an humble stock, undoubtedly"
42650,42651,Henry VIII,11.0,4.2.56,GRIFFITH,Was fashion'd to much honour from his cradle.
42651,42652,Henry VIII,11.0,4.2.57,GRIFFITH,"He was a scholar, and a ripe and good one,"
42652,42653,Henry VIII,11.0,4.2.58,GRIFFITH,"Exceeding wise, fair-spoken, and persuading:"
42653,42654,Henry VIII,11.0,4.2.59,GRIFFITH,"Lofty and sour to them that loved him not,"
42654,42655,Henry VIII,11.0,4.2.60,GRIFFITH,But to those men that sought him sweet as summer.
42655,42656,Henry VIII,11.0,4.2.61,GRIFFITH,"And though he were unsatisfied in getting,"
42656,42657,Henry VIII,11.0,4.2.62,GRIFFITH,"Which was a sin, yet in bestowing, madam,"
42657,42658,Henry VIII,11.0,4.2.63,GRIFFITH,He was most princely: ever witness for him
42658,42659,Henry VIII,11.0,4.2.64,GRIFFITH,"Those twins Of learning that he raised in you,"
42659,42660,Henry VIII,11.0,4.2.65,GRIFFITH,"Ipswich and Oxford! one of which fell with him,"
42660,42661,Henry VIII,11.0,4.2.66,GRIFFITH,"Unwilling to outlive the good that did it,"
42661,42662,Henry VIII,11.0,4.2.67,GRIFFITH,"The other, though unfinish'd, yet so famous,"
42662,42663,Henry VIII,11.0,4.2.68,GRIFFITH,"So excellent in art, and still so rising,"
42663,42664,Henry VIII,11.0,4.2.69,GRIFFITH,That Christendom shall ever speak his virtue.
42664,42665,Henry VIII,11.0,4.2.70,GRIFFITH,"His overthrow heap'd happiness upon him,"
42665,42666,Henry VIII,11.0,4.2.71,GRIFFITH,"For then, and not till then, he felt himself,"
42666,42667,Henry VIII,11.0,4.2.72,GRIFFITH,And found the blessedness of being little:
42667,42668,Henry VIII,11.0,4.2.73,GRIFFITH,"And, to add greater honours to his age"
42668,42669,Henry VIII,11.0,4.2.74,GRIFFITH,"Than man could give him, he died fearing God."
42669,42670,Henry VIII,12.0,4.2.75,KATHARINE,"After my death I wish no other herald,"
42670,42671,Henry VIII,12.0,4.2.76,KATHARINE,"No other speaker of my living actions,"
42671,42672,Henry VIII,12.0,4.2.77,KATHARINE,"To keep mine honour from corruption,"
42672,42673,Henry VIII,12.0,4.2.78,KATHARINE,But such an honest chronicler as Griffith.
42673,42674,Henry VIII,12.0,4.2.79,KATHARINE,"Whom I most hated living, thou hast made me,"
42674,42675,Henry VIII,12.0,4.2.80,KATHARINE,"With thy religious truth and modesty,"
42675,42676,Henry VIII,12.0,4.2.81,KATHARINE,Now in his ashes honour: peace be with him!
42676,42677,Henry VIII,12.0,4.2.82,KATHARINE,"Patience, be near me still, and set me lower:"
42677,42678,Henry VIII,12.0,4.2.83,KATHARINE,"I have not long to trouble thee. Good Griffith,"
42678,42679,Henry VIII,12.0,4.2.84,KATHARINE,Cause the musicians play me that sad note
42679,42680,Henry VIII,12.0,4.2.85,KATHARINE,"I named my knell, whilst I sit meditating"
42680,42681,Henry VIII,12.0,4.2.86,KATHARINE,On that celestial harmony I go to.
42681,42682,Henry VIII,12.0,,KATHARINE,Sad and solemn music
42682,42683,Henry VIII,13.0,4.2.87,GRIFFITH,"She is asleep: good wench, let's sit down quiet,"
42683,42684,Henry VIII,13.0,4.2.88,GRIFFITH,"For fear we wake her: softly, gentle Patience."
42684,42685,Henry VIII,13.0,4.2.88,GRIFFITH,"The vision. Enter, solemnly tripping one after  another, six personages, clad in white robes,  wearing on their heads garlands of bays, and golden  vizards on their faces, branches of bays or palm in  their hands. They first congee unto her, then  dance, and, at certain changes, the first two hold  a spare garland over her head, at which the other  four make reverent curtsies, then the two that held  the garland deliver the same to the other next two,  who observe the same order in their changes, and  holding the garland over her head: which done,  they deliver the same garland to the last two, who  likewise observe the same order: at which, as it  were by inspiration, she makes in her sleep signs  of rejoicing, and holdeth up her hands to heaven:  and so in their dancing vanish, carrying the garland with them. The music continues"
42685,42686,Henry VIII,14.0,4.2.89,KATHARINE,"Spirits of peace, where are ye? are ye all gone,"
