,Dataline,Play,PlayerLinenumber,ActSceneLine,Player,PlayerLine
4649,4650,Henry VI Part 1,51.0,,GLOUCESTER,Sennet. Flourish. Exeunt all but EXETER
4650,4651,Henry VI Part 1,52.0,3.1.205,EXETER,"Ay, we may march in England or in France,"
4651,4652,Henry VI Part 1,52.0,3.1.206,EXETER,Not seeing what is likely to ensue.
4652,4653,Henry VI Part 1,52.0,3.1.207,EXETER,This late dissension grown betwixt the peers
4653,4654,Henry VI Part 1,52.0,3.1.208,EXETER,Burns under feigned ashes of forged love
4654,4655,Henry VI Part 1,52.0,3.1.209,EXETER,And will at last break out into a flame:
4655,4656,Henry VI Part 1,52.0,3.1.210,EXETER,"As fester'd members rot but by degree,"
4656,4657,Henry VI Part 1,52.0,3.1.211,EXETER,"Till bones and flesh and sinews fall away,"
4657,4658,Henry VI Part 1,52.0,3.1.212,EXETER,So will this base and envious discord breed.
4658,4659,Henry VI Part 1,52.0,3.1.213,EXETER,And now I fear that fatal prophecy
4659,4660,Henry VI Part 1,52.0,3.1.214,EXETER,Which in the time of Henry named the Fifth
4660,4661,Henry VI Part 1,52.0,3.1.215,EXETER,"Was in the mouth of every sucking babe,"
4661,4662,Henry VI Part 1,52.0,3.1.216,EXETER,That Henry born at Monmouth should win all
4662,4663,Henry VI Part 1,52.0,3.1.217,EXETER,And Henry born at Windsor lose all:
4663,4664,Henry VI Part 1,52.0,3.1.218,EXETER,Which is so plain that Exeter doth wish
4664,4665,Henry VI Part 1,52.0,3.1.219,EXETER,His days may finish ere that hapless time.
4665,4666,Henry VI Part 1,52.0,,EXETER,Exit
4666,4667,Henry VI Part 1,52.0,,EXETER,SCENE II. France. Before Rouen.
4667,4668,Henry VI Part 1,52.0,,EXETER,"Enter JOAN LA PUCELLE disguised, with four Soldiers with sacks upon their backs"
4668,4669,Henry VI Part 1,1.0,3.2.1,JOAN LA PUCELLE,"These are the city gates, the gates of Rouen,"
4669,4670,Henry VI Part 1,1.0,3.2.2,JOAN LA PUCELLE,Through which our policy must make a breach:
4670,4671,Henry VI Part 1,1.0,3.2.3,JOAN LA PUCELLE,"Take heed, be wary how you place your words,"
4671,4672,Henry VI Part 1,1.0,3.2.4,JOAN LA PUCELLE,Talk like the vulgar sort of market men
4672,4673,Henry VI Part 1,1.0,3.2.5,JOAN LA PUCELLE,That come to gather money for their corn.
4673,4674,Henry VI Part 1,1.0,3.2.6,JOAN LA PUCELLE,"If we have entrance, as I hope we shall,"
4674,4675,Henry VI Part 1,1.0,3.2.7,JOAN LA PUCELLE,"And that we find the slothful watch but weak,"
4675,4676,Henry VI Part 1,1.0,3.2.8,JOAN LA PUCELLE,"I'll by a sign give notice to our friends,"
4676,4677,Henry VI Part 1,1.0,3.2.9,JOAN LA PUCELLE,That Charles the Dauphin may encounter them.
4677,4678,Henry VI Part 1,2.0,3.2.10,First Soldier,"Our sacks shall be a mean to sack the city,"
4678,4679,Henry VI Part 1,2.0,3.2.11,First Soldier,"And we be lords and rulers over Rouen,"
4679,4680,Henry VI Part 1,2.0,3.2.12,First Soldier,Therefore we'll knock.
4680,4681,Henry VI Part 1,2.0,,First Soldier,Knocks
4681,4682,Henry VI Part 1,3.0,3.2.13,Watch,[Within]  Qui est la?
4682,4683,Henry VI Part 1,4.0,3.2.14,JOAN LA PUCELLE,"Paysans, pauvres gens de France,"
4683,4684,Henry VI Part 1,4.0,3.2.15,JOAN LA PUCELLE,Poor market folks that come to sell their corn.
4684,4685,Henry VI Part 1,5.0,3.2.16,Watch,"Enter, go in, the market bell is rung."
4685,4686,Henry VI Part 1,6.0,3.2.17,JOAN LA PUCELLE,"Now, Rouen, I'll shake thy bulwarks to the ground."
4686,4687,Henry VI Part 1,6.0,,JOAN LA PUCELLE,Exeunt
4687,4688,Henry VI Part 1,6.0,,JOAN LA PUCELLE,"Enter CHARLES, the BASTARD OF ORLEANS, ALENCON, REIGNIER, and forces"
4688,4689,Henry VI Part 1,7.0,3.2.18,CHARLES,Saint Denis bless this happy stratagem!
4689,4690,Henry VI Part 1,7.0,3.2.19,CHARLES,And once again we'll sleep secure in Rouen.
4690,4691,Henry VI Part 1,8.0,3.2.20,BASTARD OF ORLEANS,"Here enter'd Pucelle and her practisants,"
4691,4692,Henry VI Part 1,8.0,3.2.21,BASTARD OF ORLEANS,"Now she is there, how will she specify"
4692,4693,Henry VI Part 1,8.0,3.2.22,BASTARD OF ORLEANS,Where is the best and safest passage in?
4693,4694,Henry VI Part 1,9.0,3.2.23,REIGNIER,"By thrusting out a torch from yonder tower,"
4694,4695,Henry VI Part 1,9.0,3.2.24,REIGNIER,"Which, once discern'd, shows that her meaning is,"
4695,4696,Henry VI Part 1,9.0,3.2.25,REIGNIER,"No way to that, for weakness, which she enter'd."
4696,4697,Henry VI Part 1,9.0,,REIGNIER,"Enter JOAN LA PUCELLE on the top, thrusting out a torch burning"
4697,4698,Henry VI Part 1,10.0,3.2.26,JOAN LA PUCELLE,"Behold, this is the happy wedding torch"
4698,4699,Henry VI Part 1,10.0,3.2.27,JOAN LA PUCELLE,"That joineth Rouen unto her countrymen,"
4699,4700,Henry VI Part 1,10.0,3.2.28,JOAN LA PUCELLE,But burning fatal to the Talbotites!
4700,4701,Henry VI Part 1,10.0,,JOAN LA PUCELLE,Exit
4701,4702,Henry VI Part 1,11.0,3.2.29,BASTARD OF ORLEANS,"See, noble Charles, the beacon of our friend,"
4702,4703,Henry VI Part 1,11.0,3.2.30,BASTARD OF ORLEANS,The burning torch in yonder turret stands.
4703,4704,Henry VI Part 1,12.0,3.2.31,CHARLES,"Now shine it like a comet of revenge,"
4704,4705,Henry VI Part 1,12.0,3.2.32,CHARLES,A prophet to the fall of all our foes!
4705,4706,Henry VI Part 1,13.0,3.2.33,REIGNIER,"Defer no time, delays have dangerous ends,"
4706,4707,Henry VI Part 1,13.0,3.2.34,REIGNIER,"Enter, and cry 'The Dauphin!' presently,"
4707,4708,Henry VI Part 1,13.0,3.2.35,REIGNIER,And then do execution on the watch.
4708,4709,Henry VI Part 1,13.0,,REIGNIER,Alarum. Exeunt
4709,4710,Henry VI Part 1,13.0,,REIGNIER,An alarum. Enter TALBOT in an excursion
4710,4711,Henry VI Part 1,14.0,3.2.36,TALBOT,"France, thou shalt rue this treason with thy tears,"
4711,4712,Henry VI Part 1,14.0,3.2.37,TALBOT,If Talbot but survive thy treachery.
4712,4713,Henry VI Part 1,14.0,3.2.38,TALBOT,"Pucelle, that witch, that damned sorceress,"
4713,4714,Henry VI Part 1,14.0,3.2.39,TALBOT,"Hath wrought this hellish mischief unawares,"
4714,4715,Henry VI Part 1,14.0,3.2.40,TALBOT,That hardly we escaped the pride of France.
4715,4716,Henry VI Part 1,14.0,,TALBOT,Exit
4716,4717,Henry VI Part 1,14.0,,TALBOT,"An alarum: excursions. BEDFORD, brought in sick  in a chair. Enter TALBOT and BURGUNDY without:  within JOAN LA PUCELLE, CHARLES, BASTARD OF ORLEANS, ALENCON, and REIGNIER, on the walls"
4717,4718,Henry VI Part 1,15.0,3.2.41,JOAN LA PUCELLE,"Good morrow, gallants! want ye corn for bread?"
4718,4719,Henry VI Part 1,15.0,3.2.42,JOAN LA PUCELLE,I think the Duke of Burgundy will fast
4719,4720,Henry VI Part 1,15.0,3.2.43,JOAN LA PUCELLE,Before he'll buy again at such a rate:
4720,4721,Henry VI Part 1,15.0,3.2.44,JOAN LA PUCELLE,"'Twas full of darnel, do you like the taste?"
4721,4722,Henry VI Part 1,16.0,3.2.45,BURGUNDY,"Scoff on, vile fiend and shameless courtezan!"
4722,4723,Henry VI Part 1,16.0,3.2.46,BURGUNDY,I trust ere long to choke thee with thine own
4723,4724,Henry VI Part 1,16.0,3.2.47,BURGUNDY,And make thee curse the harvest of that corn.
4724,4725,Henry VI Part 1,17.0,3.2.48,CHARLES,Your grace may starve perhaps before that time.
4725,4726,Henry VI Part 1,18.0,3.2.49,BEDFORD,"O, let no words, but deeds, revenge this treason!"
4726,4727,Henry VI Part 1,19.0,3.2.50,JOAN LA PUCELLE,"What will you do, good grey-beard? break a lance,"
4727,4728,Henry VI Part 1,19.0,3.2.51,JOAN LA PUCELLE,And run a tilt at death within a chair?
4728,4729,Henry VI Part 1,20.0,3.2.52,TALBOT,"Foul fiend of France, and hag of all despite,"
4729,4730,Henry VI Part 1,20.0,3.2.53,TALBOT,Encompass'd with thy lustful paramours!
4730,4731,Henry VI Part 1,20.0,3.2.54,TALBOT,Becomes it thee to taunt his valiant age
4731,4732,Henry VI Part 1,20.0,3.2.55,TALBOT,And twit with cowardice a man half dead?
4732,4733,Henry VI Part 1,20.0,3.2.56,TALBOT,"Damsel, I'll have a bout with you again,"
4733,4734,Henry VI Part 1,20.0,3.2.57,TALBOT,Or else let Talbot perish with this shame.
4734,4735,Henry VI Part 1,21.0,3.2.58,JOAN LA PUCELLE,"Are ye so hot, sir? yet, Pucelle, hold thy peace,"
4735,4736,Henry VI Part 1,21.0,3.2.59,JOAN LA PUCELLE,"If Talbot do but thunder, rain will follow."
4736,4737,Henry VI Part 1,21.0,,JOAN LA PUCELLE,The English whisper together in council
4737,4738,Henry VI Part 1,21.0,3.2.60,JOAN LA PUCELLE,God speed the parliament! who shall be the speaker?
4738,4739,Henry VI Part 1,22.0,3.2.61,TALBOT,Dare ye come forth and meet us in the field?
4739,4740,Henry VI Part 1,23.0,3.2.62,JOAN LA PUCELLE,"Belike your lordship takes us then for fools,"
4740,4741,Henry VI Part 1,23.0,3.2.63,JOAN LA PUCELLE,To try if that our own be ours or no.
4741,4742,Henry VI Part 1,24.0,3.2.64,TALBOT,"I speak not to that railing Hecate,"
4742,4743,Henry VI Part 1,24.0,3.2.65,TALBOT,"But unto thee, Alencon, and the rest,"
4743,4744,Henry VI Part 1,24.0,3.2.66,TALBOT,"Will ye, like soldiers, come and fight it out?"
4744,4745,Henry VI Part 1,25.0,3.2.67,ALENCON,"Signior, no."
4745,4746,Henry VI Part 1,26.0,3.2.68,TALBOT,"Signior, hang! base muleters of France!"
4746,4747,Henry VI Part 1,26.0,3.2.69,TALBOT,Like peasant foot-boys do they keep the walls
4747,4748,Henry VI Part 1,26.0,3.2.70,TALBOT,And dare not take up arms like gentlemen.
4748,4749,Henry VI Part 1,27.0,3.2.71,JOAN LA PUCELLE,"Away, captains! let's get us from the walls,"
4749,4750,Henry VI Part 1,27.0,3.2.72,JOAN LA PUCELLE,For Talbot means no goodness by his looks.
4750,4751,Henry VI Part 1,27.0,3.2.73,JOAN LA PUCELLE,"God be wi' you, my lord! we came but to tell you"
4751,4752,Henry VI Part 1,27.0,3.2.74,JOAN LA PUCELLE,That we are here.
4752,4753,Henry VI Part 1,27.0,,JOAN LA PUCELLE,Exeunt from the walls
4753,4754,Henry VI Part 1,28.0,3.2.75,TALBOT,"And there will we be too, ere it be long,"
4754,4755,Henry VI Part 1,28.0,3.2.76,TALBOT,Or else reproach be Talbot's greatest fame!
4755,4756,Henry VI Part 1,28.0,3.2.77,TALBOT,"Vow, Burgundy, by honour of thy house,"
4756,4757,Henry VI Part 1,28.0,3.2.78,TALBOT,"Prick'd on by public wrongs sustain'd in France,"
4757,4758,Henry VI Part 1,28.0,3.2.79,TALBOT,Either to get the town again or die:
4758,4759,Henry VI Part 1,28.0,3.2.80,TALBOT,"And I, as sure as English Henry lives"
4759,4760,Henry VI Part 1,28.0,3.2.81,TALBOT,"And as his father here was conqueror,"
4760,4761,Henry VI Part 1,28.0,3.2.82,TALBOT,As sure as in this late-betrayed town
4761,4762,Henry VI Part 1,28.0,3.2.83,TALBOT,"Great Coeur-de-lion's heart was buried,"
4762,4763,Henry VI Part 1,28.0,3.2.84,TALBOT,So sure I swear to get the town or die.
4763,4764,Henry VI Part 1,29.0,3.2.85,BURGUNDY,My vows are equal partners with thy vows.
4764,4765,Henry VI Part 1,30.0,3.2.86,TALBOT,"But, ere we go, regard this dying prince,"
4765,4766,Henry VI Part 1,30.0,3.2.87,TALBOT,"The valiant Duke of Bedford. Come, my lord,"
4766,4767,Henry VI Part 1,30.0,3.2.88,TALBOT,"We will bestow you in some better place,"
4767,4768,Henry VI Part 1,30.0,3.2.89,TALBOT,Fitter for sickness and for crazy age.
4768,4769,Henry VI Part 1,31.0,3.2.90,BEDFORD,"Lord Talbot, do not so dishonour me:"
4769,4770,Henry VI Part 1,31.0,3.2.91,BEDFORD,Here will I sit before the walls of Rouen
4770,4771,Henry VI Part 1,31.0,3.2.92,BEDFORD,And will be partner of your weal or woe.
4771,4772,Henry VI Part 1,32.0,3.2.93,BURGUNDY,"Courageous Bedford, let us now persuade you."
4772,4773,Henry VI Part 1,33.0,3.2.94,BEDFORD,"Not to be gone from hence, for once I read"
4773,4774,Henry VI Part 1,33.0,3.2.95,BEDFORD,That stout Pendragon in his litter sick
4774,4775,Henry VI Part 1,33.0,3.2.96,BEDFORD,Came to the field and vanquished his foes:
4775,4776,Henry VI Part 1,33.0,3.2.97,BEDFORD,"Methinks I should revive the soldiers' hearts,"
4776,4777,Henry VI Part 1,33.0,3.2.98,BEDFORD,Because I ever found them as myself.
4777,4778,Henry VI Part 1,34.0,3.2.99,TALBOT,Undaunted spirit in a dying breast!
4778,4779,Henry VI Part 1,34.0,3.2.100,TALBOT,Then be it so: heavens keep old Bedford safe!
4779,4780,Henry VI Part 1,34.0,3.2.101,TALBOT,"And now no more ado, brave Burgundy,"
4780,4781,Henry VI Part 1,34.0,3.2.102,TALBOT,But gather we our forces out of hand
4781,4782,Henry VI Part 1,34.0,3.2.103,TALBOT,And set upon our boasting enemy.
4782,4783,Henry VI Part 1,34.0,,TALBOT,Exeunt all but BEDFORD and Attendants
4783,4784,Henry VI Part 1,34.0,,TALBOT,An alarum: excursions. Enter FASTOLFE and a Captain
4784,4785,Henry VI Part 1,35.0,3.2.104,Captain,"Whither away, Sir John Fastolfe, in such haste?"
4785,4786,Henry VI Part 1,36.0,3.2.105,FASTOLFE,Whither away! to save myself by flight:
4786,4787,Henry VI Part 1,36.0,3.2.106,FASTOLFE,We are like to have the overthrow again.
4787,4788,Henry VI Part 1,37.0,3.2.107,Captain,"What! will you fly, and leave Lord Talbot?"
4788,4789,Henry VI Part 1,38.0,3.2.108,FASTOLFE,"Ay,"
4789,4790,Henry VI Part 1,38.0,3.2.109,FASTOLFE,"All the Talbots in the world, to save my life!"
4790,4791,Henry VI Part 1,38.0,,FASTOLFE,Exit
4791,4792,Henry VI Part 1,39.0,3.2.110,Captain,Cowardly knight! ill fortune follow thee!
4792,4793,Henry VI Part 1,39.0,,Captain,Exit
4793,4794,Henry VI Part 1,39.0,,Captain,"Retreat: excursions. JOAN LA PUCELLE, ALENCON, and CHARLES fly"
4794,4795,Henry VI Part 1,40.0,3.2.111,BEDFORD,"Now, quiet soul, depart when heaven please,"
4795,4796,Henry VI Part 1,40.0,3.2.112,BEDFORD,For I have seen our enemies' overthrow.
4796,4797,Henry VI Part 1,40.0,3.2.113,BEDFORD,What is the trust or strength of foolish man?
4797,4798,Henry VI Part 1,40.0,3.2.114,BEDFORD,They that of late were daring with their scoffs
4798,4799,Henry VI Part 1,40.0,3.2.115,BEDFORD,Are glad and fain by flight to save themselves.
4799,4800,Henry VI Part 1,40.0,,BEDFORD,"BEDFORD dies, and is carried in by two in his chair"
4800,4801,Henry VI Part 1,40.0,,BEDFORD,"An alarum. Re-enter TALBOT, BURGUNDY, and the rest"
4801,4802,Henry VI Part 1,41.0,3.2.116,TALBOT,"Lost, and recover'd in a day again!"
4802,4803,Henry VI Part 1,41.0,3.2.117,TALBOT,"This is a double honour, Burgundy:"
4803,4804,Henry VI Part 1,41.0,3.2.118,TALBOT,Yet heavens have glory for this victory!
4804,4805,Henry VI Part 1,42.0,3.2.119,BURGUNDY,"Warlike and martial Talbot, Burgundy"
4805,4806,Henry VI Part 1,42.0,3.2.120,BURGUNDY,Enshrines thee in his heart and there erects
4806,4807,Henry VI Part 1,42.0,3.2.121,BURGUNDY,Thy noble deeds as valour's monuments.
4807,4808,Henry VI Part 1,43.0,3.2.122,TALBOT,"Thanks, gentle duke. But where is Pucelle now?"
4808,4809,Henry VI Part 1,43.0,3.2.123,TALBOT,I think her old familiar is asleep:
4809,4810,Henry VI Part 1,43.0,3.2.124,TALBOT,"Now where's the Bastard's braves, and Charles his gleeks?"
4810,4811,Henry VI Part 1,43.0,3.2.125,TALBOT,"What, all amort? Rouen hangs her head for grief"
4811,4812,Henry VI Part 1,43.0,3.2.126,TALBOT,That such a valiant company are fled.
4812,4813,Henry VI Part 1,43.0,3.2.127,TALBOT,"Now will we take some order in the town,"
4813,4814,Henry VI Part 1,43.0,3.2.128,TALBOT,"Placing therein some expert officers,"
4814,4815,Henry VI Part 1,43.0,3.2.129,TALBOT,"And then depart to Paris to the king,"
4815,4816,Henry VI Part 1,43.0,3.2.130,TALBOT,For there young Henry with his nobles lie.
4816,4817,Henry VI Part 1,44.0,3.2.131,BURGUNDY,What wills Lord Talbot pleaseth Burgundy.
4817,4818,Henry VI Part 1,45.0,3.2.132,TALBOT,"But yet, before we go, let's not forget"
4818,4819,Henry VI Part 1,45.0,3.2.133,TALBOT,"The noble Duke of Bedford late deceased,"
4819,4820,Henry VI Part 1,45.0,3.2.134,TALBOT,But see his exequies fulfill'd in Rouen:
4820,4821,Henry VI Part 1,45.0,3.2.135,TALBOT,"A braver soldier never couched lance,"
4821,4822,Henry VI Part 1,45.0,3.2.136,TALBOT,"A gentler heart did never sway in court,"
4822,4823,Henry VI Part 1,45.0,3.2.137,TALBOT,"But kings and mightiest potentates must die,"
4823,4824,Henry VI Part 1,45.0,3.2.138,TALBOT,For that's the end of human misery.
4824,4825,Henry VI Part 1,45.0,,TALBOT,Exeunt
4825,4826,Henry VI Part 1,45.0,,TALBOT,SCENE III. The plains near Rouen.
4826,4827,Henry VI Part 1,45.0,,TALBOT,"Enter CHARLES, the BASTARD OF ORLEANS, ALENCON, JOAN LA PUCELLE, and forces"
4827,4828,Henry VI Part 1,1.0,3.3.1,JOAN LA PUCELLE,"Dismay not, princes, at this accident,"
4828,4829,Henry VI Part 1,1.0,3.3.2,JOAN LA PUCELLE,Nor grieve that Rouen is so recovered:
4829,4830,Henry VI Part 1,1.0,3.3.3,JOAN LA PUCELLE,"Care is no cure, but rather corrosive,"
4830,4831,Henry VI Part 1,1.0,3.3.4,JOAN LA PUCELLE,For things that are not to be remedied.
4831,4832,Henry VI Part 1,1.0,3.3.5,JOAN LA PUCELLE,Let frantic Talbot triumph for a while
4832,4833,Henry VI Part 1,1.0,3.3.6,JOAN LA PUCELLE,"And like a peacock sweep along his tail,"
4833,4834,Henry VI Part 1,1.0,3.3.7,JOAN LA PUCELLE,"We'll pull his plumes and take away his train,"
4834,4835,Henry VI Part 1,1.0,3.3.8,JOAN LA PUCELLE,If Dauphin and the rest will be but ruled.
4835,4836,Henry VI Part 1,2.0,3.3.9,CHARLES,"We have been guided by thee hitherto,"
4836,4837,Henry VI Part 1,2.0,3.3.10,CHARLES,And of thy cunning had no diffidence:
4837,4838,Henry VI Part 1,2.0,3.3.11,CHARLES,One sudden foil shall never breed distrust.
4838,4839,Henry VI Part 1,3.0,3.3.12,BASTARD OF ORLEANS,"Search out thy wit for secret policies,"
4839,4840,Henry VI Part 1,3.0,3.3.13,BASTARD OF ORLEANS,And we will make thee famous through the world.
4840,4841,Henry VI Part 1,4.0,3.3.14,ALENCON,"We'll set thy statue in some holy place,"
4841,4842,Henry VI Part 1,4.0,3.3.15,ALENCON,And have thee reverenced like a blessed saint:
4842,4843,Henry VI Part 1,4.0,3.3.16,ALENCON,"Employ thee then, sweet virgin, for our good."
4843,4844,Henry VI Part 1,5.0,3.3.17,JOAN LA PUCELLE,"Then thus it must be, this doth Joan devise:"
4844,4845,Henry VI Part 1,5.0,3.3.18,JOAN LA PUCELLE,By fair persuasions mix'd with sugar'd words
4845,4846,Henry VI Part 1,5.0,3.3.19,JOAN LA PUCELLE,We will entice the Duke of Burgundy
4846,4847,Henry VI Part 1,5.0,3.3.20,JOAN LA PUCELLE,To leave the Talbot and to follow us.
4847,4848,Henry VI Part 1,6.0,3.3.21,CHARLES,"Ay, marry, sweeting, if we could do that,"
4848,4849,Henry VI Part 1,6.0,3.3.22,CHARLES,"France were no place for Henry's warriors,"
4849,4850,Henry VI Part 1,6.0,3.3.23,CHARLES,"Nor should that nation boast it so with us,"
4850,4851,Henry VI Part 1,6.0,3.3.24,CHARLES,But be extirped from our provinces.
4851,4852,Henry VI Part 1,7.0,3.3.25,ALENCON,For ever should they be expulsed from France
4852,4853,Henry VI Part 1,7.0,3.3.26,ALENCON,And not have title of an earldom here.
4853,4854,Henry VI Part 1,8.0,3.3.27,JOAN LA PUCELLE,Your honours shall perceive how I will work
4854,4855,Henry VI Part 1,8.0,3.3.28,JOAN LA PUCELLE,To bring this matter to the wished end.
4855,4856,Henry VI Part 1,8.0,,JOAN LA PUCELLE,Drum sounds afar off
4856,4857,Henry VI Part 1,8.0,3.3.29,JOAN LA PUCELLE,Hark! by the sound of drum you may perceive
4857,4858,Henry VI Part 1,8.0,3.3.30,JOAN LA PUCELLE,Their powers are marching unto Paris-ward.
4858,4859,Henry VI Part 1,8.0,,JOAN LA PUCELLE,"Here sound an English march. Enter, and pass over at a distance, TALBOT and his forces"
4859,4860,Henry VI Part 1,8.0,3.3.31,JOAN LA PUCELLE,"There goes the Talbot, with his colours spread,"
4860,4861,Henry VI Part 1,8.0,3.3.32,JOAN LA PUCELLE,And all the troops of English after him.
4861,4862,Henry VI Part 1,8.0,,JOAN LA PUCELLE,French march. Enter BURGUNDY and forces
4862,4863,Henry VI Part 1,8.0,3.3.33,JOAN LA PUCELLE,Now in the rearward comes the duke and his:
4863,4864,Henry VI Part 1,8.0,3.3.34,JOAN LA PUCELLE,Fortune in favour makes him lag behind.
4864,4865,Henry VI Part 1,8.0,3.3.35,JOAN LA PUCELLE,"Summon a parley, we will talk with him."
4865,4866,Henry VI Part 1,8.0,,JOAN LA PUCELLE,Trumpets sound a parley
4866,4867,Henry VI Part 1,9.0,3.3.36,CHARLES,A parley with the Duke of Burgundy!
4867,4868,Henry VI Part 1,10.0,3.3.37,BURGUNDY,Who craves a parley with the Burgundy?
4868,4869,Henry VI Part 1,11.0,3.3.38,JOAN LA PUCELLE,"The princely Charles of France, thy countryman."
4869,4870,Henry VI Part 1,12.0,3.3.39,BURGUNDY,"What say'st thou, Charles? for I am marching hence."
4870,4871,Henry VI Part 1,13.0,3.3.40,CHARLES,"Speak, Pucelle, and enchant him with thy words."
4871,4872,Henry VI Part 1,14.0,3.3.41,JOAN LA PUCELLE,"Brave Burgundy, undoubted hope of France!"
4872,4873,Henry VI Part 1,14.0,3.3.42,JOAN LA PUCELLE,"Stay, let thy humble handmaid speak to thee."
4873,4874,Henry VI Part 1,15.0,3.3.43,BURGUNDY,"Speak on, but be not over-tedious."
4874,4875,Henry VI Part 1,16.0,3.3.44,JOAN LA PUCELLE,"Look on thy country, look on fertile France,"
4875,4876,Henry VI Part 1,16.0,3.3.45,JOAN LA PUCELLE,And see the cities and the towns defaced
4876,4877,Henry VI Part 1,16.0,3.3.46,JOAN LA PUCELLE,By wasting ruin of the cruel foe.
4877,4878,Henry VI Part 1,16.0,3.3.47,JOAN LA PUCELLE,As looks the mother on her lowly babe
4878,4879,Henry VI Part 1,16.0,3.3.48,JOAN LA PUCELLE,"When death doth close his tender dying eyes,"
4879,4880,Henry VI Part 1,16.0,3.3.49,JOAN LA PUCELLE,"See, see the pining malady of France,"
4880,4881,Henry VI Part 1,16.0,3.3.50,JOAN LA PUCELLE,"Behold the wounds, the most unnatural wounds,"
4881,4882,Henry VI Part 1,16.0,3.3.51,JOAN LA PUCELLE,Which thou thyself hast given her woful breast.
4882,4883,Henry VI Part 1,16.0,3.3.52,JOAN LA PUCELLE,"O, turn thy edged sword another way,"
4883,4884,Henry VI Part 1,16.0,3.3.53,JOAN LA PUCELLE,"Strike those that hurt, and hurt not those that help."
4884,4885,Henry VI Part 1,16.0,3.3.54,JOAN LA PUCELLE,One drop of blood drawn from thy country's bosom
4885,4886,Henry VI Part 1,16.0,3.3.55,JOAN LA PUCELLE,Should grieve thee more than streams of foreign gore:
4886,4887,Henry VI Part 1,16.0,3.3.56,JOAN LA PUCELLE,"Return thee therefore with a flood of tears,"
4887,4888,Henry VI Part 1,16.0,3.3.57,JOAN LA PUCELLE,And wash away thy country's stained spots.
4888,4889,Henry VI Part 1,17.0,3.3.58,BURGUNDY,"Either she hath bewitch'd me with her words,"
4889,4890,Henry VI Part 1,17.0,3.3.59,BURGUNDY,Or nature makes me suddenly relent.
4890,4891,Henry VI Part 1,18.0,3.3.60,JOAN LA PUCELLE,"Besides, all French and France exclaims on thee,"
4891,4892,Henry VI Part 1,18.0,3.3.61,JOAN LA PUCELLE,Doubting thy birth and lawful progeny.
4892,4893,Henry VI Part 1,18.0,3.3.62,JOAN LA PUCELLE,Who joint'st thou with but with a lordly nation
4893,4894,Henry VI Part 1,18.0,3.3.63,JOAN LA PUCELLE,That will not trust thee but for profit's sake?
4894,4895,Henry VI Part 1,18.0,3.3.64,JOAN LA PUCELLE,When Talbot hath set footing once in France
4895,4896,Henry VI Part 1,18.0,3.3.65,JOAN LA PUCELLE,"And fashion'd thee that instrument of ill,"
4896,4897,Henry VI Part 1,18.0,3.3.66,JOAN LA PUCELLE,Who then but English Henry will be lord
4897,4898,Henry VI Part 1,18.0,3.3.67,JOAN LA PUCELLE,And thou be thrust out like a fugitive?
4898,4899,Henry VI Part 1,18.0,3.3.68,JOAN LA PUCELLE,"Call we to mind, and mark but this for proof,"
4899,4900,Henry VI Part 1,18.0,3.3.69,JOAN LA PUCELLE,Was not the Duke of Orleans thy foe?
4900,4901,Henry VI Part 1,18.0,3.3.70,JOAN LA PUCELLE,And was he not in England prisoner?
4901,4902,Henry VI Part 1,18.0,3.3.71,JOAN LA PUCELLE,"But when they heard he was thine enemy,"
4902,4903,Henry VI Part 1,18.0,3.3.72,JOAN LA PUCELLE,"They set him free without his ransom paid,"
4903,4904,Henry VI Part 1,18.0,3.3.73,JOAN LA PUCELLE,In spite of Burgundy and all his friends.
4904,4905,Henry VI Part 1,18.0,3.3.74,JOAN LA PUCELLE,"See, then, thou fight'st against thy countrymen"
4905,4906,Henry VI Part 1,18.0,3.3.75,JOAN LA PUCELLE,And joint'st with them will be thy slaughtermen.
4906,4907,Henry VI Part 1,18.0,3.3.76,JOAN LA PUCELLE,"Come, come, return, return, thou wandering lord:"
4907,4908,Henry VI Part 1,18.0,3.3.77,JOAN LA PUCELLE,Charles and the rest will take thee in their arms.
4908,4909,Henry VI Part 1,19.0,3.3.78,BURGUNDY,"I am vanquished, these haughty words of hers"
4909,4910,Henry VI Part 1,19.0,3.3.79,BURGUNDY,"Have batter'd me like roaring cannon-shot,"
4910,4911,Henry VI Part 1,19.0,3.3.80,BURGUNDY,And made me almost yield upon my knees.
4911,4912,Henry VI Part 1,19.0,3.3.81,BURGUNDY,"Forgive me, country, and sweet countrymen,"
4912,4913,Henry VI Part 1,19.0,3.3.82,BURGUNDY,"And, lords, accept this hearty kind embrace:"
4913,4914,Henry VI Part 1,19.0,3.3.83,BURGUNDY,My forces and my power of men are yours:
4914,4915,Henry VI Part 1,19.0,3.3.84,BURGUNDY,"So farewell, Talbot, I'll no longer trust thee."
4915,4916,Henry VI Part 1,20.0,3.3.85,JOAN LA PUCELLE,"[Aside]  Done like a Frenchman: turn, and turn again!"
4916,4917,Henry VI Part 1,21.0,3.3.86,CHARLES,"Welcome, brave duke! thy friendship makes us fresh."
4917,4918,Henry VI Part 1,22.0,3.3.87,BASTARD OF ORLEANS,And doth beget new courage in our breasts.
4918,4919,Henry VI Part 1,23.0,3.3.88,ALENCON,"Pucelle hath bravely play'd her part in this,"
4919,4920,Henry VI Part 1,23.0,3.3.89,ALENCON,And doth deserve a coronet of gold.
4920,4921,Henry VI Part 1,24.0,3.3.90,CHARLES,"Now let us on, my lords, and join our powers,"
4921,4922,Henry VI Part 1,24.0,3.3.91,CHARLES,And seek how we may prejudice the foe.
4922,4923,Henry VI Part 1,24.0,,CHARLES,Exeunt
4923,4924,Henry VI Part 1,24.0,,CHARLES,SCENE IV. Paris. The palace.
4924,4925,Henry VI Part 1,24.0,,CHARLES,"Enter KING HENRY VI, GLOUCESTER, BISHOP OF  WINCHESTER, YORK, SUFFOLK, SOMERSET, WARWICK,  EXETER, VERNON	BASSET, and others. To them with his Soldiers, TALBOT"
4925,4926,Henry VI Part 1,1.0,3.4.1,TALBOT,"My gracious prince, and honourable peers,"
4926,4927,Henry VI Part 1,1.0,3.4.2,TALBOT,"Hearing of your arrival in this realm,"
4927,4928,Henry VI Part 1,1.0,3.4.3,TALBOT,"I have awhile given truce unto my wars,"
4928,4929,Henry VI Part 1,1.0,3.4.4,TALBOT,To do my duty to my sovereign:
4929,4930,Henry VI Part 1,1.0,3.4.5,TALBOT,"In sign, whereof, this arm, that hath reclaim'd"
