,Dataline,Play,PlayerLinenumber,ActSceneLine,Player,PlayerLine
5510,5511,Henry VI Part 1,5.0,4.7.35,BASTARD OF ORLEANS,"How the young whelp of Talbot's, raging-wood,"
5511,5512,Henry VI Part 1,5.0,4.7.36,BASTARD OF ORLEANS,Did flesh his puny sword in Frenchmen's blood!
5512,5513,Henry VI Part 1,6.0,4.7.37,JOAN LA PUCELLE,"Once I encounter'd him, and thus I said:"
5513,5514,Henry VI Part 1,6.0,4.7.38,JOAN LA PUCELLE,"'Thou maiden youth, be vanquish'd by a maid:'"
5514,5515,Henry VI Part 1,6.0,4.7.39,JOAN LA PUCELLE,"But, with a proud majestical high scorn,"
5515,5516,Henry VI Part 1,6.0,4.7.40,JOAN LA PUCELLE,He answer'd thus: 'Young Talbot was not born
5516,5517,Henry VI Part 1,6.0,4.7.41,JOAN LA PUCELLE,To be the pillage of a giglot wench:'
5517,5518,Henry VI Part 1,6.0,4.7.42,JOAN LA PUCELLE,"So, rushing in the bowels of the French,"
5518,5519,Henry VI Part 1,6.0,4.7.43,JOAN LA PUCELLE,"He left me proudly, as unworthy fight."
5519,5520,Henry VI Part 1,7.0,4.7.44,BURGUNDY,"Doubtless he would have made a noble knight,"
5520,5521,Henry VI Part 1,7.0,4.7.45,BURGUNDY,"See, where he lies inhearsed in the arms"
5521,5522,Henry VI Part 1,7.0,4.7.46,BURGUNDY,Of the most bloody nurser of his harms!
5522,5523,Henry VI Part 1,8.0,4.7.47,BASTARD OF ORLEANS,"Hew them to pieces, hack their bones asunder"
5523,5524,Henry VI Part 1,8.0,4.7.48,BASTARD OF ORLEANS,"Whose life was England's glory, Gallia's wonder."
5524,5525,Henry VI Part 1,9.0,4.7.49,CHARLES,"O, no, forbear! for that which we have fled"
5525,5526,Henry VI Part 1,9.0,4.7.50,CHARLES,"During the life, let us not wrong it dead."
5526,5527,Henry VI Part 1,9.0,4.7.50,CHARLES,"Enter Sir William LUCY, attended, Herald of the French preceding"
5527,5528,Henry VI Part 1,10.0,4.7.51,LUCY,"Herald, conduct me to the Dauphin's tent,"
5528,5529,Henry VI Part 1,10.0,4.7.52,LUCY,To know who hath obtained the glory of the day.
5529,5530,Henry VI Part 1,11.0,4.7.53,CHARLES,On what submissive message art thou sent?
5530,5531,Henry VI Part 1,12.0,4.7.54,LUCY,"Submission, Dauphin! 'tis a mere French word,"
5531,5532,Henry VI Part 1,12.0,4.7.55,LUCY,We English warriors wot not what it means.
5532,5533,Henry VI Part 1,12.0,4.7.56,LUCY,I come to know what prisoners thou hast ta'en
5533,5534,Henry VI Part 1,12.0,4.7.57,LUCY,And to survey the bodies of the dead.
5534,5535,Henry VI Part 1,13.0,4.7.58,CHARLES,For prisoners ask'st thou? hell our prison is.
5535,5536,Henry VI Part 1,13.0,4.7.59,CHARLES,But tell me whom thou seek'st.
5536,5537,Henry VI Part 1,14.0,4.7.60,LUCY,"But where's the great Alcides of the field,"
5537,5538,Henry VI Part 1,14.0,4.7.61,LUCY,"Valiant Lord Talbot, Earl of Shrewsbury,"
5538,5539,Henry VI Part 1,14.0,4.7.62,LUCY,"Created, for his rare success in arms,"
5539,5540,Henry VI Part 1,14.0,4.7.63,LUCY,"Great Earl of Washford, Waterford and Valence,"
5540,5541,Henry VI Part 1,14.0,4.7.64,LUCY,"Lord Talbot of Goodrig and Urchinfield,"
5541,5542,Henry VI Part 1,14.0,4.7.65,LUCY,"Lord Strange of Blackmere, Lord Verdun of Alton,"
5542,5543,Henry VI Part 1,14.0,4.7.66,LUCY,"Lord Cromwell of Wingfield, Lord Furnival of Sheffield,"
5543,5544,Henry VI Part 1,14.0,4.7.67,LUCY,"The thrice-victorious Lord of Falconbridge,"
5544,5545,Henry VI Part 1,14.0,4.7.68,LUCY,"Knight of the noble order of Saint George,"
5545,5546,Henry VI Part 1,14.0,4.7.69,LUCY,"Worthy Saint Michael and the Golden Fleece,"
5546,5547,Henry VI Part 1,14.0,4.7.70,LUCY,Great marshal to Henry the Sixth
5547,5548,Henry VI Part 1,14.0,4.7.71,LUCY,Of all his wars within the realm of France?
5548,5549,Henry VI Part 1,15.0,4.7.72,JOAN LA PUCELLE,Here is a silly stately style indeed!
5549,5550,Henry VI Part 1,15.0,4.7.73,JOAN LA PUCELLE,"The Turk, that two and fifty kingdoms hath,"
5550,5551,Henry VI Part 1,15.0,4.7.74,JOAN LA PUCELLE,Writes not so tedious a style as this.
5551,5552,Henry VI Part 1,15.0,4.7.75,JOAN LA PUCELLE,Him that thou magnifiest with all these titles
5552,5553,Henry VI Part 1,15.0,4.7.76,JOAN LA PUCELLE,Stinking and fly-blown lies here at our feet.
5553,5554,Henry VI Part 1,16.0,4.7.77,LUCY,"Is Talbot slain, the Frenchmen's only scourge,"
5554,5555,Henry VI Part 1,16.0,4.7.78,LUCY,Your kingdom's terror and black Nemesis?
5555,5556,Henry VI Part 1,16.0,4.7.79,LUCY,"O, were mine eyeballs into bullets turn'd,"
5556,5557,Henry VI Part 1,16.0,4.7.80,LUCY,That I in rage might shoot them at your faces!
5557,5558,Henry VI Part 1,16.0,4.7.81,LUCY,"O, that I could but call these dead to life!"
5558,5559,Henry VI Part 1,16.0,4.7.82,LUCY,It were enough to fright the realm of France:
5559,5560,Henry VI Part 1,16.0,4.7.83,LUCY,"Were but his picture left amongst you here,"
5560,5561,Henry VI Part 1,16.0,4.7.84,LUCY,It would amaze the proudest of you all.
5561,5562,Henry VI Part 1,16.0,4.7.85,LUCY,"Give me their bodies, that I may bear them hence"
5562,5563,Henry VI Part 1,16.0,4.7.86,LUCY,And give them burial as beseems their worth.
5563,5564,Henry VI Part 1,17.0,4.7.87,JOAN LA PUCELLE,"I think this upstart is old Talbot's ghost,"
5564,5565,Henry VI Part 1,17.0,4.7.88,JOAN LA PUCELLE,He speaks with such a proud commanding spirit.
5565,5566,Henry VI Part 1,17.0,4.7.89,JOAN LA PUCELLE,"For God's sake let him have 'em, to keep them here,"
5566,5567,Henry VI Part 1,17.0,4.7.90,JOAN LA PUCELLE,"They would but stink, and putrefy the air."
5567,5568,Henry VI Part 1,18.0,4.7.91,CHARLES,"Go, take their bodies hence."
5568,5569,Henry VI Part 1,19.0,4.7.92,LUCY,"I'll bear them hence, but from their ashes shall be rear'd"
5569,5570,Henry VI Part 1,19.0,4.7.93,LUCY,A phoenix that shall make all France afeard.
5570,5571,Henry VI Part 1,20.0,4.7.94,CHARLES,"So we be rid of them, do with 'em what thou wilt."
5571,5572,Henry VI Part 1,20.0,4.7.95,CHARLES,"And now to Paris, in this conquering vein:"
5572,5573,Henry VI Part 1,20.0,4.7.96,CHARLES,"All will be ours, now bloody Talbot's slain."
5573,5574,Henry VI Part 1,20.0,,CHARLES,Exeunt
5574,5575,Henry VI Part 1,20.0,,CHARLES,ACT V
5575,5576,Henry VI Part 1,20.0,,CHARLES,SCENE I. London. The palace.
5576,5577,Henry VI Part 1,20.0,,CHARLES,"Sennet. Enter KING HENRY VI, GLOUCESTER, and EXETER"
5577,5578,Henry VI Part 1,1.0,5.1.1,KING HENRY VI,"Have you perused the letters from the pope,"
5578,5579,Henry VI Part 1,1.0,5.1.2,KING HENRY VI,The emperor and the Earl of Armagnac?
5579,5580,Henry VI Part 1,2.0,5.1.3,GLOUCESTER,"I have, my lord: and their intent is this:"
5580,5581,Henry VI Part 1,2.0,5.1.4,GLOUCESTER,They humbly sue unto your excellence
5581,5582,Henry VI Part 1,2.0,5.1.5,GLOUCESTER,To have a godly peace concluded of
5582,5583,Henry VI Part 1,2.0,5.1.6,GLOUCESTER,Between the realms of England and of France.
5583,5584,Henry VI Part 1,3.0,5.1.7,KING HENRY VI,How doth your grace affect their motion?
5584,5585,Henry VI Part 1,4.0,5.1.8,GLOUCESTER,"Well, my good lord, and as the only means"
5585,5586,Henry VI Part 1,4.0,5.1.9,GLOUCESTER,To stop effusion of our Christian blood
5586,5587,Henry VI Part 1,4.0,5.1.10,GLOUCESTER,And 'stablish quietness on every side.
5587,5588,Henry VI Part 1,5.0,5.1.11,KING HENRY VI,"Ay, marry, uncle, for I always thought"
5588,5589,Henry VI Part 1,5.0,5.1.12,KING HENRY VI,It was both impious and unnatural
5589,5590,Henry VI Part 1,5.0,5.1.13,KING HENRY VI,That such immanity and bloody strife
5590,5591,Henry VI Part 1,5.0,5.1.14,KING HENRY VI,Should reign among professors of one faith.
5591,5592,Henry VI Part 1,6.0,5.1.15,GLOUCESTER,"Beside, my lord, the sooner to effect"
5592,5593,Henry VI Part 1,6.0,5.1.16,GLOUCESTER,"And surer bind this knot of amity,"
5593,5594,Henry VI Part 1,6.0,5.1.17,GLOUCESTER,"The Earl of Armagnac, near knit to Charles,"
5594,5595,Henry VI Part 1,6.0,5.1.18,GLOUCESTER,"A man of great authority in France,"
5595,5596,Henry VI Part 1,6.0,5.1.19,GLOUCESTER,Proffers his only daughter to your grace
5596,5597,Henry VI Part 1,6.0,5.1.20,GLOUCESTER,"In marriage, with a large and sumptuous dowry."
5597,5598,Henry VI Part 1,7.0,5.1.21,KING HENRY VI,"Marriage, uncle! alas, my years are young!"
5598,5599,Henry VI Part 1,7.0,5.1.22,KING HENRY VI,And fitter is my study and my books
5599,5600,Henry VI Part 1,7.0,5.1.23,KING HENRY VI,Than wanton dalliance with a paramour.
5600,5601,Henry VI Part 1,7.0,5.1.24,KING HENRY VI,"Yet call the ambassador, and, as you please,"
5601,5602,Henry VI Part 1,7.0,5.1.25,KING HENRY VI,So let them have their answers every one:
5602,5603,Henry VI Part 1,7.0,5.1.26,KING HENRY VI,I shall be well content with any choice
5603,5604,Henry VI Part 1,7.0,5.1.27,KING HENRY VI,Tends to God's glory and my country's weal.
5604,5605,Henry VI Part 1,7.0,,KING HENRY VI,"Enter CARDINAL OF WINCHESTER in Cardinal's habit, a Legate and two Ambassadors"
5605,5606,Henry VI Part 1,8.0,5.1.28,EXETER,"What! is my Lord of Winchester install'd,"
5606,5607,Henry VI Part 1,8.0,5.1.29,EXETER,And call'd unto a cardinal's degree?
5607,5608,Henry VI Part 1,8.0,5.1.30,EXETER,Then I perceive that will be verified
5608,5609,Henry VI Part 1,8.0,5.1.31,EXETER,"Henry the Fifth did sometime prophesy,"
5609,5610,Henry VI Part 1,8.0,5.1.32,EXETER,"'If once he come to be a cardinal,"
5610,5611,Henry VI Part 1,8.0,5.1.33,EXETER,He'll make his cap co-equal with the crown.'
5611,5612,Henry VI Part 1,9.0,5.1.34,KING HENRY VI,"My lords ambassadors, your several suits"
5612,5613,Henry VI Part 1,9.0,5.1.35,KING HENRY VI,Have been consider'd and debated on.
5613,5614,Henry VI Part 1,9.0,5.1.36,KING HENRY VI,And therefore are we certainly resolved
5614,5615,Henry VI Part 1,9.0,5.1.37,KING HENRY VI,"To draw conditions of a friendly peace,"
5615,5616,Henry VI Part 1,9.0,5.1.38,KING HENRY VI,Which by my Lord of Winchester we mean
5616,5617,Henry VI Part 1,9.0,5.1.39,KING HENRY VI,Shall be transported presently to France.
5617,5618,Henry VI Part 1,10.0,5.1.40,GLOUCESTER,"And for the proffer of my lord your master,"
5618,5619,Henry VI Part 1,10.0,5.1.41,GLOUCESTER,I have inform'd his highness so at large
5619,5620,Henry VI Part 1,10.0,5.1.42,GLOUCESTER,"As liking of the lady's virtuous gifts,"
5620,5621,Henry VI Part 1,10.0,5.1.43,GLOUCESTER,"Her beauty and the value of her dower,"
5621,5622,Henry VI Part 1,10.0,5.1.44,GLOUCESTER,He doth intend she shall be England's queen.
5622,5623,Henry VI Part 1,11.0,5.1.45,KING HENRY VI,"In argument and proof of which contract,"
5623,5624,Henry VI Part 1,11.0,5.1.46,KING HENRY VI,"Bear her this jewel, pledge of my affection."
5624,5625,Henry VI Part 1,11.0,5.1.47,KING HENRY VI,"And so, my lord protector, see them guarded"
5625,5626,Henry VI Part 1,11.0,5.1.48,KING HENRY VI,"And safely brought to Dover, where inshipp'd"
5626,5627,Henry VI Part 1,11.0,5.1.49,KING HENRY VI,Commit them to the fortune of the sea.
5627,5628,Henry VI Part 1,11.0,,KING HENRY VI,Exeunt all but CARDINAL OF WINCHESTER and Legate
5628,5629,Henry VI Part 1,11.0,5.1.50,KING HENRY VI,CARDINAL
5629,5630,Henry VI Part 1,12.0,5.1.51,OF WINCHESTER,"Stay, my lord legate: you shall first receive"
5630,5631,Henry VI Part 1,12.0,5.1.52,OF WINCHESTER,The sum of money which I promised
5631,5632,Henry VI Part 1,12.0,5.1.53,OF WINCHESTER,Should be deliver'd to his holiness
5632,5633,Henry VI Part 1,12.0,5.1.54,OF WINCHESTER,For clothing me in these grave ornaments.
5633,5634,Henry VI Part 1,13.0,5.1.55,Legate,I will attend upon your lordship's leisure.
5634,5635,Henry VI Part 1,13.0,5.1.56,Legate,CARDINAL
5635,5636,Henry VI Part 1,14.0,5.1.57,OF WINCHESTER,"[Aside]  Now Winchester will not submit, I trow,"
5636,5637,Henry VI Part 1,14.0,5.1.58,OF WINCHESTER,Or be inferior to the proudest peer.
5637,5638,Henry VI Part 1,14.0,5.1.59,OF WINCHESTER,"Humphrey of Gloucester, thou shalt well perceive"
5638,5639,Henry VI Part 1,14.0,5.1.60,OF WINCHESTER,"That, neither in birth or for authority,"
5639,5640,Henry VI Part 1,14.0,5.1.61,OF WINCHESTER,The bishop will be overborne by thee:
5640,5641,Henry VI Part 1,14.0,5.1.62,OF WINCHESTER,"I'll either make thee stoop and bend thy knee,"
5641,5642,Henry VI Part 1,14.0,5.1.63,OF WINCHESTER,Or sack this country with a mutiny.
5642,5643,Henry VI Part 1,14.0,,OF WINCHESTER,Exeunt
5643,5644,Henry VI Part 1,14.0,,OF WINCHESTER,SCENE II. France. Plains in Anjou.
5644,5645,Henry VI Part 1,14.0,,OF WINCHESTER,"Enter CHARLES, BURGUNDY, ALENCON, BASTARD OF ORLEANS, REIGNIER, JOAN LA PUCELLE, and forces"
5645,5646,Henry VI Part 1,1.0,5.2.1,CHARLES,"These news, my lord, may cheer our drooping spirits:"
5646,5647,Henry VI Part 1,1.0,5.2.2,CHARLES,'Tis said the stout Parisians do revolt
5647,5648,Henry VI Part 1,1.0,5.2.3,CHARLES,And turn again unto the warlike French.
5648,5649,Henry VI Part 1,2.0,5.2.4,ALENCON,"Then march to Paris, royal Charles of France,"
5649,5650,Henry VI Part 1,2.0,5.2.5,ALENCON,And keep not back your powers in dalliance.
5650,5651,Henry VI Part 1,3.0,5.2.6,JOAN LA PUCELLE,"Peace be amongst them, if they turn to us,"
5651,5652,Henry VI Part 1,3.0,5.2.7,JOAN LA PUCELLE,"Else, ruin combat with their palaces!"
5652,5653,Henry VI Part 1,3.0,,JOAN LA PUCELLE,Enter Scout
5653,5654,Henry VI Part 1,4.0,5.2.8,Scout,"Success unto our valiant general,"
5654,5655,Henry VI Part 1,4.0,5.2.9,Scout,And happiness to his accomplices!
5655,5656,Henry VI Part 1,5.0,5.2.10,CHARLES,"What tidings send our scouts? I prithee, speak."
5656,5657,Henry VI Part 1,6.0,5.2.11,Scout,"The English army, that divided was"
5657,5658,Henry VI Part 1,6.0,5.2.12,Scout,"Into two parties, is now conjoined in one,"
5658,5659,Henry VI Part 1,6.0,5.2.13,Scout,And means to give you battle presently.
5659,5660,Henry VI Part 1,7.0,5.2.14,CHARLES,"Somewhat too sudden, sirs, the warning is,"
5660,5661,Henry VI Part 1,7.0,5.2.15,CHARLES,But we will presently provide for them.
5661,5662,Henry VI Part 1,8.0,5.2.16,BURGUNDY,I trust the ghost of Talbot is not there:
5662,5663,Henry VI Part 1,8.0,5.2.17,BURGUNDY,"Now he is gone, my lord, you need not fear."
5663,5664,Henry VI Part 1,9.0,5.2.18,JOAN LA PUCELLE,"Of all base passions, fear is most accursed."
5664,5665,Henry VI Part 1,9.0,5.2.19,JOAN LA PUCELLE,"Command the conquest, Charles, it shall be thine,"
5665,5666,Henry VI Part 1,9.0,5.2.20,JOAN LA PUCELLE,Let Henry fret and all the world repine.
5666,5667,Henry VI Part 1,10.0,5.2.21,CHARLES,"Then on, my lords, and France be fortunate!"
5667,5668,Henry VI Part 1,10.0,,CHARLES,Exeunt
5668,5669,Henry VI Part 1,10.0,,CHARLES,SCENE III. Before Angiers.
5669,5670,Henry VI Part 1,10.0,,CHARLES,Alarum. Excursions. Enter JOAN LA PUCELLE
5670,5671,Henry VI Part 1,1.0,5.3.1,JOAN LA PUCELLE,"The regent conquers, and the Frenchmen fly."
5671,5672,Henry VI Part 1,1.0,5.3.2,JOAN LA PUCELLE,"Now help, ye charming spells and periapts,"
5672,5673,Henry VI Part 1,1.0,5.3.3,JOAN LA PUCELLE,And ye choice spirits that admonish me
5673,5674,Henry VI Part 1,1.0,5.3.4,JOAN LA PUCELLE,And give me signs of future accidents.
5674,5675,Henry VI Part 1,1.0,,JOAN LA PUCELLE,Thunder
5675,5676,Henry VI Part 1,1.0,5.3.5,JOAN LA PUCELLE,"You speedy helpers, that are substitutes"
5676,5677,Henry VI Part 1,1.0,5.3.6,JOAN LA PUCELLE,"Under the lordly monarch of the north,"
5677,5678,Henry VI Part 1,1.0,5.3.7,JOAN LA PUCELLE,Appear and aid me in this enterprise.
5678,5679,Henry VI Part 1,1.0,,JOAN LA PUCELLE,Enter Fiends
5679,5680,Henry VI Part 1,1.0,5.3.8,JOAN LA PUCELLE,This speedy and quick appearance argues proof
5680,5681,Henry VI Part 1,1.0,5.3.9,JOAN LA PUCELLE,Of your accustom'd diligence to me.
5681,5682,Henry VI Part 1,1.0,5.3.10,JOAN LA PUCELLE,"Now, ye familiar spirits, that are cull'd"
5682,5683,Henry VI Part 1,1.0,5.3.11,JOAN LA PUCELLE,"Out of the powerful regions under earth,"
5683,5684,Henry VI Part 1,1.0,5.3.12,JOAN LA PUCELLE,"Help me this once, that France may get the field."
5684,5685,Henry VI Part 1,1.0,,JOAN LA PUCELLE,"They walk, and speak not"
5685,5686,Henry VI Part 1,1.0,5.3.13,JOAN LA PUCELLE,"O, hold me not with silence over-long!"
5686,5687,Henry VI Part 1,1.0,5.3.14,JOAN LA PUCELLE,"Where I was wont to feed you with my blood,"
5687,5688,Henry VI Part 1,1.0,5.3.15,JOAN LA PUCELLE,I'll lop a member off and give it you
5688,5689,Henry VI Part 1,1.0,5.3.16,JOAN LA PUCELLE,"In earnest of further benefit,"
5689,5690,Henry VI Part 1,1.0,5.3.17,JOAN LA PUCELLE,So you do condescend to help me now.
5690,5691,Henry VI Part 1,1.0,,JOAN LA PUCELLE,They hang their heads
5691,5692,Henry VI Part 1,1.0,5.3.18,JOAN LA PUCELLE,No hope to have redress? My body shall
5692,5693,Henry VI Part 1,1.0,5.3.19,JOAN LA PUCELLE,"Pay recompense, if you will grant my suit."
5693,5694,Henry VI Part 1,1.0,,JOAN LA PUCELLE,They shake their heads
5694,5695,Henry VI Part 1,1.0,5.3.20,JOAN LA PUCELLE,Cannot my body nor blood-sacrifice
5695,5696,Henry VI Part 1,1.0,5.3.21,JOAN LA PUCELLE,Entreat you to your wonted furtherance?
5696,5697,Henry VI Part 1,1.0,5.3.22,JOAN LA PUCELLE,"Then take my soul, my body, soul and all,"
5697,5698,Henry VI Part 1,1.0,5.3.23,JOAN LA PUCELLE,Before that England give the French the foil.
5698,5699,Henry VI Part 1,1.0,,JOAN LA PUCELLE,They depart
5699,5700,Henry VI Part 1,1.0,5.3.24,JOAN LA PUCELLE,"See, they forsake me! Now the time is come"
5700,5701,Henry VI Part 1,1.0,5.3.25,JOAN LA PUCELLE,That France must vail her lofty-plumed crest
5701,5702,Henry VI Part 1,1.0,5.3.26,JOAN LA PUCELLE,And let her head fall into England's lap.
5702,5703,Henry VI Part 1,1.0,5.3.27,JOAN LA PUCELLE,"My ancient incantations are too weak,"
5703,5704,Henry VI Part 1,1.0,5.3.28,JOAN LA PUCELLE,And hell too strong for me to buckle with:
5704,5705,Henry VI Part 1,1.0,5.3.29,JOAN LA PUCELLE,"Now, France, thy glory droopeth to the dust."
5705,5706,Henry VI Part 1,1.0,,JOAN LA PUCELLE,Exit
5706,5707,Henry VI Part 1,1.0,,JOAN LA PUCELLE,Excursions. Re-enter JOAN LA PUCELLE fighting hand  to hand with YORK. JOAN LA PUCELLE is taken. The French fly.
5707,5708,Henry VI Part 1,2.0,5.3.30,YORK,"Damsel of France, I think I have you fast:"
5708,5709,Henry VI Part 1,2.0,5.3.31,YORK,Unchain your spirits now with spelling charms
5709,5710,Henry VI Part 1,2.0,5.3.32,YORK,And try if they can gain your liberty.
5710,5711,Henry VI Part 1,2.0,5.3.33,YORK,"A goodly prize, fit for the devil's grace!"
5711,5712,Henry VI Part 1,2.0,5.3.34,YORK,"See, how the ugly wench doth bend her brows,"
5712,5713,Henry VI Part 1,2.0,5.3.35,YORK,As if with Circe she would change my shape!
5713,5714,Henry VI Part 1,3.0,5.3.36,JOAN LA PUCELLE,Changed to a worser shape thou canst not be.
5714,5715,Henry VI Part 1,4.0,5.3.37,YORK,"O, Charles the Dauphin is a proper man,"
5715,5716,Henry VI Part 1,4.0,5.3.38,YORK,No shape but his can please your dainty eye.
5716,5717,Henry VI Part 1,5.0,5.3.39,JOAN LA PUCELLE,A plaguing mischief light on Charles and thee!
5717,5718,Henry VI Part 1,5.0,5.3.40,JOAN LA PUCELLE,And may ye both be suddenly surprised
5718,5719,Henry VI Part 1,5.0,5.3.41,JOAN LA PUCELLE,"By bloody hands, in sleeping on your beds!"
5719,5720,Henry VI Part 1,6.0,5.3.42,YORK,"Fell banning hag, enchantress, hold thy tongue!"
5720,5721,Henry VI Part 1,7.0,5.3.43,JOAN LA PUCELLE,"I prithee, give me leave to curse awhile."
5721,5722,Henry VI Part 1,8.0,5.3.44,YORK,"Curse, miscreant, when thou comest to the stake."
5722,5723,Henry VI Part 1,8.0,,YORK,Exeunt
5723,5724,Henry VI Part 1,8.0,,YORK,Alarum. Enter SUFFOLK with MARGARET in his hand
5724,5725,Henry VI Part 1,9.0,5.3.45,SUFFOLK,"Be what thou wilt, thou art my prisoner."
5725,5726,Henry VI Part 1,9.0,,SUFFOLK,Gazes on her
5726,5727,Henry VI Part 1,9.0,5.3.46,SUFFOLK,"O fairest beauty, do not fear nor fly!"
5727,5728,Henry VI Part 1,9.0,5.3.47,SUFFOLK,"For I will touch thee but with reverent hands,"
5728,5729,Henry VI Part 1,9.0,5.3.48,SUFFOLK,"I kiss these fingers for eternal peace,"
5729,5730,Henry VI Part 1,9.0,5.3.49,SUFFOLK,And lay them gently on thy tender side.
5730,5731,Henry VI Part 1,9.0,5.3.50,SUFFOLK,"Who art thou? say, that I may honour thee."
5731,5732,Henry VI Part 1,10.0,5.3.51,MARGARET,"Margaret my name, and daughter to a king,"
5732,5733,Henry VI Part 1,10.0,5.3.52,MARGARET,"The King of Naples, whosoe'er thou art."
5733,5734,Henry VI Part 1,11.0,5.3.53,SUFFOLK,"An earl I am, and Suffolk am I call'd."
5734,5735,Henry VI Part 1,11.0,5.3.54,SUFFOLK,"Be not offended, nature's miracle,"
5735,5736,Henry VI Part 1,11.0,5.3.55,SUFFOLK,Thou art allotted to be ta'en by me:
5736,5737,Henry VI Part 1,11.0,5.3.56,SUFFOLK,"So doth the swan her downy cygnets save,"
5737,5738,Henry VI Part 1,11.0,5.3.57,SUFFOLK,Keeping them prisoner underneath her wings.
5738,5739,Henry VI Part 1,11.0,5.3.58,SUFFOLK,"Yet, if this servile usage once offend."
5739,5740,Henry VI Part 1,11.0,5.3.59,SUFFOLK,"Go, and be free again, as Suffolk's friend."
5740,5741,Henry VI Part 1,11.0,,SUFFOLK,She is going
5741,5742,Henry VI Part 1,11.0,5.3.60,SUFFOLK,"O, stay! I have no power to let her pass,"
5742,5743,Henry VI Part 1,11.0,5.3.61,SUFFOLK,"My hand would free her, but my heart says no"
5743,5744,Henry VI Part 1,11.0,5.3.62,SUFFOLK,"As plays the sun upon the glassy streams,"
5744,5745,Henry VI Part 1,11.0,5.3.63,SUFFOLK,"Twinkling another counterfeited beam,"
5745,5746,Henry VI Part 1,11.0,5.3.64,SUFFOLK,So seems this gorgeous beauty to mine eyes.
5746,5747,Henry VI Part 1,11.0,5.3.65,SUFFOLK,"Fain would I woo her, yet I dare not speak:"
5747,5748,Henry VI Part 1,11.0,5.3.66,SUFFOLK,"I'll call for pen and ink, and write my mind."
5748,5749,Henry VI Part 1,11.0,5.3.67,SUFFOLK,"Fie, de la Pole! disable not thyself,"
5749,5750,Henry VI Part 1,11.0,5.3.68,SUFFOLK,Hast not a tongue? is she not here?
5750,5751,Henry VI Part 1,11.0,5.3.69,SUFFOLK,Wilt thou be daunted at a woman's sight?
5751,5752,Henry VI Part 1,11.0,5.3.70,SUFFOLK,"Ay, beauty's princely majesty is such,"
5752,5753,Henry VI Part 1,11.0,5.3.71,SUFFOLK,Confounds the tongue and makes the senses rough.
5753,5754,Henry VI Part 1,12.0,5.3.72,MARGARET,"Say, Earl of Suffolk--if thy name be so--"
5754,5755,Henry VI Part 1,12.0,5.3.73,MARGARET,What ransom must I pay before I pass?
5755,5756,Henry VI Part 1,12.0,5.3.74,MARGARET,For I perceive I am thy prisoner.
5756,5757,Henry VI Part 1,13.0,5.3.75,SUFFOLK,"How canst thou tell she will deny thy suit,"
5757,5758,Henry VI Part 1,13.0,5.3.76,SUFFOLK,Before thou make a trial of her love?
5758,5759,Henry VI Part 1,14.0,5.3.77,MARGARET,Why speak'st thou not? what ransom must I pay?
5759,5760,Henry VI Part 1,15.0,5.3.78,SUFFOLK,"She's beautiful, and therefore to be woo'd,"
5760,5761,Henry VI Part 1,15.0,5.3.79,SUFFOLK,"She is a woman, therefore to be won."
5761,5762,Henry VI Part 1,16.0,5.3.80,MARGARET,"Wilt thou accept of ransom? yea, or no."
5762,5763,Henry VI Part 1,17.0,5.3.81,SUFFOLK,"Fond man, remember that thou hast a wife,"
5763,5764,Henry VI Part 1,17.0,5.3.82,SUFFOLK,Then how can Margaret be thy paramour?
5764,5765,Henry VI Part 1,18.0,5.3.83,MARGARET,"I were best to leave him, for he will not hear."
5765,5766,Henry VI Part 1,19.0,5.3.84,SUFFOLK,"There all is marr'd, there lies a cooling card."
5766,5767,Henry VI Part 1,20.0,5.3.85,MARGARET,"He talks at random, sure, the man is mad."
5767,5768,Henry VI Part 1,21.0,5.3.86,SUFFOLK,And yet a dispensation may be had.
5768,5769,Henry VI Part 1,22.0,5.3.87,MARGARET,And yet I would that you would answer me.
5769,5770,Henry VI Part 1,23.0,5.3.88,SUFFOLK,I'll win this Lady Margaret. For whom?
5770,5771,Henry VI Part 1,23.0,5.3.89,SUFFOLK,"Why, for my king: tush, that's a wooden thing!"
5771,5772,Henry VI Part 1,24.0,5.3.90,MARGARET,He talks of wood: it is some carpenter.
5772,5773,Henry VI Part 1,25.0,5.3.91,SUFFOLK,"Yet so my fancy may be satisfied,"
5773,5774,Henry VI Part 1,25.0,5.3.92,SUFFOLK,And peace established between these realms
5774,5775,Henry VI Part 1,25.0,5.3.93,SUFFOLK,"But there remains a scruple in that too,"
5775,5776,Henry VI Part 1,25.0,5.3.94,SUFFOLK,"For though her father be the King of Naples,"
5776,5777,Henry VI Part 1,25.0,5.3.95,SUFFOLK,"Duke of Anjou and Maine, yet is he poor,"
5777,5778,Henry VI Part 1,25.0,5.3.96,SUFFOLK,And our nobility will scorn the match.
5778,5779,Henry VI Part 1,26.0,5.3.97,MARGARET,"Hear ye, captain, are you not at leisure?"
5779,5780,Henry VI Part 1,27.0,5.3.98,SUFFOLK,"It shall be so, disdain they ne'er so much."
5780,5781,Henry VI Part 1,27.0,5.3.99,SUFFOLK,Henry is youthful and will quickly yield.
5781,5782,Henry VI Part 1,27.0,5.3.100,SUFFOLK,"Madam, I have a secret to reveal."
5782,5783,Henry VI Part 1,28.0,5.3.101,MARGARET,"What though I be enthrall'd? he seems a knight,"
5783,5784,Henry VI Part 1,28.0,5.3.102,MARGARET,And will not any way dishonour me.
5784,5785,Henry VI Part 1,29.0,5.3.103,SUFFOLK,"Lady, vouchsafe to listen what I say."
5785,5786,Henry VI Part 1,30.0,5.3.104,MARGARET,"Perhaps I shall be rescued by the French,"
5786,5787,Henry VI Part 1,30.0,5.3.105,MARGARET,And then I need not crave his courtesy.
5787,5788,Henry VI Part 1,31.0,5.3.106,SUFFOLK,"Sweet madam, give me a hearing in a cause--"
5788,5789,Henry VI Part 1,32.0,5.3.107,MARGARET,"Tush, women have been captivate ere now."
5789,5790,Henry VI Part 1,33.0,5.3.108,SUFFOLK,"Lady, wherefore talk you so?"
5790,5791,Henry VI Part 1,34.0,5.3.109,MARGARET,"I cry you mercy, 'tis but Quid for Quo."
5791,5792,Henry VI Part 1,35.0,5.3.110,SUFFOLK,"Say, gentle princess, would you not suppose"
5792,5793,Henry VI Part 1,35.0,5.3.111,SUFFOLK,"Your bondage happy, to be made a queen?"
5793,5794,Henry VI Part 1,36.0,5.3.112,MARGARET,To be a queen in bondage is more vile
5794,5795,Henry VI Part 1,36.0,5.3.113,MARGARET,"Than is a slave in base servility,"
5795,5796,Henry VI Part 1,36.0,5.3.114,MARGARET,For princes should be free.
5796,5797,Henry VI Part 1,37.0,5.3.115,SUFFOLK,"And so shall you,"
