,Dataline,Play,PlayerLinenumber,ActSceneLine,Player,PlayerLine
91400,91401,The Tempest,93.0,,LUCENTIO,ACT I
91401,91402,The Tempest,93.0,,LUCENTIO,SCENE I. On a ship at sea: a tempestuous noise
91402,91403,The Tempest,93.0,1.1.1,LUCENTIO,of thunder and lightning heard.
91403,91404,The Tempest,93.0,,LUCENTIO,Enter a Master and a Boatswain
91404,91405,The Tempest,1.0,1.1.2,Master,Boatswain!
91405,91406,The Tempest,2.0,1.1.3,Boatswain,"Here, master: what cheer?"
91406,91407,The Tempest,3.0,1.1.4,Master,"Good, speak to the mariners: fall to't, yarely,"
91407,91408,The Tempest,3.0,1.1.5,Master,"or we run ourselves aground: bestir, bestir."
91408,91409,The Tempest,3.0,,Master,Exit
91409,91410,The Tempest,3.0,,Master,Enter Mariners
91410,91411,The Tempest,4.0,1.1.6,Boatswain,"Heigh, my hearts! cheerly, cheerly, my hearts!"
91411,91412,The Tempest,4.0,1.1.7,Boatswain,"yare, yare! Take in the topsail. Tend to the"
91412,91413,The Tempest,4.0,1.1.8,Boatswain,"master's whistle. Blow, till thou burst thy wind,"
91413,91414,The Tempest,4.0,1.1.9,Boatswain,if room enough!
91414,91415,The Tempest,4.0,,Boatswain,"Enter ALONSO, SEBASTIAN, ANTONIO, FERDINAND, GONZALO, and others"
91415,91416,The Tempest,5.0,1.1.10,ALONSO,"Good boatswain, have care. Where's the master?"
91416,91417,The Tempest,5.0,1.1.11,ALONSO,Play the men.
91417,91418,The Tempest,6.0,1.1.12,Boatswain,"I pray now, keep below."
91418,91419,The Tempest,7.0,1.1.13,ANTONIO,"Where is the master, boatswain?"
91419,91420,The Tempest,8.0,1.1.14,Boatswain,Do you not hear him? You mar our labour: keep your
91420,91421,The Tempest,8.0,1.1.15,Boatswain,cabins: you do assist the storm.
91421,91422,The Tempest,9.0,1.1.16,GONZALO,"Nay, good, be patient."
91422,91423,The Tempest,10.0,1.1.17,Boatswain,When the sea is. Hence! What cares these roarers
91423,91424,The Tempest,10.0,1.1.18,Boatswain,for the name of king? To cabin: silence! trouble us not.
91424,91425,The Tempest,11.0,1.1.19,GONZALO,"Good, yet remember whom thou hast aboard."
91425,91426,The Tempest,12.0,1.1.20,Boatswain,None that I more love than myself. You are a
91426,91427,The Tempest,12.0,1.1.21,Boatswain,"counsellor, if you can command these elements to"
91427,91428,The Tempest,12.0,1.1.22,Boatswain,"silence, and work the peace of the present, we will"
91428,91429,The Tempest,12.0,1.1.23,Boatswain,"not hand a rope more, use your authority: if you"
91429,91430,The Tempest,12.0,1.1.24,Boatswain,"cannot, give thanks you have lived so long, and make"
91430,91431,The Tempest,12.0,1.1.25,Boatswain,yourself ready in your cabin for the mischance of
91431,91432,The Tempest,12.0,1.1.26,Boatswain,"the hour, if it so hap. Cheerly, good hearts! Out"
91432,91433,The Tempest,12.0,1.1.27,Boatswain,"of our way, I say."
91433,91434,The Tempest,12.0,,Boatswain,Exit
91434,91435,The Tempest,13.0,1.1.28,GONZALO,I have great comfort from this fellow: methinks he
91435,91436,The Tempest,13.0,1.1.29,GONZALO,"hath no drowning mark upon him, his complexion is"
91436,91437,The Tempest,13.0,1.1.30,GONZALO,"perfect gallows. Stand fast, good Fate, to his"
91437,91438,The Tempest,13.0,1.1.31,GONZALO,"hanging: make the rope of his destiny our cable,"
91438,91439,The Tempest,13.0,1.1.32,GONZALO,for our own doth little advantage. If he be not
91439,91440,The Tempest,13.0,1.1.33,GONZALO,"born to be hanged, our case is miserable."
91440,91441,The Tempest,13.0,,GONZALO,Exeunt
91441,91442,The Tempest,13.0,,GONZALO,Re-enter Boatswain
91442,91443,The Tempest,14.0,1.1.34,Boatswain,"Down with the topmast! yare! lower, lower! Bring"
91443,91444,The Tempest,14.0,1.1.35,Boatswain,her to try with main-course.
91444,91445,The Tempest,14.0,,Boatswain,A cry within
91445,91446,The Tempest,14.0,1.1.36,Boatswain,A plague upon this howling! they are louder than
91446,91447,The Tempest,14.0,1.1.37,Boatswain,the weather or our office.
91447,91448,The Tempest,14.0,,Boatswain,"Re-enter SEBASTIAN, ANTONIO, and GONZALO"
91448,91449,The Tempest,14.0,1.1.38,Boatswain,Yet again! what do you here? Shall we give o'er
91449,91450,The Tempest,14.0,1.1.39,Boatswain,and drown? Have you a mind to sink?
91450,91451,The Tempest,15.0,1.1.40,SEBASTIAN,"A pox o' your throat, you bawling, blasphemous,"
91451,91452,The Tempest,15.0,1.1.41,SEBASTIAN,incharitable dog!
91452,91453,The Tempest,16.0,1.1.42,Boatswain,Work you then.
91453,91454,The Tempest,17.0,1.1.43,ANTONIO,"Hang, cur! hang, you whoreson, insolent noisemaker!"
91454,91455,The Tempest,17.0,1.1.44,ANTONIO,We are less afraid to be drowned than thou art.
91455,91456,The Tempest,18.0,1.1.45,GONZALO,"I'll warrant him for drowning, though the ship were"
91456,91457,The Tempest,18.0,1.1.46,GONZALO,no stronger than a nutshell and as leaky as an
91457,91458,The Tempest,18.0,1.1.47,GONZALO,unstanched wench.
91458,91459,The Tempest,19.0,1.1.48,Boatswain,"Lay her a-hold, a-hold! set her two courses off to"
91459,91460,The Tempest,19.0,1.1.49,Boatswain,"sea again, lay her off."
91460,91461,The Tempest,19.0,,Boatswain,Enter Mariners wet
91461,91462,The Tempest,20.0,1.1.50,Mariners,"All lost! to prayers, to prayers! all lost!"
91462,91463,The Tempest,21.0,1.1.51,Boatswain,"What, must our mouths be cold?"
91463,91464,The Tempest,22.0,1.1.52,GONZALO,"The king and prince at prayers! let's assist them,"
91464,91465,The Tempest,22.0,1.1.53,GONZALO,For our case is as theirs.
91465,91466,The Tempest,23.0,1.1.54,SEBASTIAN,I'm out of patience.
91466,91467,The Tempest,24.0,1.1.55,ANTONIO,We are merely cheated of our lives by drunkards:
91467,91468,The Tempest,24.0,1.1.56,ANTONIO,This wide-chapp'd rascal--would thou mightst lie drowning
91468,91469,The Tempest,24.0,1.1.57,ANTONIO,The washing of ten tides!
91469,91470,The Tempest,25.0,1.1.58,GONZALO,"He'll be hang'd yet,"
91470,91471,The Tempest,25.0,1.1.59,GONZALO,Though every drop of water swear against it
91471,91472,The Tempest,25.0,1.1.60,GONZALO,And gape at widest to glut him.
91472,91473,The Tempest,25.0,1.1.60,GONZALO,"A confused noise within:   'Mercy on us!'--  'We split, we split!'--'Farewell, my wife and  children!'-- 'Farewell, brother!'--'We split, we split, we split!'"
91473,91474,The Tempest,26.0,1.1.61,ANTONIO,Let's all sink with the king.
91474,91475,The Tempest,27.0,1.1.62,SEBASTIAN,Let's take leave of him.
91475,91476,The Tempest,27.0,,SEBASTIAN,Exeunt ANTONIO and SEBASTIAN
91476,91477,The Tempest,28.0,1.1.63,GONZALO,Now would I give a thousand furlongs of sea for an
91477,91478,The Tempest,28.0,1.1.64,GONZALO,"acre of barren ground, long heath, brown furze, any"
91478,91479,The Tempest,28.0,1.1.65,GONZALO,thing. The wills above be done! but I would fain
91479,91480,The Tempest,28.0,1.1.66,GONZALO,die a dry death.
91480,91481,The Tempest,28.0,,GONZALO,Exeunt
91481,91482,The Tempest,28.0,,GONZALO,SCENE II. The island. Before PROSPERO'S cell.
91482,91483,The Tempest,28.0,,GONZALO,Enter PROSPERO and MIRANDA
91483,91484,The Tempest,1.0,1.2.1,MIRANDA,"If by your art, my dearest father, you have"
91484,91485,The Tempest,1.0,1.2.2,MIRANDA,"Put the wild waters in this roar, allay them."
91485,91486,The Tempest,1.0,1.2.3,MIRANDA,"The sky, it seems, would pour down stinking pitch,"
91486,91487,The Tempest,1.0,1.2.4,MIRANDA,"But that the sea, mounting to the welkin's cheek,"
91487,91488,The Tempest,1.0,1.2.5,MIRANDA,"Dashes the fire out. O, I have suffered"
91488,91489,The Tempest,1.0,1.2.6,MIRANDA,"With those that I saw suffer: a brave vessel,"
91489,91490,The Tempest,1.0,1.2.7,MIRANDA,"Who had, no doubt, some noble creature in her,"
91490,91491,The Tempest,1.0,1.2.8,MIRANDA,"Dash'd all to pieces. O, the cry did knock"
91491,91492,The Tempest,1.0,1.2.9,MIRANDA,"Against my very heart. Poor souls, they perish'd."
91492,91493,The Tempest,1.0,1.2.10,MIRANDA,"Had I been any god of power, I would"
91493,91494,The Tempest,1.0,1.2.11,MIRANDA,Have sunk the sea within the earth or ere
91494,91495,The Tempest,1.0,1.2.12,MIRANDA,It should the good ship so have swallow'd and
91495,91496,The Tempest,1.0,1.2.13,MIRANDA,The fraughting souls within her.
91496,91497,The Tempest,2.0,1.2.14,PROSPERO,Be collected:
91497,91498,The Tempest,2.0,1.2.15,PROSPERO,No more amazement: tell your piteous heart
91498,91499,The Tempest,2.0,1.2.16,PROSPERO,There's no harm done.
91499,91500,The Tempest,3.0,1.2.17,MIRANDA,"O, woe the day!"
91500,91501,The Tempest,4.0,1.2.18,PROSPERO,No harm.
91501,91502,The Tempest,4.0,1.2.19,PROSPERO,"I have done nothing but in care of thee,"
91502,91503,The Tempest,4.0,1.2.20,PROSPERO,"Of thee, my dear one, thee, my daughter, who"
91503,91504,The Tempest,4.0,1.2.21,PROSPERO,"Art ignorant of what thou art, nought knowing"
91504,91505,The Tempest,4.0,1.2.22,PROSPERO,"Of whence I am, nor that I am more better"
91505,91506,The Tempest,4.0,1.2.23,PROSPERO,"Than Prospero, master of a full poor cell,"
91506,91507,The Tempest,4.0,1.2.24,PROSPERO,And thy no greater father.
91507,91508,The Tempest,5.0,1.2.25,MIRANDA,More to know
91508,91509,The Tempest,5.0,1.2.26,MIRANDA,Did never meddle with my thoughts.
91509,91510,The Tempest,6.0,1.2.27,PROSPERO,'Tis time
91510,91511,The Tempest,6.0,1.2.28,PROSPERO,"I should inform thee farther. Lend thy hand,"
91511,91512,The Tempest,6.0,1.2.29,PROSPERO,And pluck my magic garment from me. So:
91512,91513,The Tempest,6.0,,PROSPERO,Lays down his mantle
91513,91514,The Tempest,6.0,1.2.30,PROSPERO,"Lie there, my art. Wipe thou thine eyes, have comfort."
91514,91515,The Tempest,6.0,1.2.31,PROSPERO,"The direful spectacle of the wreck, which touch'd"
91515,91516,The Tempest,6.0,1.2.32,PROSPERO,"The very virtue of compassion in thee,"
91516,91517,The Tempest,6.0,1.2.33,PROSPERO,I have with such provision in mine art
91517,91518,The Tempest,6.0,1.2.34,PROSPERO,So safely ordered that there is no soul--
91518,91519,The Tempest,6.0,1.2.35,PROSPERO,"No, not so much perdition as an hair"
91519,91520,The Tempest,6.0,1.2.36,PROSPERO,Betid to any creature in the vessel
91520,91521,The Tempest,6.0,1.2.37,PROSPERO,"Which thou heard'st cry, which thou saw'st sink. Sit down,"
91521,91522,The Tempest,6.0,1.2.38,PROSPERO,For thou must now know farther.
91522,91523,The Tempest,7.0,1.2.39,MIRANDA,You have often
91523,91524,The Tempest,7.0,1.2.40,MIRANDA,"Begun to tell me what I am, but stopp'd"
91524,91525,The Tempest,7.0,1.2.41,MIRANDA,"And left me to a bootless inquisition,"
91525,91526,The Tempest,7.0,1.2.42,MIRANDA,Concluding 'Stay: not yet.'
91526,91527,The Tempest,8.0,1.2.43,PROSPERO,"The hour's now come,"
91527,91528,The Tempest,8.0,1.2.44,PROSPERO,"The very minute bids thee ope thine ear,"
91528,91529,The Tempest,8.0,1.2.45,PROSPERO,Obey and be attentive. Canst thou remember
91529,91530,The Tempest,8.0,1.2.46,PROSPERO,A time before we came unto this cell?
91530,91531,The Tempest,8.0,1.2.47,PROSPERO,"I do not think thou canst, for then thou wast not"
91531,91532,The Tempest,8.0,1.2.48,PROSPERO,Out three years old.
91532,91533,The Tempest,9.0,1.2.49,MIRANDA,"Certainly, sir, I can."
91533,91534,The Tempest,10.0,1.2.50,PROSPERO,By what? by any other house or person?
91534,91535,The Tempest,10.0,1.2.51,PROSPERO,Of any thing the image tell me that
91535,91536,The Tempest,10.0,1.2.52,PROSPERO,Hath kept with thy remembrance.
91536,91537,The Tempest,11.0,1.2.53,MIRANDA,'Tis far off
91537,91538,The Tempest,11.0,1.2.54,MIRANDA,And rather like a dream than an assurance
91538,91539,The Tempest,11.0,1.2.55,MIRANDA,That my remembrance warrants. Had I not
91539,91540,The Tempest,11.0,1.2.56,MIRANDA,Four or five women once that tended me?
91540,91541,The Tempest,12.0,1.2.57,PROSPERO,"Thou hadst, and more, Miranda. But how is it"
91541,91542,The Tempest,12.0,1.2.58,PROSPERO,That this lives in thy mind? What seest thou else
91542,91543,The Tempest,12.0,1.2.59,PROSPERO,In the dark backward and abysm of time?
91543,91544,The Tempest,12.0,1.2.60,PROSPERO,"If thou remember'st aught ere thou camest here,"
91544,91545,The Tempest,12.0,1.2.61,PROSPERO,How thou camest here thou mayst.
91545,91546,The Tempest,13.0,1.2.62,MIRANDA,But that I do not.
91546,91547,The Tempest,14.0,1.2.63,PROSPERO,"Twelve year since, Miranda, twelve year since,"
91547,91548,The Tempest,14.0,1.2.64,PROSPERO,Thy father was the Duke of Milan and
91548,91549,The Tempest,14.0,1.2.65,PROSPERO,A prince of power.
91549,91550,The Tempest,15.0,1.2.66,MIRANDA,"Sir, are not you my father?"
91550,91551,The Tempest,16.0,1.2.67,PROSPERO,"Thy mother was a piece of virtue, and"
91551,91552,The Tempest,16.0,1.2.68,PROSPERO,"She said thou wast my daughter, and thy father"
91552,91553,The Tempest,16.0,1.2.69,PROSPERO,"Was Duke of Milan, and thou his only heir"
91553,91554,The Tempest,16.0,1.2.70,PROSPERO,And princess no worse issued.
91554,91555,The Tempest,17.0,1.2.71,MIRANDA,O the heavens!
91555,91556,The Tempest,17.0,1.2.72,MIRANDA,"What foul play had we, that we came from thence?"
91556,91557,The Tempest,17.0,1.2.73,MIRANDA,Or blessed was't we did?
91557,91558,The Tempest,18.0,1.2.74,PROSPERO,"Both, both, my girl:"
91558,91559,The Tempest,18.0,1.2.75,PROSPERO,"By foul play, as thou say'st, were we heaved thence,"
91559,91560,The Tempest,18.0,1.2.76,PROSPERO,But blessedly holp hither.
91560,91561,The Tempest,19.0,1.2.77,MIRANDA,"O, my heart bleeds"
91561,91562,The Tempest,19.0,1.2.78,MIRANDA,"To think o' the teen that I have turn'd you to,"
91562,91563,The Tempest,19.0,1.2.79,MIRANDA,"Which is from my remembrance! Please you, farther."
91563,91564,The Tempest,20.0,1.2.80,PROSPERO,"My brother and thy uncle, call'd Antonio--"
91564,91565,The Tempest,20.0,1.2.81,PROSPERO,"I pray thee, mark me--that a brother should"
91565,91566,The Tempest,20.0,1.2.82,PROSPERO,Be so perfidious!--he whom next thyself
91566,91567,The Tempest,20.0,1.2.83,PROSPERO,Of all the world I loved and to him put
91567,91568,The Tempest,20.0,1.2.84,PROSPERO,"The manage of my state, as at that time"
91568,91569,The Tempest,20.0,1.2.85,PROSPERO,Through all the signories it was the first
91569,91570,The Tempest,20.0,1.2.86,PROSPERO,"And Prospero the prime duke, being so reputed"
91570,91571,The Tempest,20.0,1.2.87,PROSPERO,"In dignity, and for the liberal arts"
91571,91572,The Tempest,20.0,1.2.88,PROSPERO,"Without a parallel, those being all my study,"
91572,91573,The Tempest,20.0,1.2.89,PROSPERO,The government I cast upon my brother
91573,91574,The Tempest,20.0,1.2.90,PROSPERO,"And to my state grew stranger, being transported"
91574,91575,The Tempest,20.0,1.2.91,PROSPERO,And rapt in secret studies. Thy false uncle--
91575,91576,The Tempest,20.0,1.2.92,PROSPERO,Dost thou attend me?
91576,91577,The Tempest,21.0,1.2.93,MIRANDA,"Sir, most heedfully."
91577,91578,The Tempest,22.0,1.2.94,PROSPERO,"Being once perfected how to grant suits,"
91578,91579,The Tempest,22.0,1.2.95,PROSPERO,"How to deny them, who to advance and who"
91579,91580,The Tempest,22.0,1.2.96,PROSPERO,"To trash for over-topping, new created"
91580,91581,The Tempest,22.0,1.2.97,PROSPERO,"The creatures that were mine, I say, or changed 'em,"
91581,91582,The Tempest,22.0,1.2.98,PROSPERO,"Or else new form'd 'em, having both the key"
91582,91583,The Tempest,22.0,1.2.99,PROSPERO,"Of officer and office, set all hearts i' the state"
91583,91584,The Tempest,22.0,1.2.100,PROSPERO,"To what tune pleased his ear, that now he was"
91584,91585,The Tempest,22.0,1.2.101,PROSPERO,"The ivy which had hid my princely trunk,"
91585,91586,The Tempest,22.0,1.2.102,PROSPERO,And suck'd my verdure out on't. Thou attend'st not.
91586,91587,The Tempest,23.0,1.2.103,MIRANDA,"O, good sir, I do."
91587,91588,The Tempest,24.0,1.2.104,PROSPERO,"I pray thee, mark me."
91588,91589,The Tempest,24.0,1.2.105,PROSPERO,"I, thus neglecting worldly ends, all dedicated"
91589,91590,The Tempest,24.0,1.2.106,PROSPERO,To closeness and the bettering of my mind
91590,91591,The Tempest,24.0,1.2.107,PROSPERO,"With that which, but by being so retired,"
91591,91592,The Tempest,24.0,1.2.108,PROSPERO,"O'er-prized all popular rate, in my false brother"
91592,91593,The Tempest,24.0,1.2.109,PROSPERO,"Awaked an evil nature, and my trust,"
91593,91594,The Tempest,24.0,1.2.110,PROSPERO,"Like a good parent, did beget of him"
91594,91595,The Tempest,24.0,1.2.111,PROSPERO,A falsehood in its contrary as great
91595,91596,The Tempest,24.0,1.2.112,PROSPERO,"As my trust was, which had indeed no limit,"
91596,91597,The Tempest,24.0,1.2.113,PROSPERO,"A confidence sans bound. He being thus lorded,"
91597,91598,The Tempest,24.0,1.2.114,PROSPERO,"Not only with what my revenue yielded,"
91598,91599,The Tempest,24.0,1.2.115,PROSPERO,"But what my power might else exact, like one"
91599,91600,The Tempest,24.0,1.2.116,PROSPERO,"Who having into truth, by telling of it,"
91600,91601,The Tempest,24.0,1.2.117,PROSPERO,"Made such a sinner of his memory,"
91601,91602,The Tempest,24.0,1.2.118,PROSPERO,"To credit his own lie, he did believe"
91602,91603,The Tempest,24.0,1.2.119,PROSPERO,"He was indeed the duke, out o' the substitution"
91603,91604,The Tempest,24.0,1.2.120,PROSPERO,"And executing the outward face of royalty,"
91604,91605,The Tempest,24.0,1.2.121,PROSPERO,With all prerogative: hence his ambition growing--
91605,91606,The Tempest,24.0,1.2.122,PROSPERO,Dost thou hear?
91606,91607,The Tempest,25.0,1.2.123,MIRANDA,"Your tale, sir, would cure deafness."
91607,91608,The Tempest,26.0,1.2.124,PROSPERO,To have no screen between this part he play'd
91608,91609,The Tempest,26.0,1.2.125,PROSPERO,"And him he play'd it for, he needs will be"
91609,91610,The Tempest,26.0,1.2.126,PROSPERO,"Absolute Milan. Me, poor man, my library"
91610,91611,The Tempest,26.0,1.2.127,PROSPERO,Was dukedom large enough: of temporal royalties
91611,91612,The Tempest,26.0,1.2.128,PROSPERO,"He thinks me now incapable, confederates--"
91612,91613,The Tempest,26.0,1.2.129,PROSPERO,So dry he was for sway--wi' the King of Naples
91613,91614,The Tempest,26.0,1.2.130,PROSPERO,"To give him annual tribute, do him homage,"
91614,91615,The Tempest,26.0,1.2.131,PROSPERO,Subject his coronet to his crown and bend
91615,91616,The Tempest,26.0,1.2.132,PROSPERO,"The dukedom yet unbow'd--alas, poor Milan!--"
91616,91617,The Tempest,26.0,1.2.133,PROSPERO,To most ignoble stooping.
91617,91618,The Tempest,27.0,1.2.134,MIRANDA,O the heavens!
91618,91619,The Tempest,28.0,1.2.135,PROSPERO,"Mark his condition and the event, then tell me"
91619,91620,The Tempest,28.0,1.2.136,PROSPERO,If this might be a brother.
91620,91621,The Tempest,29.0,1.2.137,MIRANDA,I should sin
91621,91622,The Tempest,29.0,1.2.138,MIRANDA,To think but nobly of my grandmother:
91622,91623,The Tempest,29.0,1.2.139,MIRANDA,Good wombs have borne bad sons.
91623,91624,The Tempest,30.0,1.2.140,PROSPERO,Now the condition.
91624,91625,The Tempest,30.0,1.2.141,PROSPERO,"The King of Naples, being an enemy"
91625,91626,The Tempest,30.0,1.2.142,PROSPERO,"To me inveterate, hearkens my brother's suit,"
91626,91627,The Tempest,30.0,1.2.143,PROSPERO,"Which was, that he, in lieu o' the premises"
91627,91628,The Tempest,30.0,1.2.144,PROSPERO,"Of homage and I know not how much tribute,"
91628,91629,The Tempest,30.0,1.2.145,PROSPERO,Should presently extirpate me and mine
91629,91630,The Tempest,30.0,1.2.146,PROSPERO,Out of the dukedom and confer fair Milan
91630,91631,The Tempest,30.0,1.2.147,PROSPERO,"With all the honours on my brother: whereon,"
91631,91632,The Tempest,30.0,1.2.148,PROSPERO,"A treacherous army levied, one midnight"
91632,91633,The Tempest,30.0,1.2.149,PROSPERO,Fated to the purpose did Antonio open
91633,91634,The Tempest,30.0,1.2.150,PROSPERO,"The gates of Milan, and, i' the dead of darkness,"
91634,91635,The Tempest,30.0,1.2.151,PROSPERO,The ministers for the purpose hurried thence
91635,91636,The Tempest,30.0,1.2.152,PROSPERO,Me and thy crying self.
91636,91637,The Tempest,31.0,1.2.153,MIRANDA,"Alack, for pity!"
91637,91638,The Tempest,31.0,1.2.154,MIRANDA,"I, not remembering how I cried out then,"
91638,91639,The Tempest,31.0,1.2.155,MIRANDA,Will cry it o'er again: it is a hint
91639,91640,The Tempest,31.0,1.2.156,MIRANDA,That wrings mine eyes to't.
91640,91641,The Tempest,32.0,1.2.157,PROSPERO,Hear a little further
91641,91642,The Tempest,32.0,1.2.158,PROSPERO,And then I'll bring thee to the present business
91642,91643,The Tempest,32.0,1.2.159,PROSPERO,"Which now's upon's, without the which this story"
91643,91644,The Tempest,32.0,1.2.160,PROSPERO,Were most impertinent.
91644,91645,The Tempest,33.0,1.2.161,MIRANDA,Wherefore did they not
91645,91646,The Tempest,33.0,1.2.162,MIRANDA,That hour destroy us?
91646,91647,The Tempest,34.0,1.2.163,PROSPERO,"Well demanded, wench:"
91647,91648,The Tempest,34.0,1.2.164,PROSPERO,"My tale provokes that question. Dear, they durst not,"
91648,91649,The Tempest,34.0,1.2.165,PROSPERO,"So dear the love my people bore me, nor set"
91649,91650,The Tempest,34.0,1.2.166,PROSPERO,"A mark so bloody on the business, but"
91650,91651,The Tempest,34.0,1.2.167,PROSPERO,With colours fairer painted their foul ends.
91651,91652,The Tempest,34.0,1.2.168,PROSPERO,"In few, they hurried us aboard a bark,"
91652,91653,The Tempest,34.0,1.2.169,PROSPERO,"Bore us some leagues to sea, where they prepared"
91653,91654,The Tempest,34.0,1.2.170,PROSPERO,"A rotten carcass of a boat, not rigg'd,"
91654,91655,The Tempest,34.0,1.2.171,PROSPERO,"Nor tackle, sail, nor mast, the very rats"
91655,91656,The Tempest,34.0,1.2.172,PROSPERO,"Instinctively had quit it: there they hoist us,"
91656,91657,The Tempest,34.0,1.2.173,PROSPERO,"To cry to the sea that roar'd to us, to sigh"
91657,91658,The Tempest,34.0,1.2.174,PROSPERO,"To the winds whose pity, sighing back again,"
91658,91659,The Tempest,34.0,1.2.175,PROSPERO,Did us but loving wrong.
91659,91660,The Tempest,35.0,1.2.176,MIRANDA,"Alack, what trouble"
91660,91661,The Tempest,35.0,1.2.177,MIRANDA,Was I then to you!
91661,91662,The Tempest,36.0,1.2.178,PROSPERO,"O, a cherubim"
91662,91663,The Tempest,36.0,1.2.179,PROSPERO,Thou wast that did preserve me. Thou didst smile.
91663,91664,The Tempest,36.0,1.2.180,PROSPERO,"Infused with a fortitude from heaven,"
91664,91665,The Tempest,36.0,1.2.181,PROSPERO,"When I have deck'd the sea with drops full salt,"
91665,91666,The Tempest,36.0,1.2.182,PROSPERO,"Under my burthen groan'd, which raised in me"
91666,91667,The Tempest,36.0,1.2.183,PROSPERO,"An undergoing stomach, to bear up"
91667,91668,The Tempest,36.0,1.2.184,PROSPERO,Against what should ensue.
91668,91669,The Tempest,37.0,1.2.185,MIRANDA,How came we ashore?
91669,91670,The Tempest,38.0,1.2.186,PROSPERO,By Providence divine.
91670,91671,The Tempest,38.0,1.2.187,PROSPERO,Some food we had and some fresh water that
91671,91672,The Tempest,38.0,1.2.188,PROSPERO,"A noble Neapolitan, Gonzalo,"
91672,91673,The Tempest,38.0,1.2.189,PROSPERO,"Out of his charity, being then appointed"
91673,91674,The Tempest,38.0,1.2.190,PROSPERO,"Master of this design, did give us, with"
91674,91675,The Tempest,38.0,1.2.191,PROSPERO,"Rich garments, linens, stuffs and necessaries,"
91675,91676,The Tempest,38.0,1.2.192,PROSPERO,"Which since have steaded much, so, of his gentleness,"
91676,91677,The Tempest,38.0,1.2.193,PROSPERO,"Knowing I loved my books, he furnish'd me"
91677,91678,The Tempest,38.0,1.2.194,PROSPERO,From mine own library with volumes that
91678,91679,The Tempest,38.0,1.2.195,PROSPERO,I prize above my dukedom.
91679,91680,The Tempest,39.0,1.2.196,MIRANDA,Would I might
91680,91681,The Tempest,39.0,1.2.197,MIRANDA,But ever see that man!
91681,91682,The Tempest,40.0,1.2.198,PROSPERO,Now I arise:
91682,91683,The Tempest,40.0,,PROSPERO,Resumes his mantle
91683,91684,The Tempest,40.0,1.2.199,PROSPERO,"Sit still, and hear the last of our sea-sorrow."
91684,91685,The Tempest,40.0,1.2.200,PROSPERO,"Here in this island we arrived, and here"
91685,91686,The Tempest,40.0,1.2.201,PROSPERO,"Have I, thy schoolmaster, made thee more profit"
91686,91687,The Tempest,40.0,1.2.202,PROSPERO,Than other princesses can that have more time
91687,91688,The Tempest,40.0,1.2.203,PROSPERO,For vainer hours and tutors not so careful.
91688,91689,The Tempest,41.0,1.2.204,MIRANDA,"Heavens thank you for't! And now, I pray you, sir,"
91689,91690,The Tempest,41.0,1.2.205,MIRANDA,"For still 'tis beating in my mind, your reason"
91690,91691,The Tempest,41.0,1.2.206,MIRANDA,For raising this sea-storm?
91691,91692,The Tempest,42.0,1.2.207,PROSPERO,Know thus far forth.
91692,91693,The Tempest,42.0,1.2.208,PROSPERO,"By accident most strange, bountiful Fortune,"
91693,91694,The Tempest,42.0,1.2.209,PROSPERO,"Now my dear lady, hath mine enemies"
91694,91695,The Tempest,42.0,1.2.210,PROSPERO,"Brought to this shore, and by my prescience"
91695,91696,The Tempest,42.0,1.2.211,PROSPERO,I find my zenith doth depend upon
91696,91697,The Tempest,42.0,1.2.212,PROSPERO,"A most auspicious star, whose influence"
91697,91698,The Tempest,42.0,1.2.213,PROSPERO,"If now I court not but omit, my fortunes"
91698,91699,The Tempest,42.0,1.2.214,PROSPERO,Will ever after droop. Here cease more questions:
91699,91700,The Tempest,42.0,1.2.215,PROSPERO,"Thou art inclined to sleep, 'tis a good dulness,"
91700,91701,The Tempest,42.0,1.2.216,PROSPERO,And give it way: I know thou canst not choose.
91701,91702,The Tempest,42.0,,PROSPERO,MIRANDA sleeps
91702,91703,The Tempest,42.0,1.2.217,PROSPERO,"Come away, servant, come. I am ready now."
91703,91704,The Tempest,42.0,1.2.218,PROSPERO,"Approach, my Ariel, come."
91704,91705,The Tempest,42.0,,PROSPERO,Enter ARIEL
91705,91706,The Tempest,43.0,1.2.219,ARIEL,"All hail, great master! grave sir, hail! I come"
91706,91707,The Tempest,43.0,1.2.220,ARIEL,"To answer thy best pleasure, be't to fly,"
91707,91708,The Tempest,43.0,1.2.221,ARIEL,"To swim, to dive into the fire, to ride"
