,Dataline,Play,PlayerLinenumber,ActSceneLine,Player,PlayerLine
92018,92019,The Tempest,114.0,1.2.520,MIRANDA,That e'er I sigh'd for: pity move my father
92019,92020,The Tempest,114.0,1.2.521,MIRANDA,To be inclined my way!
92020,92021,The Tempest,115.0,1.2.522,FERDINAND,"O, if a virgin,"
92021,92022,The Tempest,115.0,1.2.523,FERDINAND,"And your affection not gone forth, I'll make you"
92022,92023,The Tempest,115.0,1.2.524,FERDINAND,The queen of Naples.
92023,92024,The Tempest,116.0,1.2.525,PROSPERO,"Soft, sir! one word more."
92024,92025,The Tempest,116.0,,PROSPERO,Aside
92025,92026,The Tempest,116.0,1.2.526,PROSPERO,"They are both in either's powers, but this swift business"
92026,92027,The Tempest,116.0,1.2.527,PROSPERO,"I must uneasy make, lest too light winning"
92027,92028,The Tempest,116.0,1.2.528,PROSPERO,Make the prize light.
92028,92029,The Tempest,116.0,,PROSPERO,To FERDINAND
92029,92030,The Tempest,116.0,1.2.529,PROSPERO,"One word more, I charge thee"
92030,92031,The Tempest,116.0,1.2.530,PROSPERO,That thou attend me: thou dost here usurp
92031,92032,The Tempest,116.0,1.2.531,PROSPERO,"The name thou owest not, and hast put thyself"
92032,92033,The Tempest,116.0,1.2.532,PROSPERO,"Upon this island as a spy, to win it"
92033,92034,The Tempest,116.0,1.2.533,PROSPERO,"From me, the lord on't."
92034,92035,The Tempest,117.0,1.2.534,FERDINAND,"No, as I am a man."
92035,92036,The Tempest,118.0,1.2.535,MIRANDA,There's nothing ill can dwell in such a temple:
92036,92037,The Tempest,118.0,1.2.536,MIRANDA,"If the ill spirit have so fair a house,"
92037,92038,The Tempest,118.0,1.2.537,MIRANDA,Good things will strive to dwell with't.
92038,92039,The Tempest,119.0,1.2.538,PROSPERO,Follow me.
92039,92040,The Tempest,119.0,1.2.539,PROSPERO,"Speak not you for him, he's a traitor. Come,"
92040,92041,The Tempest,119.0,1.2.540,PROSPERO,I'll manacle thy neck and feet together:
92041,92042,The Tempest,119.0,1.2.541,PROSPERO,"Sea-water shalt thou drink, thy food shall be"
92042,92043,The Tempest,119.0,1.2.542,PROSPERO,"The fresh-brook muscles, wither'd roots and husks"
92043,92044,The Tempest,119.0,1.2.543,PROSPERO,Wherein the acorn cradled. Follow.
92044,92045,The Tempest,120.0,1.2.544,FERDINAND,"No,"
92045,92046,The Tempest,120.0,1.2.545,FERDINAND,I will resist such entertainment till
92046,92047,The Tempest,120.0,1.2.546,FERDINAND,Mine enemy has more power.
92047,92048,The Tempest,120.0,,FERDINAND,"Draws, and is charmed from moving"
92048,92049,The Tempest,121.0,1.2.547,MIRANDA,"O dear father,"
92049,92050,The Tempest,121.0,1.2.548,MIRANDA,"Make not too rash a trial of him, for"
92050,92051,The Tempest,121.0,1.2.549,MIRANDA,He's gentle and not fearful.
92051,92052,The Tempest,122.0,1.2.550,PROSPERO,"What? I say,"
92052,92053,The Tempest,122.0,1.2.551,PROSPERO,"My foot my tutor? Put thy sword up, traitor,"
92053,92054,The Tempest,122.0,1.2.552,PROSPERO,"Who makest a show but darest not strike, thy conscience"
92054,92055,The Tempest,122.0,1.2.553,PROSPERO,"Is so possess'd with guilt: come from thy ward,"
92055,92056,The Tempest,122.0,1.2.554,PROSPERO,For I can here disarm thee with this stick
92056,92057,The Tempest,122.0,1.2.555,PROSPERO,And make thy weapon drop.
92057,92058,The Tempest,123.0,1.2.556,MIRANDA,"Beseech you, father."
92058,92059,The Tempest,124.0,1.2.557,PROSPERO,Hence! hang not on my garments.
92059,92060,The Tempest,125.0,1.2.558,MIRANDA,"Sir, have pity,"
92060,92061,The Tempest,125.0,1.2.559,MIRANDA,I'll be his surety.
92061,92062,The Tempest,126.0,1.2.560,PROSPERO,Silence! one word more
92062,92063,The Tempest,126.0,1.2.561,PROSPERO,"Shall make me chide thee, if not hate thee. What!"
92063,92064,The Tempest,126.0,1.2.562,PROSPERO,An advocate for an imposter! hush!
92064,92065,The Tempest,126.0,1.2.563,PROSPERO,"Thou think'st there is no more such shapes as he,"
92065,92066,The Tempest,126.0,1.2.564,PROSPERO,Having seen but him and Caliban: foolish wench!
92066,92067,The Tempest,126.0,1.2.565,PROSPERO,To the most of men this is a Caliban
92067,92068,The Tempest,126.0,1.2.566,PROSPERO,And they to him are angels.
92068,92069,The Tempest,127.0,1.2.567,MIRANDA,My affections
92069,92070,The Tempest,127.0,1.2.568,MIRANDA,"Are then most humble, I have no ambition"
92070,92071,The Tempest,127.0,1.2.569,MIRANDA,To see a goodlier man.
92071,92072,The Tempest,128.0,1.2.570,PROSPERO,"Come on, obey:"
92072,92073,The Tempest,128.0,1.2.571,PROSPERO,Thy nerves are in their infancy again
92073,92074,The Tempest,128.0,1.2.572,PROSPERO,And have no vigour in them.
92074,92075,The Tempest,129.0,1.2.573,FERDINAND,"So they are,"
92075,92076,The Tempest,129.0,1.2.574,FERDINAND,"My spirits, as in a dream, are all bound up."
92076,92077,The Tempest,129.0,1.2.575,FERDINAND,"My father's loss, the weakness which I feel,"
92077,92078,The Tempest,129.0,1.2.576,FERDINAND,"The wreck of all my friends, nor this man's threats,"
92078,92079,The Tempest,129.0,1.2.577,FERDINAND,"To whom I am subdued, are but light to me,"
92079,92080,The Tempest,129.0,1.2.578,FERDINAND,Might I but through my prison once a day
92080,92081,The Tempest,129.0,1.2.579,FERDINAND,Behold this maid: all corners else o' the earth
92081,92082,The Tempest,129.0,1.2.580,FERDINAND,"Let liberty make use of, space enough"
92082,92083,The Tempest,129.0,1.2.581,FERDINAND,Have I in such a prison.
92083,92084,The Tempest,130.0,1.2.582,PROSPERO,[Aside]                It works.
92084,92085,The Tempest,130.0,,PROSPERO,To FERDINAND
92085,92086,The Tempest,130.0,1.2.583,PROSPERO,Come on.
92086,92087,The Tempest,130.0,1.2.584,PROSPERO,"Thou hast done well, fine Ariel!"
92087,92088,The Tempest,130.0,,PROSPERO,To FERDINAND
92088,92089,The Tempest,130.0,1.2.585,PROSPERO,Follow me.
92089,92090,The Tempest,130.0,,PROSPERO,To ARIEL
92090,92091,The Tempest,130.0,1.2.586,PROSPERO,Hark what thou else shalt do me.
92091,92092,The Tempest,131.0,1.2.587,MIRANDA,"Be of comfort,"
92092,92093,The Tempest,131.0,1.2.588,MIRANDA,"My father's of a better nature, sir,"
92093,92094,The Tempest,131.0,1.2.589,MIRANDA,Than he appears by speech: this is unwonted
92094,92095,The Tempest,131.0,1.2.590,MIRANDA,Which now came from him.
92095,92096,The Tempest,132.0,1.2.591,PROSPERO,Thou shalt be free
92096,92097,The Tempest,132.0,1.2.592,PROSPERO,As mountain winds: but then exactly do
92097,92098,The Tempest,132.0,1.2.593,PROSPERO,All points of my command.
92098,92099,The Tempest,133.0,1.2.594,ARIEL,To the syllable.
92099,92100,The Tempest,134.0,1.2.595,PROSPERO,"Come, follow. Speak not for him."
92100,92101,The Tempest,134.0,,PROSPERO,Exeunt
92101,92102,The Tempest,134.0,,PROSPERO,ACT II
92102,92103,The Tempest,134.0,,PROSPERO,SCENE I. Another part of the island.
92103,92104,The Tempest,134.0,,PROSPERO,"Enter ALONSO, SEBASTIAN, ANTONIO, GONZALO, ADRIAN, FRANCISCO, and others"
92104,92105,The Tempest,1.0,2.1.1,GONZALO,"Beseech you, sir, be merry, you have cause,"
92105,92106,The Tempest,1.0,2.1.2,GONZALO,"So have we all, of joy, for our escape"
92106,92107,The Tempest,1.0,2.1.3,GONZALO,Is much beyond our loss. Our hint of woe
92107,92108,The Tempest,1.0,2.1.4,GONZALO,"Is common, every day some sailor's wife,"
92108,92109,The Tempest,1.0,2.1.5,GONZALO,The masters of some merchant and the merchant
92109,92110,The Tempest,1.0,2.1.6,GONZALO,"Have just our theme of woe, but for the miracle,"
92110,92111,The Tempest,1.0,2.1.7,GONZALO,"I mean our preservation, few in millions"
92111,92112,The Tempest,1.0,2.1.8,GONZALO,"Can speak like us: then wisely, good sir, weigh"
92112,92113,The Tempest,1.0,2.1.9,GONZALO,Our sorrow with our comfort.
92113,92114,The Tempest,2.0,2.1.10,ALONSO,"Prithee, peace."
92114,92115,The Tempest,3.0,2.1.11,SEBASTIAN,He receives comfort like cold porridge.
92115,92116,The Tempest,4.0,2.1.12,ANTONIO,The visitor will not give him o'er so.
92116,92117,The Tempest,5.0,2.1.13,SEBASTIAN,"Look he's winding up the watch of his wit,"
92117,92118,The Tempest,5.0,2.1.14,SEBASTIAN,by and by it will strike.
92118,92119,The Tempest,6.0,2.1.15,GONZALO,"Sir,--"
92119,92120,The Tempest,7.0,2.1.16,SEBASTIAN,One: tell.
92120,92121,The Tempest,8.0,2.1.17,GONZALO,"When every grief is entertain'd that's offer'd,"
92121,92122,The Tempest,8.0,2.1.18,GONZALO,Comes to the entertainer--
92122,92123,The Tempest,9.0,2.1.19,SEBASTIAN,A dollar.
92123,92124,The Tempest,10.0,2.1.20,GONZALO,"Dolour comes to him, indeed: you"
92124,92125,The Tempest,10.0,2.1.21,GONZALO,have spoken truer than you purposed.
92125,92126,The Tempest,11.0,2.1.22,SEBASTIAN,You have taken it wiselier than I meant you should.
92126,92127,The Tempest,12.0,2.1.23,GONZALO,"Therefore, my lord,--"
92127,92128,The Tempest,13.0,2.1.24,ANTONIO,"Fie, what a spendthrift is he of his tongue!"
92128,92129,The Tempest,14.0,2.1.25,ALONSO,"I prithee, spare."
92129,92130,The Tempest,15.0,2.1.26,GONZALO,"Well, I have done: but yet,--"
92130,92131,The Tempest,16.0,2.1.27,SEBASTIAN,He will be talking.
92131,92132,The Tempest,17.0,2.1.28,ANTONIO,"Which, of he or Adrian, for a good"
92132,92133,The Tempest,17.0,2.1.29,ANTONIO,"wager, first begins to crow?"
92133,92134,The Tempest,18.0,2.1.30,SEBASTIAN,The old cock.
92134,92135,The Tempest,19.0,2.1.31,ANTONIO,The cockerel.
92135,92136,The Tempest,20.0,2.1.32,SEBASTIAN,Done. The wager?
92136,92137,The Tempest,21.0,2.1.33,ANTONIO,A laughter.
92137,92138,The Tempest,22.0,2.1.34,SEBASTIAN,A match!
92138,92139,The Tempest,23.0,2.1.35,ADRIAN,"Though this island seem to be desert,--"
92139,92140,The Tempest,24.0,2.1.36,SEBASTIAN,"Ha, ha, ha! So, you're paid."
92140,92141,The Tempest,25.0,2.1.37,ADRIAN,"Uninhabitable and almost inaccessible,--"
92141,92142,The Tempest,26.0,2.1.38,SEBASTIAN,"Yet,--"
92142,92143,The Tempest,27.0,2.1.39,ADRIAN,"Yet,--"
92143,92144,The Tempest,28.0,2.1.40,ANTONIO,He could not miss't.
92144,92145,The Tempest,29.0,2.1.41,ADRIAN,"It must needs be of subtle, tender and delicate"
92145,92146,The Tempest,29.0,2.1.42,ADRIAN,temperance.
92146,92147,The Tempest,30.0,2.1.43,ANTONIO,Temperance was a delicate wench.
92147,92148,The Tempest,31.0,2.1.44,SEBASTIAN,"Ay, and a subtle, as he most learnedly delivered."
92148,92149,The Tempest,32.0,2.1.45,ADRIAN,The air breathes upon us here most sweetly.
92149,92150,The Tempest,33.0,2.1.46,SEBASTIAN,As if it had lungs and rotten ones.
92150,92151,The Tempest,34.0,2.1.47,ANTONIO,Or as 'twere perfumed by a fen.
92151,92152,The Tempest,35.0,2.1.48,GONZALO,Here is everything advantageous to life.
92152,92153,The Tempest,36.0,2.1.49,ANTONIO,"True, save means to live."
92153,92154,The Tempest,37.0,2.1.50,SEBASTIAN,"Of that there's none, or little."
92154,92155,The Tempest,38.0,2.1.51,GONZALO,How lush and lusty the grass looks! how green!
92155,92156,The Tempest,39.0,2.1.52,ANTONIO,The ground indeed is tawny.
92156,92157,The Tempest,40.0,2.1.53,SEBASTIAN,With an eye of green in't.
92157,92158,The Tempest,41.0,2.1.54,ANTONIO,He misses not much.
92158,92159,The Tempest,42.0,2.1.55,SEBASTIAN,"No, he doth but mistake the truth totally."
92159,92160,The Tempest,43.0,2.1.56,GONZALO,"But the rarity of it is,--which is indeed almost"
92160,92161,The Tempest,43.0,2.1.57,GONZALO,"beyond credit,--"
92161,92162,The Tempest,44.0,2.1.58,SEBASTIAN,As many vouched rarities are.
92162,92163,The Tempest,45.0,2.1.59,GONZALO,"That our garments, being, as they were, drenched in"
92163,92164,The Tempest,45.0,2.1.60,GONZALO,"the sea, hold notwithstanding their freshness and"
92164,92165,The Tempest,45.0,2.1.61,GONZALO,"glosses, being rather new-dyed than stained with"
92165,92166,The Tempest,45.0,2.1.62,GONZALO,salt water.
92166,92167,The Tempest,46.0,2.1.63,ANTONIO,"If but one of his pockets could speak, would it not"
92167,92168,The Tempest,46.0,2.1.64,ANTONIO,say he lies?
92168,92169,The Tempest,47.0,2.1.65,SEBASTIAN,"Ay, or very falsely pocket up his report"
92169,92170,The Tempest,48.0,2.1.66,GONZALO,Methinks our garments are now as fresh as when we
92170,92171,The Tempest,48.0,2.1.67,GONZALO,"put them on first in Afric, at the marriage of"
92171,92172,The Tempest,48.0,2.1.68,GONZALO,the king's fair daughter Claribel to the King of Tunis.
92172,92173,The Tempest,49.0,2.1.69,SEBASTIAN,"'Twas a sweet marriage, and we prosper well in our return."
92173,92174,The Tempest,50.0,2.1.70,ADRIAN,Tunis was never graced before with such a paragon to
92174,92175,The Tempest,50.0,2.1.71,ADRIAN,their queen.
92175,92176,The Tempest,51.0,2.1.72,GONZALO,Not since widow Dido's time.
92176,92177,The Tempest,52.0,2.1.73,ANTONIO,Widow! a pox o' that! How came that widow in?
92177,92178,The Tempest,52.0,2.1.74,ANTONIO,widow Dido!
92178,92179,The Tempest,53.0,2.1.75,SEBASTIAN,"What if he had said 'widower AEneas' too? Good Lord,"
92179,92180,The Tempest,53.0,2.1.76,SEBASTIAN,how you take it!
92180,92181,The Tempest,54.0,2.1.77,ADRIAN,'Widow Dido' said you? you make me study of that:
92181,92182,The Tempest,54.0,2.1.78,ADRIAN,"she was of Carthage, not of Tunis."
92182,92183,The Tempest,55.0,2.1.79,GONZALO,"This Tunis, sir, was Carthage."
92183,92184,The Tempest,56.0,2.1.80,ADRIAN,Carthage?
92184,92185,The Tempest,57.0,2.1.81,GONZALO,"I assure you, Carthage."
92185,92186,The Tempest,58.0,2.1.82,SEBASTIAN,"His word is more than the miraculous harp, he hath"
92186,92187,The Tempest,58.0,2.1.83,SEBASTIAN,raised the wall and houses too.
92187,92188,The Tempest,59.0,2.1.84,ANTONIO,What impossible matter will he make easy next?
92188,92189,The Tempest,60.0,2.1.85,SEBASTIAN,I think he will carry this island home in his pocket
92189,92190,The Tempest,60.0,2.1.86,SEBASTIAN,and give it his son for an apple.
92190,92191,The Tempest,61.0,2.1.87,ANTONIO,"And, sowing the kernels of it in the sea, bring"
92191,92192,The Tempest,61.0,2.1.88,ANTONIO,forth more islands.
92192,92193,The Tempest,62.0,2.1.89,GONZALO,Ay.
92193,92194,The Tempest,63.0,2.1.90,ANTONIO,"Why, in good time."
92194,92195,The Tempest,64.0,2.1.91,GONZALO,"Sir, we were talking that our garments seem now"
92195,92196,The Tempest,64.0,2.1.92,GONZALO,as fresh as when we were at Tunis at the marriage
92196,92197,The Tempest,64.0,2.1.93,GONZALO,"of your daughter, who is now queen."
92197,92198,The Tempest,65.0,2.1.94,ANTONIO,And the rarest that e'er came there.
92198,92199,The Tempest,66.0,2.1.95,SEBASTIAN,"Bate, I beseech you, widow Dido."
92199,92200,The Tempest,67.0,2.1.96,ANTONIO,"O, widow Dido! ay, widow Dido."
92200,92201,The Tempest,68.0,2.1.97,GONZALO,"Is not, sir, my doublet as fresh as the first day I"
92201,92202,The Tempest,68.0,2.1.98,GONZALO,"wore it? I mean, in a sort."
92202,92203,The Tempest,69.0,2.1.99,ANTONIO,That sort was well fished for.
92203,92204,The Tempest,70.0,2.1.100,GONZALO,When I wore it at your daughter's marriage?
92204,92205,The Tempest,71.0,2.1.101,ALONSO,You cram these words into mine ears against
92205,92206,The Tempest,71.0,2.1.102,ALONSO,The stomach of my sense. Would I had never
92206,92207,The Tempest,71.0,2.1.103,ALONSO,"Married my daughter there! for, coming thence,"
92207,92208,The Tempest,71.0,2.1.104,ALONSO,"My son is lost and, in my rate, she too,"
92208,92209,The Tempest,71.0,2.1.105,ALONSO,Who is so far from Italy removed
92209,92210,The Tempest,71.0,2.1.106,ALONSO,I ne'er again shall see her. O thou mine heir
92210,92211,The Tempest,71.0,2.1.107,ALONSO,"Of Naples and of Milan, what strange fish"
92211,92212,The Tempest,71.0,2.1.108,ALONSO,Hath made his meal on thee?
92212,92213,The Tempest,72.0,2.1.109,FRANCISCO,"Sir, he may live:"
92213,92214,The Tempest,72.0,2.1.110,FRANCISCO,"I saw him beat the surges under him,"
92214,92215,The Tempest,72.0,2.1.111,FRANCISCO,"And ride upon their backs, he trod the water,"
92215,92216,The Tempest,72.0,2.1.112,FRANCISCO,"Whose enmity he flung aside, and breasted"
92216,92217,The Tempest,72.0,2.1.113,FRANCISCO,"The surge most swoln that met him, his bold head"
92217,92218,The Tempest,72.0,2.1.114,FRANCISCO,"'Bove the contentious waves he kept, and oar'd"
92218,92219,The Tempest,72.0,2.1.115,FRANCISCO,Himself with his good arms in lusty stroke
92219,92220,The Tempest,72.0,2.1.116,FRANCISCO,"To the shore, that o'er his wave-worn basis bow'd,"
92220,92221,The Tempest,72.0,2.1.117,FRANCISCO,As stooping to relieve him: I not doubt
92221,92222,The Tempest,72.0,2.1.118,FRANCISCO,He came alive to land.
92222,92223,The Tempest,73.0,2.1.119,ALONSO,"No, no, he's gone."
92223,92224,The Tempest,74.0,2.1.120,SEBASTIAN,"Sir, you may thank yourself for this great loss,"
92224,92225,The Tempest,74.0,2.1.121,SEBASTIAN,"That would not bless our Europe with your daughter,"
92225,92226,The Tempest,74.0,2.1.122,SEBASTIAN,"But rather lose her to an African,"
92226,92227,The Tempest,74.0,2.1.123,SEBASTIAN,"Where she at least is banish'd from your eye,"
92227,92228,The Tempest,74.0,2.1.124,SEBASTIAN,Who hath cause to wet the grief on't.
92228,92229,The Tempest,75.0,2.1.125,ALONSO,"Prithee, peace."
92229,92230,The Tempest,76.0,2.1.126,SEBASTIAN,You were kneel'd to and importuned otherwise
92230,92231,The Tempest,76.0,2.1.127,SEBASTIAN,"By all of us, and the fair soul herself"
92231,92232,The Tempest,76.0,2.1.128,SEBASTIAN,"Weigh'd between loathness and obedience, at"
92232,92233,The Tempest,76.0,2.1.129,SEBASTIAN,Which end o' the beam should bow. We have lost your
92233,92234,The Tempest,76.0,2.1.130,SEBASTIAN,"son,"
92234,92235,The Tempest,76.0,2.1.131,SEBASTIAN,"I fear, for ever: Milan and Naples have"
92235,92236,The Tempest,76.0,2.1.132,SEBASTIAN,More widows in them of this business' making
92236,92237,The Tempest,76.0,2.1.133,SEBASTIAN,Than we bring men to comfort them:
92237,92238,The Tempest,76.0,2.1.134,SEBASTIAN,The fault's your own.
92238,92239,The Tempest,77.0,2.1.135,ALONSO,So is the dear'st o' the loss.
92239,92240,The Tempest,78.0,2.1.136,GONZALO,"My lord Sebastian,"
92240,92241,The Tempest,78.0,2.1.137,GONZALO,The truth you speak doth lack some gentleness
92241,92242,The Tempest,78.0,2.1.138,GONZALO,"And time to speak it in: you rub the sore,"
92242,92243,The Tempest,78.0,2.1.139,GONZALO,When you should bring the plaster.
92243,92244,The Tempest,79.0,2.1.140,SEBASTIAN,Very well.
92244,92245,The Tempest,80.0,2.1.141,ANTONIO,And most chirurgeonly.
92245,92246,The Tempest,81.0,2.1.142,GONZALO,"It is foul weather in us all, good sir,"
92246,92247,The Tempest,81.0,2.1.143,GONZALO,When you are cloudy.
92247,92248,The Tempest,82.0,2.1.144,SEBASTIAN,Foul weather?
92248,92249,The Tempest,83.0,2.1.145,ANTONIO,Very foul.
92249,92250,The Tempest,84.0,2.1.146,GONZALO,"Had I plantation of this isle, my lord,--"
92250,92251,The Tempest,85.0,2.1.147,ANTONIO,He'ld sow't with nettle-seed.
92251,92252,The Tempest,86.0,2.1.148,SEBASTIAN,"Or docks, or mallows."
92252,92253,The Tempest,87.0,2.1.149,GONZALO,"And were the king on't, what would I do?"
92253,92254,The Tempest,88.0,2.1.150,SEBASTIAN,'Scape being drunk for want of wine.
92254,92255,The Tempest,89.0,2.1.151,GONZALO,I' the commonwealth I would by contraries
92255,92256,The Tempest,89.0,2.1.152,GONZALO,"Execute all things, for no kind of traffic"
92256,92257,The Tempest,89.0,2.1.153,GONZALO,"Would I admit, no name of magistrate,"
92257,92258,The Tempest,89.0,2.1.154,GONZALO,"Letters should not be known, riches, poverty,"
92258,92259,The Tempest,89.0,2.1.155,GONZALO,"And use of service, none, contract, succession,"
92259,92260,The Tempest,89.0,2.1.156,GONZALO,"Bourn, bound of land, tilth, vineyard, none,"
92260,92261,The Tempest,89.0,2.1.157,GONZALO,"No use of metal, corn, or wine, or oil,"
92261,92262,The Tempest,89.0,2.1.158,GONZALO,"No occupation, all men idle, all,"
92262,92263,The Tempest,89.0,2.1.159,GONZALO,"And women too, but innocent and pure,"
92263,92264,The Tempest,89.0,2.1.160,GONZALO,"No sovereignty,--"
92264,92265,The Tempest,90.0,2.1.161,SEBASTIAN,Yet he would be king on't.
92265,92266,The Tempest,91.0,2.1.162,ANTONIO,The latter end of his commonwealth forgets the
92266,92267,The Tempest,91.0,2.1.163,ANTONIO,beginning.
92267,92268,The Tempest,92.0,2.1.164,GONZALO,All things in common nature should produce
92268,92269,The Tempest,92.0,2.1.165,GONZALO,"Without sweat or endeavour: treason, felony,"
92269,92270,The Tempest,92.0,2.1.166,GONZALO,"Sword, pike, knife, gun, or need of any engine,"
92270,92271,The Tempest,92.0,2.1.167,GONZALO,"Would I not have, but nature should bring forth,"
92271,92272,The Tempest,92.0,2.1.168,GONZALO,"Of its own kind, all foison, all abundance,"
92272,92273,The Tempest,92.0,2.1.169,GONZALO,To feed my innocent people.
92273,92274,The Tempest,93.0,2.1.170,SEBASTIAN,No marrying 'mong his subjects?
92274,92275,The Tempest,94.0,2.1.171,ANTONIO,"None, man, all idle: whores and knaves."
92275,92276,The Tempest,95.0,2.1.172,GONZALO,"I would with such perfection govern, sir,"
92276,92277,The Tempest,95.0,2.1.173,GONZALO,To excel the golden age.
92277,92278,The Tempest,96.0,2.1.174,SEBASTIAN,God save his majesty!
92278,92279,The Tempest,97.0,2.1.175,ANTONIO,Long live Gonzalo!
92279,92280,The Tempest,98.0,2.1.176,GONZALO,"And,--do you mark me, sir?"
92280,92281,The Tempest,99.0,2.1.177,ALONSO,"Prithee, no more: thou dost talk nothing to me."
92281,92282,The Tempest,100.0,2.1.178,GONZALO,"I do well believe your highness, and"
92282,92283,The Tempest,100.0,2.1.179,GONZALO,"did it to minister occasion to these gentlemen,"
92283,92284,The Tempest,100.0,2.1.180,GONZALO,who are of such sensible and nimble lungs that
92284,92285,The Tempest,100.0,2.1.181,GONZALO,they always use to laugh at nothing.
92285,92286,The Tempest,101.0,2.1.182,ANTONIO,'Twas you we laughed at.
92286,92287,The Tempest,102.0,2.1.183,GONZALO,Who in this kind of merry fooling am nothing
92287,92288,The Tempest,102.0,2.1.184,GONZALO,to you: so you may continue and laugh at
92288,92289,The Tempest,102.0,2.1.185,GONZALO,nothing still.
92289,92290,The Tempest,103.0,2.1.186,ANTONIO,What a blow was there given!
92290,92291,The Tempest,104.0,2.1.187,SEBASTIAN,An it had not fallen flat-long.
92291,92292,The Tempest,105.0,2.1.188,GONZALO,"You are gentlemen of brave metal, you would lift"
92292,92293,The Tempest,105.0,2.1.189,GONZALO,"the moon out of her sphere, if she would continue"
92293,92294,The Tempest,105.0,2.1.190,GONZALO,in it five weeks without changing.
92294,92295,The Tempest,105.0,,GONZALO,"Enter ARIEL, invisible, playing solemn music"
92295,92296,The Tempest,106.0,2.1.191,SEBASTIAN,"We would so, and then go a bat-fowling."
92296,92297,The Tempest,107.0,2.1.192,ANTONIO,"Nay, good my lord, be not angry."
92297,92298,The Tempest,108.0,2.1.193,GONZALO,"No, I warrant you, I will not adventure"
92298,92299,The Tempest,108.0,2.1.194,GONZALO,my discretion so weakly. Will you laugh
92299,92300,The Tempest,108.0,2.1.195,GONZALO,"me asleep, for I am very heavy?"
92300,92301,The Tempest,109.0,2.1.196,ANTONIO,"Go sleep, and hear us."
92301,92302,The Tempest,109.0,,ANTONIO,"All sleep except ALONSO, SEBASTIAN, and ANTONIO"
92302,92303,The Tempest,110.0,2.1.197,ALONSO,"What, all so soon asleep! I wish mine eyes"
92303,92304,The Tempest,110.0,2.1.198,ALONSO,"Would, with themselves, shut up my thoughts: I find"
92304,92305,The Tempest,110.0,2.1.199,ALONSO,They are inclined to do so.
92305,92306,The Tempest,111.0,2.1.200,SEBASTIAN,"Please you, sir,"
92306,92307,The Tempest,111.0,2.1.201,SEBASTIAN,Do not omit the heavy offer of it:
92307,92308,The Tempest,111.0,2.1.202,SEBASTIAN,"It seldom visits sorrow, when it doth,"
92308,92309,The Tempest,111.0,2.1.203,SEBASTIAN,It is a comforter.
92309,92310,The Tempest,112.0,2.1.204,ANTONIO,"We two, my lord,"
92310,92311,The Tempest,112.0,2.1.205,ANTONIO,"Will guard your person while you take your rest,"
92311,92312,The Tempest,112.0,2.1.206,ANTONIO,And watch your safety.
92312,92313,The Tempest,113.0,2.1.207,ALONSO,Thank you. Wondrous heavy.
92313,92314,The Tempest,113.0,,ALONSO,ALONSO sleeps. Exit ARIEL
92314,92315,The Tempest,114.0,2.1.208,SEBASTIAN,What a strange drowsiness possesses them!
92315,92316,The Tempest,115.0,2.1.209,ANTONIO,It is the quality o' the climate.
92316,92317,The Tempest,116.0,2.1.210,SEBASTIAN,Why
92317,92318,The Tempest,116.0,2.1.211,SEBASTIAN,Doth it not then our eyelids sink? I find not
92318,92319,The Tempest,116.0,2.1.212,SEBASTIAN,Myself disposed to sleep.
92319,92320,The Tempest,117.0,2.1.213,ANTONIO,"Nor I, my spirits are nimble."
92320,92321,The Tempest,117.0,2.1.214,ANTONIO,"They fell together all, as by consent,"
92321,92322,The Tempest,117.0,2.1.215,ANTONIO,"They dropp'd, as by a thunder-stroke. What might,"
92322,92323,The Tempest,117.0,2.1.216,ANTONIO,"Worthy Sebastian? O, what might?--No more:--"
92323,92324,The Tempest,117.0,2.1.217,ANTONIO,"And yet me thinks I see it in thy face,"
92324,92325,The Tempest,117.0,2.1.218,ANTONIO,"What thou shouldst be: the occasion speaks thee, and"
92325,92326,The Tempest,117.0,2.1.219,ANTONIO,My strong imagination sees a crown
92326,92327,The Tempest,117.0,2.1.220,ANTONIO,Dropping upon thy head.
92327,92328,The Tempest,118.0,2.1.221,SEBASTIAN,"What, art thou waking?"
92328,92329,The Tempest,119.0,2.1.222,ANTONIO,Do you not hear me speak?
92329,92330,The Tempest,120.0,2.1.223,SEBASTIAN,"I do, and surely"
92330,92331,The Tempest,120.0,2.1.224,SEBASTIAN,It is a sleepy language and thou speak'st
92331,92332,The Tempest,120.0,2.1.225,SEBASTIAN,Out of thy sleep. What is it thou didst say?
92332,92333,The Tempest,120.0,2.1.226,SEBASTIAN,"This is a strange repose, to be asleep"
92333,92334,The Tempest,120.0,2.1.227,SEBASTIAN,"With eyes wide open, standing, speaking, moving,"
92334,92335,The Tempest,120.0,2.1.228,SEBASTIAN,And yet so fast asleep.
92335,92336,The Tempest,121.0,2.1.229,ANTONIO,"Noble Sebastian,"
92336,92337,The Tempest,121.0,2.1.230,ANTONIO,"Thou let'st thy fortune sleep--die, rather, wink'st"
