,Dataline,Play,PlayerLinenumber,ActSceneLine,Player,PlayerLine
92639,92640,The Tempest,36.0,2.2.154,STEPHANO,"Come on then, down, and swear."
92640,92641,The Tempest,37.0,2.2.155,TRINCULO,I shall laugh myself to death at this puppy-headed
92641,92642,The Tempest,37.0,2.2.156,TRINCULO,monster. A most scurvy monster! I could find in my
92642,92643,The Tempest,37.0,2.2.157,TRINCULO,"heart to beat him,--"
92643,92644,The Tempest,38.0,2.2.158,STEPHANO,"Come, kiss."
92644,92645,The Tempest,39.0,2.2.159,TRINCULO,But that the poor monster's in drink: an abominable monster!
92645,92646,The Tempest,40.0,2.2.160,CALIBAN,"I'll show thee the best springs, I'll pluck thee berries,"
92646,92647,The Tempest,40.0,2.2.161,CALIBAN,I'll fish for thee and get thee wood enough.
92647,92648,The Tempest,40.0,2.2.162,CALIBAN,A plague upon the tyrant that I serve!
92648,92649,The Tempest,40.0,2.2.163,CALIBAN,"I'll bear him no more sticks, but follow thee,"
92649,92650,The Tempest,40.0,2.2.164,CALIBAN,Thou wondrous man.
92650,92651,The Tempest,41.0,2.2.165,TRINCULO,"A most ridiculous monster, to make a wonder of a"
92651,92652,The Tempest,41.0,2.2.166,TRINCULO,Poor drunkard!
92652,92653,The Tempest,42.0,2.2.167,CALIBAN,"I prithee, let me bring thee where crabs grow,"
92653,92654,The Tempest,42.0,2.2.168,CALIBAN,"And I with my long nails will dig thee pignuts,"
92654,92655,The Tempest,42.0,2.2.169,CALIBAN,Show thee a jay's nest and instruct thee how
92655,92656,The Tempest,42.0,2.2.170,CALIBAN,"To snare the nimble marmoset, I'll bring thee"
92656,92657,The Tempest,42.0,2.2.171,CALIBAN,To clustering filberts and sometimes I'll get thee
92657,92658,The Tempest,42.0,2.2.172,CALIBAN,Young scamels from the rock. Wilt thou go with me?
92658,92659,The Tempest,43.0,2.2.173,STEPHANO,"I prithee now, lead the way without any more"
92659,92660,The Tempest,43.0,2.2.174,STEPHANO,"talking. Trinculo, the king and all our company"
92660,92661,The Tempest,43.0,2.2.175,STEPHANO,"else being drowned, we will inherit here: here,"
92661,92662,The Tempest,43.0,2.2.176,STEPHANO,"bear my bottle: fellow Trinculo, we'll fill him by"
92662,92663,The Tempest,43.0,2.2.177,STEPHANO,and by again.
92663,92664,The Tempest,44.0,2.2.178,CALIBAN,[Sings drunkenly]
92664,92665,The Tempest,44.0,2.2.179,CALIBAN,"Farewell master, farewell, farewell!"
92665,92666,The Tempest,45.0,2.2.180,TRINCULO,A howling monster: a drunken monster!
92666,92667,The Tempest,46.0,2.2.181,CALIBAN,No more dams I'll make for fish
92667,92668,The Tempest,46.0,2.2.182,CALIBAN,Nor fetch in firing
92668,92669,The Tempest,46.0,2.2.183,CALIBAN,"At requiring,"
92669,92670,The Tempest,46.0,2.2.184,CALIBAN,"Nor scrape trencher, nor wash dish"
92670,92671,The Tempest,46.0,2.2.185,CALIBAN,"'Ban, 'Ban, Cacaliban"
92671,92672,The Tempest,46.0,2.2.186,CALIBAN,Has a new master: get a new man.
92672,92673,The Tempest,46.0,2.2.187,CALIBAN,"Freedom, hey-day! hey-day, freedom! freedom,"
92673,92674,The Tempest,46.0,2.2.188,CALIBAN,"hey-day, freedom!"
92674,92675,The Tempest,47.0,2.2.189,STEPHANO,O brave monster! Lead the way.
92675,92676,The Tempest,47.0,,STEPHANO,Exeunt
92676,92677,The Tempest,47.0,,STEPHANO,ACT III
92677,92678,The Tempest,47.0,,STEPHANO,SCENE I. Before PROSPERO'S Cell.
92678,92679,The Tempest,47.0,,STEPHANO,"Enter FERDINAND, bearing a log"
92679,92680,The Tempest,1.0,3.1.1,FERDINAND,"There be some sports are painful, and their labour"
92680,92681,The Tempest,1.0,3.1.2,FERDINAND,Delight in them sets off: some kinds of baseness
92681,92682,The Tempest,1.0,3.1.3,FERDINAND,Are nobly undergone and most poor matters
92682,92683,The Tempest,1.0,3.1.4,FERDINAND,Point to rich ends. This my mean task
92683,92684,The Tempest,1.0,3.1.5,FERDINAND,"Would be as heavy to me as odious, but"
92684,92685,The Tempest,1.0,3.1.6,FERDINAND,The mistress which I serve quickens what's dead
92685,92686,The Tempest,1.0,3.1.7,FERDINAND,"And makes my labours pleasures: O, she is"
92686,92687,The Tempest,1.0,3.1.8,FERDINAND,"Ten times more gentle than her father's crabbed,"
92687,92688,The Tempest,1.0,3.1.9,FERDINAND,And he's composed of harshness. I must remove
92688,92689,The Tempest,1.0,3.1.10,FERDINAND,"Some thousands of these logs and pile them up,"
92689,92690,The Tempest,1.0,3.1.11,FERDINAND,Upon a sore injunction: my sweet mistress
92690,92691,The Tempest,1.0,3.1.12,FERDINAND,"Weeps when she sees me work, and says, such baseness"
92691,92692,The Tempest,1.0,3.1.13,FERDINAND,Had never like executor. I forget:
92692,92693,The Tempest,1.0,3.1.14,FERDINAND,"But these sweet thoughts do even refresh my labours,"
92693,92694,The Tempest,1.0,3.1.15,FERDINAND,"Most busy lest, when I do it."
92694,92695,The Tempest,1.0,3.1.15,FERDINAND,"Enter MIRANDA, and PROSPERO at a distance, unseen"
92695,92696,The Tempest,2.0,3.1.16,MIRANDA,"Alas, now, pray you,"
92696,92697,The Tempest,2.0,3.1.17,MIRANDA,Work not so hard: I would the lightning had
92697,92698,The Tempest,2.0,3.1.18,MIRANDA,Burnt up those logs that you are enjoin'd to pile!
92698,92699,The Tempest,2.0,3.1.19,MIRANDA,"Pray, set it down and rest you: when this burns,"
92699,92700,The Tempest,2.0,3.1.20,MIRANDA,'Twill weep for having wearied you. My father
92700,92701,The Tempest,2.0,3.1.21,MIRANDA,"Is hard at study, pray now, rest yourself,"
92701,92702,The Tempest,2.0,3.1.22,MIRANDA,He's safe for these three hours.
92702,92703,The Tempest,3.0,3.1.23,FERDINAND,"O most dear mistress,"
92703,92704,The Tempest,3.0,3.1.24,FERDINAND,The sun will set before I shall discharge
92704,92705,The Tempest,3.0,3.1.25,FERDINAND,What I must strive to do.
92705,92706,The Tempest,4.0,3.1.26,MIRANDA,"If you'll sit down,"
92706,92707,The Tempest,4.0,3.1.27,MIRANDA,"I'll bear your logs the while: pray, give me that,"
92707,92708,The Tempest,4.0,3.1.28,MIRANDA,I'll carry it to the pile.
92708,92709,The Tempest,5.0,3.1.29,FERDINAND,"No, precious creature,"
92709,92710,The Tempest,5.0,3.1.30,FERDINAND,"I had rather crack my sinews, break my back,"
92710,92711,The Tempest,5.0,3.1.31,FERDINAND,"Than you should such dishonour undergo,"
92711,92712,The Tempest,5.0,3.1.32,FERDINAND,While I sit lazy by.
92712,92713,The Tempest,6.0,3.1.33,MIRANDA,It would become me
92713,92714,The Tempest,6.0,3.1.34,MIRANDA,As well as it does you: and I should do it
92714,92715,The Tempest,6.0,3.1.35,MIRANDA,"With much more ease, for my good will is to it,"
92715,92716,The Tempest,6.0,3.1.36,MIRANDA,And yours it is against.
92716,92717,The Tempest,7.0,3.1.37,PROSPERO,"Poor worm, thou art infected!"
92717,92718,The Tempest,7.0,3.1.38,PROSPERO,This visitation shows it.
92718,92719,The Tempest,8.0,3.1.39,MIRANDA,You look wearily.
92719,92720,The Tempest,9.0,3.1.40,FERDINAND,"No, noble mistress,'tis fresh morning with me"
92720,92721,The Tempest,9.0,3.1.41,FERDINAND,When you are by at night. I do beseech you--
92721,92722,The Tempest,9.0,3.1.42,FERDINAND,Chiefly that I might set it in my prayers--
92722,92723,The Tempest,9.0,3.1.43,FERDINAND,What is your name?
92723,92724,The Tempest,10.0,3.1.44,MIRANDA,"Miranda.--O my father,"
92724,92725,The Tempest,10.0,3.1.45,MIRANDA,I have broke your hest to say so!
92725,92726,The Tempest,11.0,3.1.46,FERDINAND,Admired Miranda!
92726,92727,The Tempest,11.0,3.1.47,FERDINAND,Indeed the top of admiration! worth
92727,92728,The Tempest,11.0,3.1.48,FERDINAND,What's dearest to the world! Full many a lady
92728,92729,The Tempest,11.0,3.1.49,FERDINAND,I have eyed with best regard and many a time
92729,92730,The Tempest,11.0,3.1.50,FERDINAND,The harmony of their tongues hath into bondage
92730,92731,The Tempest,11.0,3.1.51,FERDINAND,Brought my too diligent ear: for several virtues
92731,92732,The Tempest,11.0,3.1.52,FERDINAND,"Have I liked several women, never any"
92732,92733,The Tempest,11.0,3.1.53,FERDINAND,"With so fun soul, but some defect in her"
92733,92734,The Tempest,11.0,3.1.54,FERDINAND,Did quarrel with the noblest grace she owed
92734,92735,The Tempest,11.0,3.1.55,FERDINAND,"And put it to the foil: but you, O you,"
92735,92736,The Tempest,11.0,3.1.56,FERDINAND,"So perfect and so peerless, are created"
92736,92737,The Tempest,11.0,3.1.57,FERDINAND,Of every creature's best!
92737,92738,The Tempest,12.0,3.1.58,MIRANDA,I do not know
92738,92739,The Tempest,12.0,3.1.59,MIRANDA,"One of my sex, no woman's face remember,"
92739,92740,The Tempest,12.0,3.1.60,MIRANDA,"Save, from my glass, mine own, nor have I seen"
92740,92741,The Tempest,12.0,3.1.61,MIRANDA,"More that I may call men than you, good friend,"
92741,92742,The Tempest,12.0,3.1.62,MIRANDA,"And my dear father: how features are abroad,"
92742,92743,The Tempest,12.0,3.1.63,MIRANDA,"I am skilless of, but, by my modesty,"
92743,92744,The Tempest,12.0,3.1.64,MIRANDA,"The jewel in my dower, I would not wish"
92744,92745,The Tempest,12.0,3.1.65,MIRANDA,"Any companion in the world but you,"
92745,92746,The Tempest,12.0,3.1.66,MIRANDA,"Nor can imagination form a shape,"
92746,92747,The Tempest,12.0,3.1.67,MIRANDA,"Besides yourself, to like of. But I prattle"
92747,92748,The Tempest,12.0,3.1.68,MIRANDA,Something too wildly and my father's precepts
92748,92749,The Tempest,12.0,3.1.69,MIRANDA,I therein do forget.
92749,92750,The Tempest,13.0,3.1.70,FERDINAND,I am in my condition
92750,92751,The Tempest,13.0,3.1.71,FERDINAND,"A prince, Miranda, I do think, a king,"
92751,92752,The Tempest,13.0,3.1.72,FERDINAND,"I would, not so!--and would no more endure"
92752,92753,The Tempest,13.0,3.1.73,FERDINAND,This wooden slavery than to suffer
92753,92754,The Tempest,13.0,3.1.74,FERDINAND,The flesh-fly blow my mouth. Hear my soul speak:
92754,92755,The Tempest,13.0,3.1.75,FERDINAND,"The very instant that I saw you, did"
92755,92756,The Tempest,13.0,3.1.76,FERDINAND,"My heart fly to your service, there resides,"
92756,92757,The Tempest,13.0,3.1.77,FERDINAND,"To make me slave to it, and for your sake"
92757,92758,The Tempest,13.0,3.1.78,FERDINAND,Am I this patient log--man.
92758,92759,The Tempest,14.0,3.1.79,MIRANDA,Do you love me?
92759,92760,The Tempest,15.0,3.1.80,FERDINAND,"O heaven, O earth, bear witness to this sound"
92760,92761,The Tempest,15.0,3.1.81,FERDINAND,And crown what I profess with kind event
92761,92762,The Tempest,15.0,3.1.82,FERDINAND,"If I speak true! if hollowly, invert"
92762,92763,The Tempest,15.0,3.1.83,FERDINAND,What best is boded me to mischief! I
92763,92764,The Tempest,15.0,3.1.84,FERDINAND,Beyond all limit of what else i' the world
92764,92765,The Tempest,15.0,3.1.85,FERDINAND,"Do love, prize, honour you."
92765,92766,The Tempest,16.0,3.1.86,MIRANDA,I am a fool
92766,92767,The Tempest,16.0,3.1.87,MIRANDA,To weep at what I am glad of.
92767,92768,The Tempest,17.0,3.1.88,PROSPERO,Fair encounter
92768,92769,The Tempest,17.0,3.1.89,PROSPERO,Of two most rare affections! Heavens rain grace
92769,92770,The Tempest,17.0,3.1.90,PROSPERO,On that which breeds between 'em!
92770,92771,The Tempest,18.0,3.1.91,FERDINAND,Wherefore weep you?
92771,92772,The Tempest,19.0,3.1.92,MIRANDA,At mine unworthiness that dare not offer
92772,92773,The Tempest,19.0,3.1.93,MIRANDA,"What I desire to give, and much less take"
92773,92774,The Tempest,19.0,3.1.94,MIRANDA,"What I shall die to want. But this is trifling,"
92774,92775,The Tempest,19.0,3.1.95,MIRANDA,"And all the more it seeks to hide itself,"
92775,92776,The Tempest,19.0,3.1.96,MIRANDA,"The bigger bulk it shows. Hence, bashful cunning!"
92776,92777,The Tempest,19.0,3.1.97,MIRANDA,"And prompt me, plain and holy innocence!"
92777,92778,The Tempest,19.0,3.1.98,MIRANDA,"I am your wife, if you will marry me,"
92778,92779,The Tempest,19.0,3.1.99,MIRANDA,"If not, I'll die your maid: to be your fellow"
92779,92780,The Tempest,19.0,3.1.100,MIRANDA,"You may deny me, but I'll be your servant,"
92780,92781,The Tempest,19.0,3.1.101,MIRANDA,Whether you will or no.
92781,92782,The Tempest,20.0,3.1.102,FERDINAND,"My mistress, dearest,"
92782,92783,The Tempest,20.0,3.1.103,FERDINAND,And I thus humble ever.
92783,92784,The Tempest,21.0,3.1.104,MIRANDA,"My husband, then?"
92784,92785,The Tempest,22.0,3.1.105,FERDINAND,"Ay, with a heart as willing"
92785,92786,The Tempest,22.0,3.1.106,FERDINAND,As bondage e'er of freedom: here's my hand.
92786,92787,The Tempest,23.0,3.1.107,MIRANDA,"And mine, with my heart in't, and now farewell"
92787,92788,The Tempest,23.0,3.1.108,MIRANDA,Till half an hour hence.
92788,92789,The Tempest,24.0,3.1.109,FERDINAND,A thousand thousand!
92789,92790,The Tempest,24.0,,FERDINAND,Exeunt FERDINAND and MIRANDA severally
92790,92791,The Tempest,25.0,3.1.110,PROSPERO,"So glad of this as they I cannot be,"
92791,92792,The Tempest,25.0,3.1.111,PROSPERO,"Who are surprised withal, but my rejoicing"
92792,92793,The Tempest,25.0,3.1.112,PROSPERO,"At nothing can be more. I'll to my book,"
92793,92794,The Tempest,25.0,3.1.113,PROSPERO,For yet ere supper-time must I perform
92794,92795,The Tempest,25.0,3.1.114,PROSPERO,Much business appertaining.
92795,92796,The Tempest,25.0,,PROSPERO,Exit
92796,92797,The Tempest,25.0,,PROSPERO,SCENE II. Another part of the island.
92797,92798,The Tempest,25.0,,PROSPERO,"Enter CALIBAN, STEPHANO, and TRINCULO"
92798,92799,The Tempest,1.0,3.2.1,STEPHANO,"Tell not me, when the butt is out, we will drink"
92799,92800,The Tempest,1.0,3.2.2,STEPHANO,"water, not a drop before: therefore bear up, and"
92800,92801,The Tempest,1.0,3.2.3,STEPHANO,"board 'em. Servant-monster, drink to me."
92801,92802,The Tempest,2.0,3.2.4,TRINCULO,Servant-monster! the folly of this island! They
92802,92803,The Tempest,2.0,3.2.5,TRINCULO,say there's but five upon this isle: we are three
92803,92804,The Tempest,2.0,3.2.6,TRINCULO,"of them, if th' other two be brained like us, the"
92804,92805,The Tempest,2.0,3.2.7,TRINCULO,state totters.
92805,92806,The Tempest,3.0,3.2.8,STEPHANO,"Drink, servant-monster, when I bid thee: thy eyes"
92806,92807,The Tempest,3.0,3.2.9,STEPHANO,are almost set in thy head.
92807,92808,The Tempest,4.0,3.2.10,TRINCULO,Where should they be set else? he were a brave
92808,92809,The Tempest,4.0,3.2.11,TRINCULO,"monster indeed, if they were set in his tail."
92809,92810,The Tempest,5.0,3.2.12,STEPHANO,My man-monster hath drown'd his tongue in sack:
92810,92811,The Tempest,5.0,3.2.13,STEPHANO,"for my part, the sea cannot drown me, I swam, ere I"
92811,92812,The Tempest,5.0,3.2.14,STEPHANO,"could recover the shore, five and thirty leagues off"
92812,92813,The Tempest,5.0,3.2.15,STEPHANO,"and on. By this light, thou shalt be my lieutenant,"
92813,92814,The Tempest,5.0,3.2.16,STEPHANO,"monster, or my standard."
92814,92815,The Tempest,6.0,3.2.17,TRINCULO,"Your lieutenant, if you list, he's no standard."
92815,92816,The Tempest,7.0,3.2.18,STEPHANO,"We'll not run, Monsieur Monster."
92816,92817,The Tempest,8.0,3.2.19,TRINCULO,"Nor go neither, but you'll lie like dogs and yet say"
92817,92818,The Tempest,8.0,3.2.20,TRINCULO,nothing neither.
92818,92819,The Tempest,9.0,3.2.21,STEPHANO,"Moon-calf, speak once in thy life, if thou beest a"
92819,92820,The Tempest,9.0,3.2.22,STEPHANO,good moon-calf.
92820,92821,The Tempest,10.0,3.2.23,CALIBAN,How does thy honour? Let me lick thy shoe.
92821,92822,The Tempest,10.0,3.2.24,CALIBAN,"I'll not serve him, he's not valiant."
92822,92823,The Tempest,11.0,3.2.25,TRINCULO,"Thou liest, most ignorant monster: I am in case to"
92823,92824,The Tempest,11.0,3.2.26,TRINCULO,"justle a constable. Why, thou deboshed fish thou,"
92824,92825,The Tempest,11.0,3.2.27,TRINCULO,was there ever man a coward that hath drunk so much
92825,92826,The Tempest,11.0,3.2.28,TRINCULO,"sack as I to-day? Wilt thou tell a monstrous lie,"
92826,92827,The Tempest,11.0,3.2.29,TRINCULO,being but half a fish and half a monster?
92827,92828,The Tempest,12.0,3.2.30,CALIBAN,"Lo, how he mocks me! wilt thou let him, my lord?"
92828,92829,The Tempest,13.0,3.2.31,TRINCULO,'Lord' quoth he! That a monster should be such a natural!
92829,92830,The Tempest,14.0,3.2.32,CALIBAN,"Lo, lo, again! bite him to death, I prithee."
92830,92831,The Tempest,15.0,3.2.33,STEPHANO,"Trinculo, keep a good tongue in your head: if you"
92831,92832,The Tempest,15.0,3.2.34,STEPHANO,"prove a mutineer,--the next tree! The poor monster's"
92832,92833,The Tempest,15.0,3.2.35,STEPHANO,my subject and he shall not suffer indignity.
92833,92834,The Tempest,16.0,3.2.36,CALIBAN,I thank my noble lord. Wilt thou be pleased to
92834,92835,The Tempest,16.0,3.2.37,CALIBAN,hearken once again to the suit I made to thee?
92835,92836,The Tempest,17.0,3.2.38,STEPHANO,"Marry, will I	kneel and repeat it, I will stand,"
92836,92837,The Tempest,17.0,3.2.39,STEPHANO,and so shall Trinculo.
92837,92838,The Tempest,17.0,,STEPHANO,"Enter ARIEL, invisible"
92838,92839,The Tempest,18.0,3.2.40,CALIBAN,"As I told thee before, I am subject to a tyrant, a"
92839,92840,The Tempest,18.0,3.2.41,CALIBAN,"sorcerer, that by his cunning hath cheated me of the island."
92840,92841,The Tempest,19.0,3.2.42,ARIEL,Thou liest.
92841,92842,The Tempest,20.0,3.2.43,CALIBAN,"Thou liest, thou jesting monkey, thou: I would my"
92842,92843,The Tempest,20.0,3.2.44,CALIBAN,valiant master would destroy thee! I do not lie.
92843,92844,The Tempest,21.0,3.2.45,STEPHANO,"Trinculo, if you trouble him any more in's tale, by"
92844,92845,The Tempest,21.0,3.2.46,STEPHANO,"this hand, I will supplant some of your teeth."
92845,92846,The Tempest,22.0,3.2.47,TRINCULO,"Why, I said nothing."
92846,92847,The Tempest,23.0,3.2.48,STEPHANO,"Mum, then, and no more. Proceed."
92847,92848,The Tempest,24.0,3.2.49,CALIBAN,"I say, by sorcery he got this isle,"
92848,92849,The Tempest,24.0,3.2.50,CALIBAN,From me he got it. if thy greatness will
92849,92850,The Tempest,24.0,3.2.51,CALIBAN,"Revenge it on him,--for I know thou darest,"
92850,92851,The Tempest,24.0,3.2.52,CALIBAN,"But this thing dare not,--"
92851,92852,The Tempest,25.0,3.2.53,STEPHANO,That's most certain.
92852,92853,The Tempest,26.0,3.2.54,CALIBAN,Thou shalt be lord of it and I'll serve thee.
92853,92854,The Tempest,27.0,3.2.55,STEPHANO,How now shall this be compassed?
92854,92855,The Tempest,27.0,3.2.56,STEPHANO,Canst thou bring me to the party?
92855,92856,The Tempest,28.0,3.2.57,CALIBAN,"Yea, yea, my lord: I'll yield him thee asleep,"
92856,92857,The Tempest,28.0,3.2.58,CALIBAN,Where thou mayst knock a nail into his bead.
92857,92858,The Tempest,29.0,3.2.59,ARIEL,"Thou liest, thou canst not."
92858,92859,The Tempest,30.0,3.2.60,CALIBAN,What a pied ninny's this! Thou scurvy patch!
92859,92860,The Tempest,30.0,3.2.61,CALIBAN,"I do beseech thy greatness, give him blows"
92860,92861,The Tempest,30.0,3.2.62,CALIBAN,And take his bottle from him: when that's gone
92861,92862,The Tempest,30.0,3.2.63,CALIBAN,"He shall drink nought but brine, for I'll not show him"
92862,92863,The Tempest,30.0,3.2.64,CALIBAN,Where the quick freshes are.
92863,92864,The Tempest,31.0,3.2.65,STEPHANO,"Trinculo, run into no further danger:"
92864,92865,The Tempest,31.0,3.2.66,STEPHANO,"interrupt the monster one word further, and,"
92865,92866,The Tempest,31.0,3.2.67,STEPHANO,"by this hand, I'll turn my mercy out o' doors"
92866,92867,The Tempest,31.0,3.2.68,STEPHANO,and make a stock-fish of thee.
92867,92868,The Tempest,32.0,3.2.69,TRINCULO,"Why, what did I? I did nothing. I'll go farther"
92868,92869,The Tempest,32.0,3.2.70,TRINCULO,off.
92869,92870,The Tempest,33.0,3.2.71,STEPHANO,Didst thou not say he lied?
92870,92871,The Tempest,34.0,3.2.72,ARIEL,Thou liest.
92871,92872,The Tempest,35.0,3.2.73,STEPHANO,Do I so? take thou that.
92872,92873,The Tempest,35.0,,STEPHANO,Beats TRINCULO
92873,92874,The Tempest,35.0,3.2.74,STEPHANO,"As you like this, give me the lie another time."
92874,92875,The Tempest,36.0,3.2.75,TRINCULO,I did not give the lie. Out o' your
92875,92876,The Tempest,36.0,3.2.76,TRINCULO,wits and bearing too? A pox o' your bottle!
92876,92877,The Tempest,36.0,3.2.77,TRINCULO,this can sack and drinking do. A murrain on
92877,92878,The Tempest,36.0,3.2.78,TRINCULO,"your monster, and the devil take your fingers!"
92878,92879,The Tempest,37.0,3.2.79,CALIBAN,"Ha, ha, ha!"
92879,92880,The Tempest,38.0,3.2.80,STEPHANO,"Now, forward with your tale. Prithee, stand farther"
92880,92881,The Tempest,38.0,3.2.81,STEPHANO,off.
92881,92882,The Tempest,39.0,3.2.82,CALIBAN,Beat him enough: after a little time
92882,92883,The Tempest,39.0,3.2.83,CALIBAN,I'll beat him too.
92883,92884,The Tempest,40.0,3.2.84,STEPHANO,"Stand farther. Come, proceed."
92884,92885,The Tempest,41.0,3.2.85,CALIBAN,"Why, as I told thee, 'tis a custom with him,"
92885,92886,The Tempest,41.0,3.2.86,CALIBAN,"I' th' afternoon to sleep: there thou mayst brain him,"
92886,92887,The Tempest,41.0,3.2.87,CALIBAN,"Having first seized his books, or with a log"
92887,92888,The Tempest,41.0,3.2.88,CALIBAN,"Batter his skull, or paunch him with a stake,"
92888,92889,The Tempest,41.0,3.2.89,CALIBAN,Or cut his wezand with thy knife. Remember
92889,92890,The Tempest,41.0,3.2.90,CALIBAN,"First to possess his books, for without them"
92890,92891,The Tempest,41.0,3.2.91,CALIBAN,"He's but a sot, as I am, nor hath not"
92891,92892,The Tempest,41.0,3.2.92,CALIBAN,One spirit to command: they all do hate him
92892,92893,The Tempest,41.0,3.2.93,CALIBAN,As rootedly as I. Burn but his books.
92893,92894,The Tempest,41.0,3.2.94,CALIBAN,"He has brave utensils,--for so he calls them--"
92894,92895,The Tempest,41.0,3.2.95,CALIBAN,"Which when he has a house, he'll deck withal"
92895,92896,The Tempest,41.0,3.2.96,CALIBAN,And that most deeply to consider is
92896,92897,The Tempest,41.0,3.2.97,CALIBAN,"The beauty of his daughter, he himself"
92897,92898,The Tempest,41.0,3.2.98,CALIBAN,"Calls her a nonpareil: I never saw a woman,"
92898,92899,The Tempest,41.0,3.2.99,CALIBAN,"But only Sycorax my dam and she,"
92899,92900,The Tempest,41.0,3.2.100,CALIBAN,But she as far surpasseth Sycorax
92900,92901,The Tempest,41.0,3.2.101,CALIBAN,As great'st does least.
92901,92902,The Tempest,42.0,3.2.102,STEPHANO,Is it so brave a lass?
92902,92903,The Tempest,43.0,3.2.103,CALIBAN,"Ay, lord, she will become thy bed, I warrant."
92903,92904,The Tempest,43.0,3.2.104,CALIBAN,And bring thee forth brave brood.
92904,92905,The Tempest,44.0,3.2.105,STEPHANO,"Monster, I will kill this man: his daughter and I"
92905,92906,The Tempest,44.0,3.2.106,STEPHANO,will be king and queen--save our graces!--and
92906,92907,The Tempest,44.0,3.2.107,STEPHANO,Trinculo and thyself shall be viceroys. Dost thou
92907,92908,The Tempest,44.0,3.2.108,STEPHANO,"like the plot, Trinculo?"
92908,92909,The Tempest,45.0,3.2.109,TRINCULO,Excellent.
92909,92910,The Tempest,46.0,3.2.110,STEPHANO,"Give me thy hand: I am sorry I beat thee, but,"
92910,92911,The Tempest,46.0,3.2.111,STEPHANO,"while thou livest, keep a good tongue in thy head."
92911,92912,The Tempest,47.0,3.2.112,CALIBAN,Within this half hour will he be asleep:
92912,92913,The Tempest,47.0,3.2.113,CALIBAN,Wilt thou destroy him then?
92913,92914,The Tempest,48.0,3.2.114,STEPHANO,"Ay, on mine honour."
92914,92915,The Tempest,49.0,3.2.115,ARIEL,This will I tell my master.
92915,92916,The Tempest,50.0,3.2.116,CALIBAN,"Thou makest me merry, I am full of pleasure:"
92916,92917,The Tempest,50.0,3.2.117,CALIBAN,Let us be jocund: will you troll the catch
92917,92918,The Tempest,50.0,3.2.118,CALIBAN,You taught me but while-ere?
92918,92919,The Tempest,51.0,3.2.119,STEPHANO,"At thy request, monster, I will do reason, any"
92919,92920,The Tempest,51.0,3.2.120,STEPHANO,"reason. Come on, Trinculo, let us sing."
92920,92921,The Tempest,51.0,,STEPHANO,Sings
92921,92922,The Tempest,51.0,3.2.121,STEPHANO,Flout 'em and scout 'em
92922,92923,The Tempest,51.0,3.2.122,STEPHANO,And scout 'em and flout 'em
92923,92924,The Tempest,51.0,3.2.123,STEPHANO,Thought is free.
92924,92925,The Tempest,52.0,3.2.124,CALIBAN,That's not the tune.
92925,92926,The Tempest,52.0,,CALIBAN,Ariel plays the tune on a tabour and pipe
92926,92927,The Tempest,53.0,3.2.125,STEPHANO,What is this same?
92927,92928,The Tempest,54.0,3.2.126,TRINCULO,"This is the tune of our catch, played by the picture"
92928,92929,The Tempest,54.0,3.2.127,TRINCULO,of Nobody.
92929,92930,The Tempest,55.0,3.2.128,STEPHANO,"If thou beest a man, show thyself in thy likeness:"
92930,92931,The Tempest,55.0,3.2.129,STEPHANO,"if thou beest a devil, take't as thou list."
92931,92932,The Tempest,56.0,3.2.130,TRINCULO,"O, forgive me my sins!"
92932,92933,The Tempest,57.0,3.2.131,STEPHANO,He that dies pays all debts: I defy thee. Mercy upon us!
92933,92934,The Tempest,58.0,3.2.132,CALIBAN,Art thou afeard?
92934,92935,The Tempest,59.0,3.2.133,STEPHANO,"No, monster, not I."
92935,92936,The Tempest,60.0,3.2.134,CALIBAN,"Be not afeard, the isle is full of noises,"
92936,92937,The Tempest,60.0,3.2.135,CALIBAN,"Sounds and sweet airs, that give delight and hurt not."
92937,92938,The Tempest,60.0,3.2.136,CALIBAN,Sometimes a thousand twangling instruments
92938,92939,The Tempest,60.0,3.2.137,CALIBAN,"Will hum about mine ears, and sometime voices"
92939,92940,The Tempest,60.0,3.2.138,CALIBAN,"That, if I then had waked after long sleep,"
92940,92941,The Tempest,60.0,3.2.139,CALIBAN,"Will make me sleep again: and then, in dreaming,"
92941,92942,The Tempest,60.0,3.2.140,CALIBAN,The clouds methought would open and show riches
92942,92943,The Tempest,60.0,3.2.141,CALIBAN,"Ready to drop upon me that, when I waked,"
92943,92944,The Tempest,60.0,3.2.142,CALIBAN,I cried to dream again.
92944,92945,The Tempest,61.0,3.2.143,STEPHANO,"This will prove a brave kingdom to me, where I shall"
92945,92946,The Tempest,61.0,3.2.144,STEPHANO,have my music for nothing.
92946,92947,The Tempest,62.0,3.2.145,CALIBAN,When Prospero is destroyed.
