,Dataline,Play,PlayerLinenumber,ActSceneLine,Player,PlayerLine
92947,92948,The Tempest,63.0,3.2.146,STEPHANO,That shall be by and by: I remember the story.
92948,92949,The Tempest,64.0,3.2.147,TRINCULO,"The sound is going away, let's follow it, and"
92949,92950,The Tempest,64.0,3.2.148,TRINCULO,after do our work.
92950,92951,The Tempest,65.0,3.2.149,STEPHANO,"Lead, monster, we'll follow. I would I could see"
92951,92952,The Tempest,65.0,3.2.150,STEPHANO,"this tabourer, he lays it on."
92952,92953,The Tempest,66.0,3.2.151,TRINCULO,"Wilt come? I'll follow, Stephano."
92953,92954,The Tempest,66.0,,TRINCULO,Exeunt
92954,92955,The Tempest,66.0,,TRINCULO,SCENE III. Another part of the island.
92955,92956,The Tempest,66.0,,TRINCULO,"Enter ALONSO, SEBASTIAN, ANTONIO, GONZALO, ADRIAN, FRANCISCO, and others"
92956,92957,The Tempest,1.0,3.3.1,GONZALO,"By'r lakin, I can go no further, sir,"
92957,92958,The Tempest,1.0,3.3.2,GONZALO,My old bones ache: here's a maze trod indeed
92958,92959,The Tempest,1.0,3.3.3,GONZALO,"Through forth-rights and meanders! By your patience,"
92959,92960,The Tempest,1.0,3.3.4,GONZALO,I needs must rest me.
92960,92961,The Tempest,2.0,3.3.5,ALONSO,"Old lord, I cannot blame thee,"
92961,92962,The Tempest,2.0,3.3.6,ALONSO,"Who am myself attach'd with weariness,"
92962,92963,The Tempest,2.0,3.3.7,ALONSO,"To the dulling of my spirits: sit down, and rest."
92963,92964,The Tempest,2.0,3.3.8,ALONSO,Even here I will put off my hope and keep it
92964,92965,The Tempest,2.0,3.3.9,ALONSO,No longer for my flatterer: he is drown'd
92965,92966,The Tempest,2.0,3.3.10,ALONSO,"Whom thus we stray to find, and the sea mocks"
92966,92967,The Tempest,2.0,3.3.11,ALONSO,"Our frustrate search on land. Well, let him go."
92967,92968,The Tempest,3.0,3.3.12,ANTONIO,[Aside to SEBASTIAN]  I am right glad that he's so
92968,92969,The Tempest,3.0,3.3.13,ANTONIO,out of hope.
92969,92970,The Tempest,3.0,3.3.14,ANTONIO,"Do not, for one repulse, forego the purpose"
92970,92971,The Tempest,3.0,3.3.15,ANTONIO,That you resolved to effect.
92971,92972,The Tempest,4.0,3.3.16,SEBASTIAN,[Aside to ANTONIO]  The next advantage
92972,92973,The Tempest,4.0,3.3.17,SEBASTIAN,Will we take throughly.
92973,92974,The Tempest,5.0,3.3.18,ANTONIO,"[Aside to SEBASTIAN]  Let it be to-night,"
92974,92975,The Tempest,5.0,3.3.19,ANTONIO,"For, now they are oppress'd with travel, they"
92975,92976,The Tempest,5.0,3.3.20,ANTONIO,"Will not, nor cannot, use such vigilance"
92976,92977,The Tempest,5.0,3.3.21,ANTONIO,As when they are fresh.
92977,92978,The Tempest,6.0,3.3.22,SEBASTIAN,"[Aside to ANTONIO]  I say, to-night: no more."
92978,92979,The Tempest,6.0,,SEBASTIAN,Solemn and strange music
92979,92980,The Tempest,7.0,3.3.23,ALONSO,"What harmony is this? My good friends, hark!"
92980,92981,The Tempest,8.0,3.3.24,GONZALO,Marvellous sweet music!
92981,92982,The Tempest,8.0,3.3.24,GONZALO,"Enter PROSPERO above, invisible. Enter several  strange Shapes, bringing in a banquet,  they dance about it with gentle actions of  salutation, and, inviting the King,  and c. to eat, they depart"
92982,92983,The Tempest,9.0,3.3.25,ALONSO,"Give us kind keepers, heavens! What were these?"
92983,92984,The Tempest,10.0,3.3.26,SEBASTIAN,A living drollery. Now I will believe
92984,92985,The Tempest,10.0,3.3.27,SEBASTIAN,"That there are unicorns, that in Arabia"
92985,92986,The Tempest,10.0,3.3.28,SEBASTIAN,"There is one tree, the phoenix' throne, one phoenix"
92986,92987,The Tempest,10.0,3.3.29,SEBASTIAN,At this hour reigning there.
92987,92988,The Tempest,11.0,3.3.30,ANTONIO,"I'll believe both,"
92988,92989,The Tempest,11.0,3.3.31,ANTONIO,"And what does else want credit, come to me,"
92989,92990,The Tempest,11.0,3.3.32,ANTONIO,And I'll be sworn 'tis true: travellers ne'er did
92990,92991,The Tempest,11.0,3.3.33,ANTONIO,"lie,"
92991,92992,The Tempest,11.0,3.3.34,ANTONIO,Though fools at home condemn 'em.
92992,92993,The Tempest,12.0,3.3.35,GONZALO,If in Naples
92993,92994,The Tempest,12.0,3.3.36,GONZALO,"I should report this now, would they believe me?"
92994,92995,The Tempest,12.0,3.3.37,GONZALO,"If I should say, I saw such islanders--"
92995,92996,The Tempest,12.0,3.3.38,GONZALO,"For, certes, these are people of the island--"
92996,92997,The Tempest,12.0,3.3.39,GONZALO,"Who, though they are of monstrous shape, yet, note,"
92997,92998,The Tempest,12.0,3.3.40,GONZALO,Their manners are more gentle-kind than of
92998,92999,The Tempest,12.0,3.3.41,GONZALO,Our human generation you shall find
92999,93000,The Tempest,12.0,3.3.42,GONZALO,"Many, nay, almost any."
93000,93001,The Tempest,13.0,3.3.43,PROSPERO,"[Aside]              Honest lord,"
93001,93002,The Tempest,13.0,3.3.44,PROSPERO,"Thou hast said well, for some of you there present"
93002,93003,The Tempest,13.0,3.3.45,PROSPERO,Are worse than devils.
93003,93004,The Tempest,14.0,3.3.46,ALONSO,I cannot too much muse
93004,93005,The Tempest,14.0,3.3.47,ALONSO,"Such shapes, such gesture and such sound, expressing,"
93005,93006,The Tempest,14.0,3.3.48,ALONSO,"Although they want the use of tongue, a kind"
93006,93007,The Tempest,14.0,3.3.49,ALONSO,Of excellent dumb discourse.
93007,93008,The Tempest,15.0,3.3.50,PROSPERO,[Aside]	Praise in departing.
93008,93009,The Tempest,16.0,3.3.51,FRANCISCO,They vanish'd strangely.
93009,93010,The Tempest,17.0,3.3.52,SEBASTIAN,"No matter, since"
93010,93011,The Tempest,17.0,3.3.53,SEBASTIAN,"They have left their viands behind, for we have stomachs."
93011,93012,The Tempest,17.0,3.3.54,SEBASTIAN,Will't please you taste of what is here?
93012,93013,The Tempest,18.0,3.3.55,ALONSO,Not I.
93013,93014,The Tempest,19.0,3.3.56,GONZALO,"Faith, sir, you need not fear. When we were boys,"
93014,93015,The Tempest,19.0,3.3.57,GONZALO,Who would believe that there were mountaineers
93015,93016,The Tempest,19.0,3.3.58,GONZALO,"Dew-lapp'd like bulls, whose throats had hanging at 'em"
93016,93017,The Tempest,19.0,3.3.59,GONZALO,Wallets of flesh? or that there were such men
93017,93018,The Tempest,19.0,3.3.60,GONZALO,Whose heads stood in their breasts? which now we find
93018,93019,The Tempest,19.0,3.3.61,GONZALO,Each putter-out of five for one will bring us
93019,93020,The Tempest,19.0,3.3.62,GONZALO,Good warrant of.
93020,93021,The Tempest,20.0,3.3.63,ALONSO,"I will stand to and feed,"
93021,93022,The Tempest,20.0,3.3.64,ALONSO,"Although my last: no matter, since I feel"
93022,93023,The Tempest,20.0,3.3.65,ALONSO,"The best is past. Brother, my lord the duke,"
93023,93024,The Tempest,20.0,3.3.66,ALONSO,Stand to and do as we.
93024,93025,The Tempest,20.0,3.3.66,ALONSO,"Thunder and lightning. Enter ARIEL, like a  harpy, claps his wings upon the table, and, with a quaint device, the banquet vanishes"
93025,93026,The Tempest,21.0,3.3.67,ARIEL,"You are three men of sin, whom Destiny,"
93026,93027,The Tempest,21.0,3.3.68,ARIEL,That hath to instrument this lower world
93027,93028,The Tempest,21.0,3.3.69,ARIEL,"And what is in't, the never-surfeited sea"
93028,93029,The Tempest,21.0,3.3.70,ARIEL,"Hath caused to belch up you, and on this island"
93029,93030,The Tempest,21.0,3.3.71,ARIEL,"Where man doth not inhabit, you 'mongst men"
93030,93031,The Tempest,21.0,3.3.72,ARIEL,"Being most unfit to live. I have made you mad,"
93031,93032,The Tempest,21.0,3.3.73,ARIEL,And even with such-like valour men hang and drown
93032,93033,The Tempest,21.0,3.3.74,ARIEL,Their proper selves.
93033,93034,The Tempest,21.0,3.3.74,ARIEL,"ALONSO, SEBASTIAN  and c. draw their swords"
93034,93035,The Tempest,21.0,3.3.75,ARIEL,You fools! I and my fellows
93035,93036,The Tempest,21.0,3.3.76,ARIEL,"Are ministers of Fate: the elements,"
93036,93037,The Tempest,21.0,3.3.77,ARIEL,"Of whom your swords are temper'd, may as well"
93037,93038,The Tempest,21.0,3.3.78,ARIEL,"Wound the loud winds, or with bemock'd-at stabs"
93038,93039,The Tempest,21.0,3.3.79,ARIEL,"Kill the still-closing waters, as diminish"
93039,93040,The Tempest,21.0,3.3.80,ARIEL,One dowle that's in my plume: my fellow-ministers
93040,93041,The Tempest,21.0,3.3.81,ARIEL,"Are like invulnerable. If you could hurt,"
93041,93042,The Tempest,21.0,3.3.82,ARIEL,Your swords are now too massy for your strengths
93042,93043,The Tempest,21.0,3.3.83,ARIEL,And will not be uplifted. But remember--
93043,93044,The Tempest,21.0,3.3.84,ARIEL,For that's my business to you--that you three
93044,93045,The Tempest,21.0,3.3.85,ARIEL,"From Milan did supplant good Prospero,"
93045,93046,The Tempest,21.0,3.3.86,ARIEL,"Exposed unto the sea, which hath requit it,"
93046,93047,The Tempest,21.0,3.3.87,ARIEL,Him and his innocent child: for which foul deed
93047,93048,The Tempest,21.0,3.3.88,ARIEL,"The powers, delaying, not forgetting, have"
93048,93049,The Tempest,21.0,3.3.89,ARIEL,"Incensed the seas and shores, yea, all the creatures,"
93049,93050,The Tempest,21.0,3.3.90,ARIEL,"Against your peace. Thee of thy son, Alonso,"
93050,93051,The Tempest,21.0,3.3.91,ARIEL,"They have bereft, and do pronounce by me:"
93051,93052,The Tempest,21.0,3.3.92,ARIEL,"Lingering perdition, worse than any death"
93052,93053,The Tempest,21.0,3.3.93,ARIEL,"Can be at once, shall step by step attend"
93053,93054,The Tempest,21.0,3.3.94,ARIEL,"You and your ways, whose wraths to guard you from--"
93054,93055,The Tempest,21.0,3.3.95,ARIEL,"Which here, in this most desolate isle, else falls"
93055,93056,The Tempest,21.0,3.3.96,ARIEL,Upon your heads--is nothing but heart-sorrow
93056,93057,The Tempest,21.0,3.3.97,ARIEL,And a clear life ensuing.
93057,93058,The Tempest,21.0,3.3.97,ARIEL,"He vanishes in thunder, then, to soft music  enter the Shapes again, and dance, with mocks and mows, and carrying out the table"
93058,93059,The Tempest,22.0,3.3.98,PROSPERO,Bravely the figure of this harpy hast thou
93059,93060,The Tempest,22.0,3.3.99,PROSPERO,"Perform'd, my Ariel, a grace it had, devouring:"
93060,93061,The Tempest,22.0,3.3.100,PROSPERO,Of my instruction hast thou nothing bated
93061,93062,The Tempest,22.0,3.3.101,PROSPERO,"In what thou hadst to say: so, with good life"
93062,93063,The Tempest,22.0,3.3.102,PROSPERO,"And observation strange, my meaner ministers"
93063,93064,The Tempest,22.0,3.3.103,PROSPERO,Their several kinds have done. My high charms work
93064,93065,The Tempest,22.0,3.3.104,PROSPERO,And these mine enemies are all knit up
93065,93066,The Tempest,22.0,3.3.105,PROSPERO,"In their distractions, they now are in my power,"
93066,93067,The Tempest,22.0,3.3.106,PROSPERO,"And in these fits I leave them, while I visit"
93067,93068,The Tempest,22.0,3.3.107,PROSPERO,"Young Ferdinand, whom they suppose is drown'd,"
93068,93069,The Tempest,22.0,3.3.108,PROSPERO,And his and mine loved darling.
93069,93070,The Tempest,22.0,,PROSPERO,Exit above
93070,93071,The Tempest,23.0,3.3.109,GONZALO,"I' the name of something holy, sir, why stand you"
93071,93072,The Tempest,23.0,3.3.110,GONZALO,In this strange stare?
93072,93073,The Tempest,24.0,3.3.111,ALONSO,"O, it is monstrous, monstrous:"
93073,93074,The Tempest,24.0,3.3.112,ALONSO,"Methought the billows spoke and told me of it,"
93074,93075,The Tempest,24.0,3.3.113,ALONSO,"The winds did sing it to me, and the thunder,"
93075,93076,The Tempest,24.0,3.3.114,ALONSO,"That deep and dreadful organ-pipe, pronounced"
93076,93077,The Tempest,24.0,3.3.115,ALONSO,The name of Prosper: it did bass my trespass.
93077,93078,The Tempest,24.0,3.3.116,ALONSO,"Therefore my son i' the ooze is bedded, and"
93078,93079,The Tempest,24.0,3.3.117,ALONSO,I'll seek him deeper than e'er plummet sounded
93079,93080,The Tempest,24.0,3.3.118,ALONSO,And with him there lie mudded.
93080,93081,The Tempest,24.0,,ALONSO,Exit
93081,93082,The Tempest,25.0,3.3.119,SEBASTIAN,"But one fiend at a time,"
93082,93083,The Tempest,25.0,3.3.120,SEBASTIAN,I'll fight their legions o'er.
93083,93084,The Tempest,26.0,3.3.121,ANTONIO,I'll be thy second.
93084,93085,The Tempest,26.0,,ANTONIO,"Exeunt SEBASTIAN, and ANTONIO"
93085,93086,The Tempest,27.0,3.3.122,GONZALO,"All three of them are desperate: their great guilt,"
93086,93087,The Tempest,27.0,3.3.123,GONZALO,"Like poison given to work a great time after,"
93087,93088,The Tempest,27.0,3.3.124,GONZALO,Now 'gins to bite the spirits. I do beseech you
93088,93089,The Tempest,27.0,3.3.125,GONZALO,"That are of suppler joints, follow them swiftly"
93089,93090,The Tempest,27.0,3.3.126,GONZALO,And hinder them from what this ecstasy
93090,93091,The Tempest,27.0,3.3.127,GONZALO,May now provoke them to.
93091,93092,The Tempest,28.0,3.3.128,ADRIAN,"Follow, I pray you."
93092,93093,The Tempest,28.0,,ADRIAN,Exeunt
93093,93094,The Tempest,28.0,,ADRIAN,ACT IV
93094,93095,The Tempest,28.0,,ADRIAN,SCENE I. Before PROSPERO'S cell.
93095,93096,The Tempest,28.0,,ADRIAN,"Enter PROSPERO, FERDINAND, and MIRANDA"
93096,93097,The Tempest,1.0,4.1.1,PROSPERO,"If I have too austerely punish'd you,"
93097,93098,The Tempest,1.0,4.1.2,PROSPERO,"Your compensation makes amends, for I"
93098,93099,The Tempest,1.0,4.1.3,PROSPERO,"Have given you here a third of mine own life,"
93099,93100,The Tempest,1.0,4.1.4,PROSPERO,"Or that for which I live, who once again"
93100,93101,The Tempest,1.0,4.1.5,PROSPERO,I tender to thy hand: all thy vexations
93101,93102,The Tempest,1.0,4.1.6,PROSPERO,Were but my trials of thy love and thou
93102,93103,The Tempest,1.0,4.1.7,PROSPERO,"Hast strangely stood the test here, afore Heaven,"
93103,93104,The Tempest,1.0,4.1.8,PROSPERO,"I ratify this my rich gift. O Ferdinand,"
93104,93105,The Tempest,1.0,4.1.9,PROSPERO,"Do not smile at me that I boast her off,"
93105,93106,The Tempest,1.0,4.1.10,PROSPERO,For thou shalt find she will outstrip all praise
93106,93107,The Tempest,1.0,4.1.11,PROSPERO,And make it halt behind her.
93107,93108,The Tempest,2.0,4.1.12,FERDINAND,I do believe it
93108,93109,The Tempest,2.0,4.1.13,FERDINAND,Against an oracle.
93109,93110,The Tempest,3.0,4.1.14,PROSPERO,"Then, as my gift and thine own acquisition"
93110,93111,The Tempest,3.0,4.1.15,PROSPERO,Worthily purchased take my daughter: but
93111,93112,The Tempest,3.0,4.1.16,PROSPERO,If thou dost break her virgin-knot before
93112,93113,The Tempest,3.0,4.1.17,PROSPERO,All sanctimonious ceremonies may
93113,93114,The Tempest,3.0,4.1.18,PROSPERO,"With full and holy rite be minister'd,"
93114,93115,The Tempest,3.0,4.1.19,PROSPERO,No sweet aspersion shall the heavens let fall
93115,93116,The Tempest,3.0,4.1.20,PROSPERO,"To make this contract grow: but barren hate,"
93116,93117,The Tempest,3.0,4.1.21,PROSPERO,Sour-eyed disdain and discord shall bestrew
93117,93118,The Tempest,3.0,4.1.22,PROSPERO,The union of your bed with weeds so loathly
93118,93119,The Tempest,3.0,4.1.23,PROSPERO,"That you shall hate it both: therefore take heed,"
93119,93120,The Tempest,3.0,4.1.24,PROSPERO,As Hymen's lamps shall light you.
93120,93121,The Tempest,4.0,4.1.25,FERDINAND,As I hope
93121,93122,The Tempest,4.0,4.1.26,FERDINAND,"For quiet days, fair issue and long life,"
93122,93123,The Tempest,4.0,4.1.27,FERDINAND,"With such love as 'tis now, the murkiest den,"
93123,93124,The Tempest,4.0,4.1.28,FERDINAND,"The most opportune place, the strong'st suggestion."
93124,93125,The Tempest,4.0,4.1.29,FERDINAND,"Our worser genius can, shall never melt"
93125,93126,The Tempest,4.0,4.1.30,FERDINAND,"Mine honour into lust, to take away"
93126,93127,The Tempest,4.0,4.1.31,FERDINAND,The edge of that day's celebration
93127,93128,The Tempest,4.0,4.1.32,FERDINAND,"When I shall think: or Phoebus' steeds are founder'd,"
93128,93129,The Tempest,4.0,4.1.33,FERDINAND,Or Night kept chain'd below.
93129,93130,The Tempest,5.0,4.1.34,PROSPERO,Fairly spoke.
93130,93131,The Tempest,5.0,4.1.35,PROSPERO,"Sit then and talk with her, she is thine own."
93131,93132,The Tempest,5.0,4.1.36,PROSPERO,"What, Ariel! my industrious servant, Ariel!"
93132,93133,The Tempest,5.0,,PROSPERO,Enter ARIEL
93133,93134,The Tempest,6.0,4.1.37,ARIEL,What would my potent master? here I am.
93134,93135,The Tempest,7.0,4.1.38,PROSPERO,Thou and thy meaner fellows your last service
93135,93136,The Tempest,7.0,4.1.39,PROSPERO,"Did worthily perform, and I must use you"
93136,93137,The Tempest,7.0,4.1.40,PROSPERO,"In such another trick. Go bring the rabble,"
93137,93138,The Tempest,7.0,4.1.41,PROSPERO,"O'er whom I give thee power, here to this place:"
93138,93139,The Tempest,7.0,4.1.42,PROSPERO,"Incite them to quick motion, for I must"
93139,93140,The Tempest,7.0,4.1.43,PROSPERO,Bestow upon the eyes of this young couple
93140,93141,The Tempest,7.0,4.1.44,PROSPERO,"Some vanity of mine art: it is my promise,"
93141,93142,The Tempest,7.0,4.1.45,PROSPERO,And they expect it from me.
93142,93143,The Tempest,8.0,4.1.46,ARIEL,Presently?
93143,93144,The Tempest,9.0,4.1.47,PROSPERO,"Ay, with a twink."
93144,93145,The Tempest,10.0,4.1.48,ARIEL,"Before you can say 'come' and 'go,'"
93145,93146,The Tempest,10.0,4.1.49,ARIEL,"And breathe twice and cry 'so, so,'"
93146,93147,The Tempest,10.0,4.1.50,ARIEL,"Each one, tripping on his toe,"
93147,93148,The Tempest,10.0,4.1.51,ARIEL,Will be here with mop and mow.
93148,93149,The Tempest,10.0,4.1.52,ARIEL,"Do you love me, master? no?"
93149,93150,The Tempest,11.0,4.1.53,PROSPERO,Dearly my delicate Ariel. Do not approach
93150,93151,The Tempest,11.0,4.1.54,PROSPERO,Till thou dost hear me call.
93151,93152,The Tempest,12.0,4.1.55,ARIEL,"Well, I conceive."
93152,93153,The Tempest,12.0,,ARIEL,Exit
93153,93154,The Tempest,13.0,4.1.56,PROSPERO,"Look thou be true, do not give dalliance"
93154,93155,The Tempest,13.0,4.1.57,PROSPERO,Too much the rein: the strongest oaths are straw
93155,93156,The Tempest,13.0,4.1.58,PROSPERO,"To the fire i' the blood: be more abstemious,"
93156,93157,The Tempest,13.0,4.1.59,PROSPERO,"Or else, good night your vow!"
93157,93158,The Tempest,14.0,4.1.60,FERDINAND,"I warrant you sir,"
93158,93159,The Tempest,14.0,4.1.61,FERDINAND,The white cold virgin snow upon my heart
93159,93160,The Tempest,14.0,4.1.62,FERDINAND,Abates the ardour of my liver.
93160,93161,The Tempest,15.0,4.1.63,PROSPERO,Well.
93161,93162,The Tempest,15.0,4.1.64,PROSPERO,"Now come, my Ariel! bring a corollary,"
93162,93163,The Tempest,15.0,4.1.65,PROSPERO,Rather than want a spirit: appear and pertly!
93163,93164,The Tempest,15.0,4.1.66,PROSPERO,No tongue! all eyes! be silent.
93164,93165,The Tempest,15.0,,PROSPERO,Soft music
93165,93166,The Tempest,15.0,,PROSPERO,Enter IRIS
93166,93167,The Tempest,16.0,4.1.67,IRIS,"Ceres, most bounteous lady, thy rich leas"
93167,93168,The Tempest,16.0,4.1.68,IRIS,"Of wheat, rye, barley, vetches, oats and pease,"
93168,93169,The Tempest,16.0,4.1.69,IRIS,"Thy turfy mountains, where live nibbling sheep,"
93169,93170,The Tempest,16.0,4.1.70,IRIS,"And flat meads thatch'd with stover, them to keep,"
93170,93171,The Tempest,16.0,4.1.71,IRIS,"Thy banks with pioned and twilled brims,"
93171,93172,The Tempest,16.0,4.1.72,IRIS,"Which spongy April at thy hest betrims,"
93172,93173,The Tempest,16.0,4.1.73,IRIS,"To make cold nymphs chaste crowns, and thy broom -groves,"
93173,93174,The Tempest,16.0,4.1.74,IRIS,"Whose shadow the dismissed bachelor loves,"
93174,93175,The Tempest,16.0,4.1.75,IRIS,"Being lass-lorn: thy pole-clipt vineyard,"
93175,93176,The Tempest,16.0,4.1.76,IRIS,"And thy sea-marge, sterile and rocky-hard,"
93176,93177,The Tempest,16.0,4.1.77,IRIS,"Where thou thyself dost air,--the queen o' the sky,"
93177,93178,The Tempest,16.0,4.1.78,IRIS,"Whose watery arch and messenger am I,"
93178,93179,The Tempest,16.0,4.1.79,IRIS,"Bids thee leave these, and with her sovereign grace,"
93179,93180,The Tempest,16.0,4.1.80,IRIS,"Here on this grass-plot, in this very place,"
93180,93181,The Tempest,16.0,4.1.81,IRIS,To come and sport: her peacocks fly amain:
93181,93182,The Tempest,16.0,4.1.82,IRIS,"Approach, rich Ceres, her to entertain."
93182,93183,The Tempest,16.0,,IRIS,Enter CERES
93183,93184,The Tempest,17.0,4.1.83,CERES,"Hail, many-colour'd messenger, that ne'er"
93184,93185,The Tempest,17.0,4.1.84,CERES,"Dost disobey the wife of Jupiter,"
93185,93186,The Tempest,17.0,4.1.85,CERES,Who with thy saffron wings upon my flowers
93186,93187,The Tempest,17.0,4.1.86,CERES,"Diffusest honey-drops, refreshing showers,"
93187,93188,The Tempest,17.0,4.1.87,CERES,And with each end of thy blue bow dost crown
93188,93189,The Tempest,17.0,4.1.88,CERES,"My bosky acres and my unshrubb'd down,"
93189,93190,The Tempest,17.0,4.1.89,CERES,"Rich scarf to my proud earth, why hath thy queen"
93190,93191,The Tempest,17.0,4.1.90,CERES,"Summon'd me hither, to this short-grass'd green?"
93191,93192,The Tempest,18.0,4.1.91,IRIS,"A contract of true love to celebrate,"
93192,93193,The Tempest,18.0,4.1.92,IRIS,And some donation freely to estate
93193,93194,The Tempest,18.0,4.1.93,IRIS,On the blest lovers.
93194,93195,The Tempest,19.0,4.1.94,CERES,"Tell me, heavenly bow,"
93195,93196,The Tempest,19.0,4.1.95,CERES,"If Venus or her son, as thou dost know,"
93196,93197,The Tempest,19.0,4.1.96,CERES,Do now attend the queen? Since they did plot
93197,93198,The Tempest,19.0,4.1.97,CERES,"The means that dusky Dis my daughter got,"
93198,93199,The Tempest,19.0,4.1.98,CERES,Her and her blind boy's scandal'd company
93199,93200,The Tempest,19.0,4.1.99,CERES,I have forsworn.
93200,93201,The Tempest,20.0,4.1.100,IRIS,Of her society
93201,93202,The Tempest,20.0,4.1.101,IRIS,Be not afraid: I met her deity
93202,93203,The Tempest,20.0,4.1.102,IRIS,Cutting the clouds towards Paphos and her son
93203,93204,The Tempest,20.0,4.1.103,IRIS,Dove-drawn with her. Here thought they to have done
93204,93205,The Tempest,20.0,4.1.104,IRIS,"Some wanton charm upon this man and maid,"
93205,93206,The Tempest,20.0,4.1.105,IRIS,"Whose vows are, that no bed-right shall be paid"
93206,93207,The Tempest,20.0,4.1.106,IRIS,"Till Hymen's torch be lighted: but vain,"
93207,93208,The Tempest,20.0,4.1.107,IRIS,"Mars's hot minion is returned again,"
93208,93209,The Tempest,20.0,4.1.108,IRIS,"Her waspish-headed son has broke his arrows,"
93209,93210,The Tempest,20.0,4.1.109,IRIS,Swears he will shoot no more but play with sparrows
93210,93211,The Tempest,20.0,4.1.110,IRIS,And be a boy right out.
93211,93212,The Tempest,21.0,4.1.111,CERES,"High'st queen of state,"
93212,93213,The Tempest,21.0,4.1.112,CERES,"Great Juno, comes, I know her by her gait."
93213,93214,The Tempest,21.0,,CERES,Enter JUNO
93214,93215,The Tempest,22.0,4.1.113,JUNO,How does my bounteous sister? Go with me
93215,93216,The Tempest,22.0,4.1.114,JUNO,"To bless this twain, that they may prosperous be"
93216,93217,The Tempest,22.0,4.1.115,JUNO,And honour'd in their issue.
93217,93218,The Tempest,22.0,4.1.115,JUNO,They sing:
93218,93219,The Tempest,23.0,4.1.116,JUNO,"Honour, riches, marriage-blessing,"
93219,93220,The Tempest,23.0,4.1.117,JUNO,"Long continuance, and increasing,"
93220,93221,The Tempest,23.0,4.1.118,JUNO,Hourly joys be still upon you!
93221,93222,The Tempest,23.0,4.1.119,JUNO,Juno sings her blessings upon you.
93222,93223,The Tempest,24.0,4.1.120,CERES,"Earth's increase, foison plenty,"
93223,93224,The Tempest,24.0,4.1.121,CERES,"Barns and garners never empty,"
93224,93225,The Tempest,24.0,4.1.122,CERES,"Vines and clustering bunches growing,"
93225,93226,The Tempest,24.0,4.1.123,CERES,"Plants with goodly burthen bowing,"
93226,93227,The Tempest,24.0,4.1.124,CERES,Spring come to you at the farthest
93227,93228,The Tempest,24.0,4.1.125,CERES,In the very end of harvest!
93228,93229,The Tempest,24.0,4.1.126,CERES,"Scarcity and want shall shun you,"
93229,93230,The Tempest,24.0,4.1.127,CERES,Ceres' blessing so is on you.
93230,93231,The Tempest,25.0,4.1.128,FERDINAND,"This is a most majestic vision, and"
93231,93232,The Tempest,25.0,4.1.129,FERDINAND,Harmoniously charmingly. May I be bold
93232,93233,The Tempest,25.0,4.1.130,FERDINAND,To think these spirits?
93233,93234,The Tempest,26.0,4.1.131,PROSPERO,"Spirits, which by mine art"
93234,93235,The Tempest,26.0,4.1.132,PROSPERO,I have from their confines call'd to enact
93235,93236,The Tempest,26.0,4.1.133,PROSPERO,My present fancies.
93236,93237,The Tempest,27.0,4.1.134,FERDINAND,"Let me live here ever,"
93237,93238,The Tempest,27.0,4.1.135,FERDINAND,So rare a wonder'd father and a wife
93238,93239,The Tempest,27.0,4.1.136,FERDINAND,Makes this place Paradise.
93239,93240,The Tempest,27.0,,FERDINAND,"Juno and Ceres whisper, and send Iris on employment"
93240,93241,The Tempest,28.0,4.1.137,PROSPERO,"Sweet, now, silence!"
93241,93242,The Tempest,28.0,4.1.138,PROSPERO,"Juno and Ceres whisper seriously,"
93242,93243,The Tempest,28.0,4.1.139,PROSPERO,"There's something else to do: hush, and be mute,"
93243,93244,The Tempest,28.0,4.1.140,PROSPERO,Or else our spell is marr'd.
93244,93245,The Tempest,29.0,4.1.141,IRIS,"You nymphs, call'd Naiads, of the windring brooks,"
93245,93246,The Tempest,29.0,4.1.142,IRIS,"With your sedged crowns and ever-harmless looks,"
93246,93247,The Tempest,29.0,4.1.143,IRIS,Leave your crisp channels and on this green land
93247,93248,The Tempest,29.0,4.1.144,IRIS,"Answer your summons, Juno does command:"
93248,93249,The Tempest,29.0,4.1.145,IRIS,"Come, temperate nymphs, and help to celebrate"
93249,93250,The Tempest,29.0,4.1.146,IRIS,"A contract of true love, be not too late."
93250,93251,The Tempest,29.0,,IRIS,Enter certain Nymphs
93251,93252,The Tempest,29.0,4.1.147,IRIS,"You sunburnt sicklemen, of August weary,"
93252,93253,The Tempest,29.0,4.1.148,IRIS,Come hither from the furrow and be merry:
93253,93254,The Tempest,29.0,4.1.149,IRIS,"Make holiday, your rye-straw hats put on"
93254,93255,The Tempest,29.0,4.1.150,IRIS,And these fresh nymphs encounter every one
93255,93256,The Tempest,29.0,4.1.151,IRIS,In country footing.
