,Dataline,Play,PlayerLinenumber,ActSceneLine,Player,PlayerLine
101896,101897,Troilus and Cressida,48.0,4.5.94,AENEAS,"The other blank as nothing. Weigh him well,"
101897,101898,Troilus and Cressida,48.0,4.5.95,AENEAS,And that which looks like pride is courtesy.
101898,101899,Troilus and Cressida,48.0,4.5.96,AENEAS,This Ajax is half made of Hector's blood:
101899,101900,Troilus and Cressida,48.0,4.5.97,AENEAS,"In love whereof, half Hector stays at home,"
101900,101901,Troilus and Cressida,48.0,4.5.98,AENEAS,"Half heart, half hand, half Hector comes to seek"
101901,101902,Troilus and Cressida,48.0,4.5.99,AENEAS,"This blended knight, half Trojan and half Greek."
101902,101903,Troilus and Cressida,49.0,4.5.100,ACHILLES,"A maiden battle, then? O, I perceive you."
101903,101904,Troilus and Cressida,49.0,,ACHILLES,Re-enter DIOMEDES
101904,101905,Troilus and Cressida,50.0,4.5.101,AGAMEMNON,"Here is Sir Diomed. Go, gentle knight,"
101905,101906,Troilus and Cressida,50.0,4.5.102,AGAMEMNON,Stand by our Ajax: as you and Lord AEneas
101906,101907,Troilus and Cressida,50.0,4.5.103,AGAMEMNON,"Consent upon the order of their fight,"
101907,101908,Troilus and Cressida,50.0,4.5.104,AGAMEMNON,"So be it, either to the uttermost,"
101908,101909,Troilus and Cressida,50.0,4.5.105,AGAMEMNON,Or else a breath: the combatants being kin
101909,101910,Troilus and Cressida,50.0,4.5.106,AGAMEMNON,Half stints their strife before their strokes begin.
101910,101911,Troilus and Cressida,50.0,,AGAMEMNON,AJAX and HECTOR enter the lists
101911,101912,Troilus and Cressida,51.0,4.5.107,ULYSSES,They are opposed already.
101912,101913,Troilus and Cressida,52.0,4.5.108,AGAMEMNON,What Trojan is that same that looks so heavy?
101913,101914,Troilus and Cressida,53.0,4.5.109,ULYSSES,"The youngest son of Priam, a true knight,"
101914,101915,Troilus and Cressida,53.0,4.5.110,ULYSSES,"Not yet mature, yet matchless, firm of word,"
101915,101916,Troilus and Cressida,53.0,4.5.111,ULYSSES,"Speaking in deeds and deedless in his tongue,"
101916,101917,Troilus and Cressida,53.0,4.5.112,ULYSSES,Not soon provoked nor being provoked soon calm'd:
101917,101918,Troilus and Cressida,53.0,4.5.113,ULYSSES,"His heart and hand both open and both free,"
101918,101919,Troilus and Cressida,53.0,4.5.114,ULYSSES,"For what he has he gives, what thinks he shows,"
101919,101920,Troilus and Cressida,53.0,4.5.115,ULYSSES,"Yet gives he not till judgment guide his bounty,"
101920,101921,Troilus and Cressida,53.0,4.5.116,ULYSSES,"Nor dignifies an impure thought with breath,"
101921,101922,Troilus and Cressida,53.0,4.5.117,ULYSSES,"Manly as Hector, but more dangerous,"
101922,101923,Troilus and Cressida,53.0,4.5.118,ULYSSES,For Hector in his blaze of wrath subscribes
101923,101924,Troilus and Cressida,53.0,4.5.119,ULYSSES,"To tender objects, but he in heat of action"
101924,101925,Troilus and Cressida,53.0,4.5.120,ULYSSES,Is more vindicative than jealous love:
101925,101926,Troilus and Cressida,53.0,4.5.121,ULYSSES,"They call him Troilus, and on him erect"
101926,101927,Troilus and Cressida,53.0,4.5.122,ULYSSES,"A second hope, as fairly built as Hector."
101927,101928,Troilus and Cressida,53.0,4.5.123,ULYSSES,"Thus says AEneas, one that knows the youth"
101928,101929,Troilus and Cressida,53.0,4.5.124,ULYSSES,"Even to his inches, and with private soul"
101929,101930,Troilus and Cressida,53.0,4.5.125,ULYSSES,Did in great Ilion thus translate him to me.
101930,101931,Troilus and Cressida,53.0,,ULYSSES,Alarum. Hector and Ajax fight
101931,101932,Troilus and Cressida,54.0,4.5.126,AGAMEMNON,They are in action.
101932,101933,Troilus and Cressida,55.0,4.5.127,NESTOR,"Now, Ajax, hold thine own!"
101933,101934,Troilus and Cressida,56.0,4.5.128,TROILUS,"Hector, thou sleep'st,"
101934,101935,Troilus and Cressida,56.0,4.5.129,TROILUS,Awake thee!
101935,101936,Troilus and Cressida,57.0,4.5.130,AGAMEMNON,"His blows are well disposed: there, Ajax!"
101936,101937,Troilus and Cressida,58.0,4.5.131,DIOMEDES,You must no more.
101937,101938,Troilus and Cressida,58.0,,DIOMEDES,Trumpets cease
101938,101939,Troilus and Cressida,59.0,4.5.132,AENEAS,"Princes, enough, so please you."
101939,101940,Troilus and Cressida,60.0,4.5.133,AJAX,"I am not warm yet, let us fight again."
101940,101941,Troilus and Cressida,61.0,4.5.134,DIOMEDES,As Hector pleases.
101941,101942,Troilus and Cressida,62.0,4.5.135,HECTOR,"Why, then will I no more:"
101942,101943,Troilus and Cressida,62.0,4.5.136,HECTOR,"Thou art, great lord, my father's sister's son,"
101943,101944,Troilus and Cressida,62.0,4.5.137,HECTOR,"A cousin-german to great Priam's seed,"
101944,101945,Troilus and Cressida,62.0,4.5.138,HECTOR,The obligation of our blood forbids
101945,101946,Troilus and Cressida,62.0,4.5.139,HECTOR,A gory emulation 'twixt us twain:
101946,101947,Troilus and Cressida,62.0,4.5.140,HECTOR,Were thy commixtion Greek and Trojan so
101947,101948,Troilus and Cressida,62.0,4.5.141,HECTOR,"That thou couldst say 'This hand is Grecian all,"
101948,101949,Troilus and Cressida,62.0,4.5.142,HECTOR,"And this is Trojan, the sinews of this leg"
101949,101950,Troilus and Cressida,62.0,4.5.143,HECTOR,"All Greek, and this all Troy, my mother's blood"
101950,101951,Troilus and Cressida,62.0,4.5.144,HECTOR,"Runs on the dexter cheek, and this sinister"
101951,101952,Troilus and Cressida,62.0,4.5.145,HECTOR,"Bounds in my father's,' by Jove multipotent,"
101952,101953,Troilus and Cressida,62.0,4.5.146,HECTOR,Thou shouldst not bear from me a Greekish member
101953,101954,Troilus and Cressida,62.0,4.5.147,HECTOR,Wherein my sword had not impressure made
101954,101955,Troilus and Cressida,62.0,4.5.148,HECTOR,Of our rank feud: but the just gods gainsay
101955,101956,Troilus and Cressida,62.0,4.5.149,HECTOR,"That any drop thou borrow'dst from thy mother,"
101956,101957,Troilus and Cressida,62.0,4.5.150,HECTOR,"My sacred aunt, should by my mortal sword"
101957,101958,Troilus and Cressida,62.0,4.5.151,HECTOR,"Be drain'd! Let me embrace thee, Ajax:"
101958,101959,Troilus and Cressida,62.0,4.5.152,HECTOR,"By him that thunders, thou hast lusty arms,"
101959,101960,Troilus and Cressida,62.0,4.5.153,HECTOR,Hector would have them fall upon him thus:
101960,101961,Troilus and Cressida,62.0,4.5.154,HECTOR,"Cousin, all honour to thee!"
101961,101962,Troilus and Cressida,63.0,4.5.155,AJAX,"I thank thee, Hector"
101962,101963,Troilus and Cressida,63.0,4.5.156,AJAX,Thou art too gentle and too free a man:
101963,101964,Troilus and Cressida,63.0,4.5.157,AJAX,"I came to kill thee, cousin, and bear hence"
101964,101965,Troilus and Cressida,63.0,4.5.158,AJAX,A great addition earned in thy death.
101965,101966,Troilus and Cressida,64.0,4.5.159,HECTOR,"Not Neoptolemus so mirable,"
101966,101967,Troilus and Cressida,64.0,4.5.160,HECTOR,On whose bright crest Fame with her loud'st Oyes
101967,101968,Troilus and Cressida,64.0,4.5.161,HECTOR,"Cries 'This is he,' could promise to himself"
101968,101969,Troilus and Cressida,64.0,4.5.162,HECTOR,A thought of added honour torn from Hector.
101969,101970,Troilus and Cressida,65.0,4.5.163,AENEAS,"There is expectance here from both the sides,"
101970,101971,Troilus and Cressida,65.0,4.5.164,AENEAS,What further you will do.
101971,101972,Troilus and Cressida,66.0,4.5.165,HECTOR,"We'll answer it,"
101972,101973,Troilus and Cressida,66.0,4.5.166,HECTOR,"The issue is embracement: Ajax, farewell."
101973,101974,Troilus and Cressida,67.0,4.5.167,AJAX,If I might in entreaties find success--
101974,101975,Troilus and Cressida,67.0,4.5.168,AJAX,As seld I have the chance--I would desire
101975,101976,Troilus and Cressida,67.0,4.5.169,AJAX,My famous cousin to our Grecian tents.
101976,101977,Troilus and Cressida,68.0,4.5.170,DIOMEDES,"'Tis Agamemnon's wish, and great Achilles"
101977,101978,Troilus and Cressida,68.0,4.5.171,DIOMEDES,Doth long to see unarm'd the valiant Hector.
101978,101979,Troilus and Cressida,69.0,4.5.172,HECTOR,"AEneas, call my brother Troilus to me,"
101979,101980,Troilus and Cressida,69.0,4.5.173,HECTOR,And signify this loving interview
101980,101981,Troilus and Cressida,69.0,4.5.174,HECTOR,"To the expecters of our Trojan part,"
101981,101982,Troilus and Cressida,69.0,4.5.175,HECTOR,"Desire them home. Give me thy hand, my cousin,"
101982,101983,Troilus and Cressida,69.0,4.5.176,HECTOR,I will go eat with thee and see your knights.
101983,101984,Troilus and Cressida,70.0,4.5.177,AJAX,Great Agamemnon comes to meet us here.
101984,101985,Troilus and Cressida,71.0,4.5.178,HECTOR,"The worthiest of them tell me name by name,"
101985,101986,Troilus and Cressida,71.0,4.5.179,HECTOR,"But for Achilles, mine own searching eyes"
101986,101987,Troilus and Cressida,71.0,4.5.180,HECTOR,Shall find him by his large and portly size.
101987,101988,Troilus and Cressida,72.0,4.5.181,AGAMEMNON,Worthy of arms! as welcome as to one
101988,101989,Troilus and Cressida,72.0,4.5.182,AGAMEMNON,"That would be rid of such an enemy,"
101989,101990,Troilus and Cressida,72.0,4.5.183,AGAMEMNON,"But that's no welcome: understand more clear,"
101990,101991,Troilus and Cressida,72.0,4.5.184,AGAMEMNON,What's past and what's to come is strew'd with husks
101991,101992,Troilus and Cressida,72.0,4.5.185,AGAMEMNON,"And formless ruin of oblivion,"
101992,101993,Troilus and Cressida,72.0,4.5.186,AGAMEMNON,"But in this extant moment, faith and troth,"
101993,101994,Troilus and Cressida,72.0,4.5.187,AGAMEMNON,"Strain'd purely from all hollow bias-drawing,"
101994,101995,Troilus and Cressida,72.0,4.5.188,AGAMEMNON,"Bids thee, with most divine integrity,"
101995,101996,Troilus and Cressida,72.0,4.5.189,AGAMEMNON,"From heart of very heart, great Hector, welcome."
101996,101997,Troilus and Cressida,73.0,4.5.190,HECTOR,"I thank thee, most imperious Agamemnon."
101997,101998,Troilus and Cressida,74.0,4.5.191,AGAMEMNON,"[To TROILUS]  My well-famed lord of Troy, no"
101998,101999,Troilus and Cressida,74.0,4.5.192,AGAMEMNON,less to you.
101999,102000,Troilus and Cressida,75.0,4.5.193,MENELAUS,Let me confirm my princely brother's greeting:
102000,102001,Troilus and Cressida,75.0,4.5.194,MENELAUS,"You brace of warlike brothers, welcome hither."
102001,102002,Troilus and Cressida,76.0,4.5.195,HECTOR,Who must we answer?
102002,102003,Troilus and Cressida,77.0,4.5.196,AENEAS,The noble Menelaus.
102003,102004,Troilus and Cressida,78.0,4.5.197,HECTOR,"O, you, my lord? by Mars his gauntlet, thanks!"
102004,102005,Troilus and Cressida,78.0,4.5.198,HECTOR,"Mock not, that I affect the untraded oath,"
102005,102006,Troilus and Cressida,78.0,4.5.199,HECTOR,Your quondam wife swears still by Venus' glove:
102006,102007,Troilus and Cressida,78.0,4.5.200,HECTOR,"She's well, but bade me not commend her to you."
102007,102008,Troilus and Cressida,79.0,4.5.201,MENELAUS,"Name her not now, sir, she's a deadly theme."
102008,102009,Troilus and Cressida,80.0,4.5.202,HECTOR,"O, pardon, I offend."
102009,102010,Troilus and Cressida,81.0,4.5.203,NESTOR,"I have, thou gallant Trojan, seen thee oft"
102010,102011,Troilus and Cressida,81.0,4.5.204,NESTOR,Labouring for destiny make cruel way
102011,102012,Troilus and Cressida,81.0,4.5.205,NESTOR,"Through ranks of Greekish youth, and I have seen thee,"
102012,102013,Troilus and Cressida,81.0,4.5.206,NESTOR,"As hot as Perseus, spur thy Phrygian steed,"
102013,102014,Troilus and Cressida,81.0,4.5.207,NESTOR,"Despising many forfeits and subduements,"
102014,102015,Troilus and Cressida,81.0,4.5.208,NESTOR,"When thou hast hung thy advanced sword i' the air,"
102015,102016,Troilus and Cressida,81.0,4.5.209,NESTOR,"Not letting it decline on the declined,"
102016,102017,Troilus and Cressida,81.0,4.5.210,NESTOR,That I have said to some my standers by
102017,102018,Troilus and Cressida,81.0,4.5.211,NESTOR,"'Lo, Jupiter is yonder, dealing life!'"
102018,102019,Troilus and Cressida,81.0,4.5.212,NESTOR,"And I have seen thee pause and take thy breath,"
102019,102020,Troilus and Cressida,81.0,4.5.213,NESTOR,"When that a ring of Greeks have hemm'd thee in,"
102020,102021,Troilus and Cressida,81.0,4.5.214,NESTOR,"Like an Olympian wrestling: this have I seen,"
102021,102022,Troilus and Cressida,81.0,4.5.215,NESTOR,"But this thy countenance, still lock'd in steel,"
102022,102023,Troilus and Cressida,81.0,4.5.216,NESTOR,"I never saw till now. I knew thy grandsire,"
102023,102024,Troilus and Cressida,81.0,4.5.217,NESTOR,"And once fought with him: he was a soldier good,"
102024,102025,Troilus and Cressida,81.0,4.5.218,NESTOR,"But, by great Mars, the captain of us all,"
102025,102026,Troilus and Cressida,81.0,4.5.219,NESTOR,"Never saw like thee. Let an old man embrace thee,"
102026,102027,Troilus and Cressida,81.0,4.5.220,NESTOR,"And, worthy warrior, welcome to our tents."
102027,102028,Troilus and Cressida,82.0,4.5.221,AENEAS,'Tis the old Nestor.
102028,102029,Troilus and Cressida,83.0,4.5.222,HECTOR,"Let me embrace thee, good old chronicle,"
102029,102030,Troilus and Cressida,83.0,4.5.223,HECTOR,That hast so long walk'd hand in hand with time:
102030,102031,Troilus and Cressida,83.0,4.5.224,HECTOR,"Most reverend Nestor, I am glad to clasp thee."
102031,102032,Troilus and Cressida,84.0,4.5.225,NESTOR,"I would my arms could match thee in contention,"
102032,102033,Troilus and Cressida,84.0,4.5.226,NESTOR,As they contend with thee in courtesy.
102033,102034,Troilus and Cressida,85.0,4.5.227,HECTOR,I would they could.
102034,102035,Troilus and Cressida,86.0,4.5.228,NESTOR,Ha!
102035,102036,Troilus and Cressida,86.0,4.5.229,NESTOR,"By this white beard, I'ld fight with thee to-morrow."
102036,102037,Troilus and Cressida,86.0,4.5.230,NESTOR,"Well, welcome, welcome! I have seen the time."
102037,102038,Troilus and Cressida,87.0,4.5.231,ULYSSES,I wonder now how yonder city stands
102038,102039,Troilus and Cressida,87.0,4.5.232,ULYSSES,When we have here her base and pillar by us.
102039,102040,Troilus and Cressida,88.0,4.5.233,HECTOR,"I know your favour, Lord Ulysses, well."
102040,102041,Troilus and Cressida,88.0,4.5.234,HECTOR,"Ah, sir, there's many a Greek and Trojan dead,"
102041,102042,Troilus and Cressida,88.0,4.5.235,HECTOR,Since first I saw yourself and Diomed
102042,102043,Troilus and Cressida,88.0,4.5.236,HECTOR,"In Ilion, on your Greekish embassy."
102043,102044,Troilus and Cressida,89.0,4.5.237,ULYSSES,"Sir, I foretold you then what would ensue:"
102044,102045,Troilus and Cressida,89.0,4.5.238,ULYSSES,"My prophecy is but half his journey yet,"
102045,102046,Troilus and Cressida,89.0,4.5.239,ULYSSES,"For yonder walls, that pertly front your town,"
102046,102047,Troilus and Cressida,89.0,4.5.240,ULYSSES,"Yond towers, whose wanton tops do buss the clouds,"
102047,102048,Troilus and Cressida,89.0,4.5.241,ULYSSES,Must kiss their own feet.
102048,102049,Troilus and Cressida,90.0,4.5.242,HECTOR,I must not believe you:
102049,102050,Troilus and Cressida,90.0,4.5.243,HECTOR,"There they stand yet, and modestly I think,"
102050,102051,Troilus and Cressida,90.0,4.5.244,HECTOR,The fall of every Phrygian stone will cost
102051,102052,Troilus and Cressida,90.0,4.5.245,HECTOR,"A drop of Grecian blood: the end crowns all,"
102052,102053,Troilus and Cressida,90.0,4.5.246,HECTOR,"And that old common arbitrator, Time,"
102053,102054,Troilus and Cressida,90.0,4.5.247,HECTOR,Will one day end it.
102054,102055,Troilus and Cressida,91.0,4.5.248,ULYSSES,So to him we leave it.
102055,102056,Troilus and Cressida,91.0,4.5.249,ULYSSES,"Most gentle and most valiant Hector, welcome:"
102056,102057,Troilus and Cressida,91.0,4.5.250,ULYSSES,"After the general, I beseech you next"
102057,102058,Troilus and Cressida,91.0,4.5.251,ULYSSES,To feast with me and see me at my tent.
102058,102059,Troilus and Cressida,92.0,4.5.252,ACHILLES,"I shall forestall thee, Lord Ulysses, thou!"
102059,102060,Troilus and Cressida,92.0,4.5.253,ACHILLES,"Now, Hector, I have fed mine eyes on thee,"
102060,102061,Troilus and Cressida,92.0,4.5.254,ACHILLES,"I have with exact view perused thee, Hector,"
102061,102062,Troilus and Cressida,92.0,4.5.255,ACHILLES,And quoted joint by joint.
102062,102063,Troilus and Cressida,93.0,4.5.256,HECTOR,Is this Achilles?
102063,102064,Troilus and Cressida,94.0,4.5.257,ACHILLES,I am Achilles.
102064,102065,Troilus and Cressida,95.0,4.5.258,HECTOR,"Stand fair, I pray thee: let me look on thee."
102065,102066,Troilus and Cressida,96.0,4.5.259,ACHILLES,Behold thy fill.
102066,102067,Troilus and Cressida,97.0,4.5.260,HECTOR,"Nay, I have done already."
102067,102068,Troilus and Cressida,98.0,4.5.261,ACHILLES,"Thou art too brief: I will the second time,"
102068,102069,Troilus and Cressida,98.0,4.5.262,ACHILLES,"As I would buy thee, view thee limb by limb."
102069,102070,Troilus and Cressida,99.0,4.5.263,HECTOR,"O, like a book of sport thou'lt read me o'er,"
102070,102071,Troilus and Cressida,99.0,4.5.264,HECTOR,But there's more in me than thou understand'st.
102071,102072,Troilus and Cressida,99.0,4.5.265,HECTOR,Why dost thou so oppress me with thine eye?
102072,102073,Troilus and Cressida,100.0,4.5.266,ACHILLES,"Tell me, you heavens, in which part of his body"
102073,102074,Troilus and Cressida,100.0,4.5.267,ACHILLES,"Shall I destroy him? whether there, or there, or there?"
102074,102075,Troilus and Cressida,100.0,4.5.268,ACHILLES,That I may give the local wound a name
102075,102076,Troilus and Cressida,100.0,4.5.269,ACHILLES,And make distinct the very breach whereout
102076,102077,Troilus and Cressida,100.0,4.5.270,ACHILLES,"Hector's great spirit flew: answer me, heavens!"
102077,102078,Troilus and Cressida,101.0,4.5.271,HECTOR,"It would discredit the blest gods, proud man,"
102078,102079,Troilus and Cressida,101.0,4.5.272,HECTOR,To answer such a question: stand again:
102079,102080,Troilus and Cressida,101.0,4.5.273,HECTOR,Think'st thou to catch my life so pleasantly
102080,102081,Troilus and Cressida,101.0,4.5.274,HECTOR,As to prenominate in nice conjecture
102081,102082,Troilus and Cressida,101.0,4.5.275,HECTOR,Where thou wilt hit me dead?
102082,102083,Troilus and Cressida,102.0,4.5.276,ACHILLES,"I tell thee, yea."
102083,102084,Troilus and Cressida,103.0,4.5.277,HECTOR,"Wert thou an oracle to tell me so,"
102084,102085,Troilus and Cressida,103.0,4.5.278,HECTOR,"I'd not believe thee. Henceforth guard thee well,"
102085,102086,Troilus and Cressida,103.0,4.5.279,HECTOR,"For I'll not kill thee there, nor there, nor there,"
102086,102087,Troilus and Cressida,103.0,4.5.280,HECTOR,"But, by the forge that stithied Mars his helm,"
102087,102088,Troilus and Cressida,103.0,4.5.281,HECTOR,"I'll kill thee every where, yea, o'er and o'er."
102088,102089,Troilus and Cressida,103.0,4.5.282,HECTOR,"You wisest Grecians, pardon me this brag,"
102089,102090,Troilus and Cressida,103.0,4.5.283,HECTOR,"His insolence draws folly from my lips,"
102090,102091,Troilus and Cressida,103.0,4.5.284,HECTOR,"But I'll endeavour deeds to match these words,"
102091,102092,Troilus and Cressida,103.0,4.5.285,HECTOR,Or may I never--
102092,102093,Troilus and Cressida,104.0,4.5.286,AJAX,"Do not chafe thee, cousin:"
102093,102094,Troilus and Cressida,104.0,4.5.287,AJAX,"And you, Achilles, let these threats alone,"
102094,102095,Troilus and Cressida,104.0,4.5.288,AJAX,Till accident or purpose bring you to't:
102095,102096,Troilus and Cressida,104.0,4.5.289,AJAX,You may have every day enough of Hector
102096,102097,Troilus and Cressida,104.0,4.5.290,AJAX,"If you have stomach, the general state, I fear,"
102097,102098,Troilus and Cressida,104.0,4.5.291,AJAX,Can scarce entreat you to be odd with him.
102098,102099,Troilus and Cressida,105.0,4.5.292,HECTOR,"I pray you, let us see you in the field:"
102099,102100,Troilus and Cressida,105.0,4.5.293,HECTOR,"We have had pelting wars, since you refused"
102100,102101,Troilus and Cressida,105.0,4.5.294,HECTOR,The Grecians' cause.
102101,102102,Troilus and Cressida,106.0,4.5.295,ACHILLES,"Dost thou entreat me, Hector?"
102102,102103,Troilus and Cressida,106.0,4.5.296,ACHILLES,"To-morrow do I meet thee, fell as death,"
102103,102104,Troilus and Cressida,106.0,4.5.297,ACHILLES,To-night all friends.
102104,102105,Troilus and Cressida,107.0,4.5.298,HECTOR,Thy hand upon that match.
102105,102106,Troilus and Cressida,108.0,4.5.299,AGAMEMNON,"First, all you peers of Greece, go to my tent,"
102106,102107,Troilus and Cressida,108.0,4.5.300,AGAMEMNON,"There in the full convive we: afterwards,"
102107,102108,Troilus and Cressida,108.0,4.5.301,AGAMEMNON,As Hector's leisure and your bounties shall
102108,102109,Troilus and Cressida,108.0,4.5.302,AGAMEMNON,"Concur together, severally entreat him."
102109,102110,Troilus and Cressida,108.0,4.5.303,AGAMEMNON,"Beat loud the tabourines, let the trumpets blow,"
102110,102111,Troilus and Cressida,108.0,4.5.304,AGAMEMNON,That this great soldier may his welcome know.
102111,102112,Troilus and Cressida,108.0,,AGAMEMNON,Exeunt all except TROILUS and ULYSSES
102112,102113,Troilus and Cressida,109.0,4.5.305,TROILUS,"My Lord Ulysses, tell me, I beseech you,"
102113,102114,Troilus and Cressida,109.0,4.5.306,TROILUS,In what place of the field doth Calchas keep?
102114,102115,Troilus and Cressida,110.0,4.5.307,ULYSSES,"At Menelaus' tent, most princely Troilus:"
102115,102116,Troilus and Cressida,110.0,4.5.308,ULYSSES,"There Diomed doth feast with him to-night,"
102116,102117,Troilus and Cressida,110.0,4.5.309,ULYSSES,"Who neither looks upon the heaven nor earth,"
102117,102118,Troilus and Cressida,110.0,4.5.310,ULYSSES,But gives all gaze and bent of amorous view
102118,102119,Troilus and Cressida,110.0,4.5.311,ULYSSES,On the fair Cressid.
102119,102120,Troilus and Cressida,111.0,4.5.312,TROILUS,"Shall sweet lord, be bound to you so much,"
102120,102121,Troilus and Cressida,111.0,4.5.313,TROILUS,"After we part from Agamemnon's tent,"
102121,102122,Troilus and Cressida,111.0,4.5.314,TROILUS,To bring me thither?
102122,102123,Troilus and Cressida,112.0,4.5.315,ULYSSES,"You shall command me, sir."
102123,102124,Troilus and Cressida,112.0,4.5.316,ULYSSES,"As gentle tell me, of what honour was"
102124,102125,Troilus and Cressida,112.0,4.5.317,ULYSSES,This Cressida in Troy? Had she no lover there
102125,102126,Troilus and Cressida,112.0,4.5.318,ULYSSES,That wails her absence?
102126,102127,Troilus and Cressida,113.0,4.5.319,TROILUS,"O, sir, to such as boasting show their scars"
102127,102128,Troilus and Cressida,113.0,4.5.320,TROILUS,"A mock is due. Will you walk on, my lord?"
102128,102129,Troilus and Cressida,113.0,4.5.321,TROILUS,"She was beloved, she loved, she is, and doth:"
102129,102130,Troilus and Cressida,113.0,4.5.322,TROILUS,But still sweet love is food for fortune's tooth.
102130,102131,Troilus and Cressida,113.0,,TROILUS,Exeunt
102131,102132,Troilus and Cressida,113.0,,TROILUS,ACT V
102132,102133,Troilus and Cressida,113.0,,TROILUS,SCENE I. The Grecian camp. Before Achilles' tent.
102133,102134,Troilus and Cressida,113.0,,TROILUS,Enter ACHILLES and PATROCLUS
102134,102135,Troilus and Cressida,1.0,5.1.1,ACHILLES,"I'll heat his blood with Greekish wine to-night,"
102135,102136,Troilus and Cressida,1.0,5.1.2,ACHILLES,Which with my scimitar I'll cool to-morrow.
102136,102137,Troilus and Cressida,1.0,5.1.3,ACHILLES,"Patroclus, let us feast him to the height."
102137,102138,Troilus and Cressida,2.0,5.1.4,PATROCLUS,Here comes Thersites.
102138,102139,Troilus and Cressida,2.0,,PATROCLUS,Enter THERSITES
102139,102140,Troilus and Cressida,3.0,5.1.5,ACHILLES,"How now, thou core of envy!"
102140,102141,Troilus and Cressida,3.0,5.1.6,ACHILLES,"Thou crusty batch of nature, what's the news?"
102141,102142,Troilus and Cressida,4.0,5.1.7,THERSITES,"Why, thou picture of what thou seemest, and idol"
102142,102143,Troilus and Cressida,4.0,5.1.8,THERSITES,"of idiot worshippers, here's a letter for thee."
102143,102144,Troilus and Cressida,5.0,5.1.9,ACHILLES,"From whence, fragment?"
102144,102145,Troilus and Cressida,6.0,5.1.10,THERSITES,"Why, thou full dish of fool, from Troy."
102145,102146,Troilus and Cressida,7.0,5.1.11,PATROCLUS,Who keeps the tent now?
102146,102147,Troilus and Cressida,8.0,5.1.12,THERSITES,"The surgeon's box, or the patient's wound."
102147,102148,Troilus and Cressida,9.0,5.1.13,PATROCLUS,"Well said, adversity! and what need these tricks?"
102148,102149,Troilus and Cressida,10.0,5.1.14,THERSITES,"Prithee, be silent, boy, I profit not by thy talk:"
102149,102150,Troilus and Cressida,10.0,5.1.15,THERSITES,thou art thought to be Achilles' male varlet.
102150,102151,Troilus and Cressida,11.0,5.1.16,PATROCLUS,"Male varlet, you rogue! what's that?"
102151,102152,Troilus and Cressida,12.0,5.1.17,THERSITES,"Why, his masculine whore. Now, the rotten diseases"
102152,102153,Troilus and Cressida,12.0,5.1.18,THERSITES,"of the south, the guts-griping, ruptures, catarrhs,"
102153,102154,Troilus and Cressida,12.0,5.1.19,THERSITES,"loads o' gravel i' the back, lethargies, cold"
102154,102155,Troilus and Cressida,12.0,5.1.20,THERSITES,"palsies, raw eyes, dirt-rotten livers, wheezing"
102155,102156,Troilus and Cressida,12.0,5.1.21,THERSITES,"lungs, bladders full of imposthume, sciaticas,"
102156,102157,Troilus and Cressida,12.0,5.1.22,THERSITES,"limekilns i' the palm, incurable bone-ache, and the"
102157,102158,Troilus and Cressida,12.0,5.1.23,THERSITES,"rivelled fee-simple of the tetter, take and take"
102158,102159,Troilus and Cressida,12.0,5.1.24,THERSITES,again such preposterous discoveries!
102159,102160,Troilus and Cressida,13.0,5.1.25,PATROCLUS,"Why thou damnable box of envy, thou, what meanest"
102160,102161,Troilus and Cressida,13.0,5.1.26,PATROCLUS,thou to curse thus?
102161,102162,Troilus and Cressida,14.0,5.1.27,THERSITES,Do I curse thee?
