,Dataline,Play,PlayerLinenumber,ActSceneLine,Player,PlayerLine
100817,100818,Troilus and Cressida,70.0,3.1.121,PARIS,"thoughts beget hot deeds, and hot deeds is love."
100818,100819,Troilus and Cressida,71.0,3.1.122,PANDARUS,"Is this the generation of love? hot blood, hot"
100819,100820,Troilus and Cressida,71.0,3.1.123,PANDARUS,"thoughts, and hot deeds? Why, they are vipers:"
100820,100821,Troilus and Cressida,71.0,3.1.124,PANDARUS,"is love a generation of vipers? Sweet lord, who's"
100821,100822,Troilus and Cressida,71.0,3.1.125,PANDARUS,a-field to-day?
100822,100823,Troilus and Cressida,72.0,3.1.126,PARIS,"Hector, Deiphobus, Helenus, Antenor, and all the"
100823,100824,Troilus and Cressida,72.0,3.1.127,PARIS,"gallantry of Troy: I  would fain have armed to-day,"
100824,100825,Troilus and Cressida,72.0,3.1.128,PARIS,but my Nell would not have it so. How chance my
100825,100826,Troilus and Cressida,72.0,3.1.129,PARIS,brother Troilus went not?
100826,100827,Troilus and Cressida,73.0,3.1.130,HELEN,"He hangs the lip at something: you know all, Lord Pandarus."
100827,100828,Troilus and Cressida,74.0,3.1.131,PANDARUS,"Not I, honey-sweet queen. I long to hear how they"
100828,100829,Troilus and Cressida,74.0,3.1.132,PANDARUS,sped to-day. You'll remember your brother's excuse?
100829,100830,Troilus and Cressida,75.0,3.1.133,PARIS,To a hair.
100830,100831,Troilus and Cressida,76.0,3.1.134,PANDARUS,"Farewell, sweet queen."
100831,100832,Troilus and Cressida,77.0,3.1.135,HELEN,Commend me to your niece.
100832,100833,Troilus and Cressida,78.0,3.1.136,PANDARUS,"I will, sweet queen."
100833,100834,Troilus and Cressida,78.0,,PANDARUS,Exit
100834,100835,Troilus and Cressida,78.0,,PANDARUS,A retreat sounded
100835,100836,Troilus and Cressida,79.0,3.1.137,PARIS,"They're come from field: let us to Priam's hall,"
100836,100837,Troilus and Cressida,79.0,3.1.138,PARIS,"To greet the warriors. Sweet Helen, I must woo you"
100837,100838,Troilus and Cressida,79.0,3.1.139,PARIS,"To help unarm our Hector: his stubborn buckles,"
100838,100839,Troilus and Cressida,79.0,3.1.140,PARIS,"With these your white enchanting fingers touch'd,"
100839,100840,Troilus and Cressida,79.0,3.1.141,PARIS,Shall more obey than to the edge of steel
100840,100841,Troilus and Cressida,79.0,3.1.142,PARIS,"Or force of Greekish sinews, you shall do more"
100841,100842,Troilus and Cressida,79.0,3.1.143,PARIS,"Than all the island kings,--disarm great Hector."
100842,100843,Troilus and Cressida,80.0,3.1.144,HELEN,"'Twill make us proud to be his servant, Paris,"
100843,100844,Troilus and Cressida,80.0,3.1.145,HELEN,"Yea, what he shall receive of us in duty"
100844,100845,Troilus and Cressida,80.0,3.1.146,HELEN,"Gives us more palm in beauty than we have,"
100845,100846,Troilus and Cressida,80.0,3.1.147,HELEN,"Yea, overshines ourself."
100846,100847,Troilus and Cressida,81.0,3.1.148,PARIS,"Sweet, above thought I love thee."
100847,100848,Troilus and Cressida,81.0,,PARIS,Exeunt
100848,100849,Troilus and Cressida,81.0,,PARIS,SCENE II. The same. Pandarus' orchard.
100849,100850,Troilus and Cressida,81.0,,PARIS,"Enter PANDARUS and Troilus's Boy, meeting"
100850,100851,Troilus and Cressida,1.0,3.2.1,PANDARUS,How now! where's thy master? at my cousin
100851,100852,Troilus and Cressida,1.0,3.2.2,PANDARUS,Cressida's?
100852,100853,Troilus and Cressida,2.0,3.2.3,Boy,"No, sir, he stays for you to conduct him thither."
100853,100854,Troilus and Cressida,3.0,3.2.4,PANDARUS,"O, here he comes."
100854,100855,Troilus and Cressida,3.0,,PANDARUS,Enter TROILUS
100855,100856,Troilus and Cressida,3.0,3.2.5,PANDARUS,"How now, how now!"
100856,100857,Troilus and Cressida,4.0,3.2.6,TROILUS,"Sirrah, walk off."
100857,100858,Troilus and Cressida,4.0,,TROILUS,Exit Boy
100858,100859,Troilus and Cressida,5.0,3.2.7,PANDARUS,Have you seen my cousin?
100859,100860,Troilus and Cressida,6.0,3.2.8,TROILUS,"No, Pandarus: I stalk about her door,"
100860,100861,Troilus and Cressida,6.0,3.2.9,TROILUS,Like a strange soul upon the Stygian banks
100861,100862,Troilus and Cressida,6.0,3.2.10,TROILUS,"Staying for waftage. O, be thou my Charon,"
100862,100863,Troilus and Cressida,6.0,3.2.11,TROILUS,And give me swift transportance to those fields
100863,100864,Troilus and Cressida,6.0,3.2.12,TROILUS,Where I may wallow in the lily-beds
100864,100865,Troilus and Cressida,6.0,3.2.13,TROILUS,"Proposed for the deserver! O gentle Pandarus,"
100865,100866,Troilus and Cressida,6.0,3.2.14,TROILUS,From Cupid's shoulder pluck his painted wings
100866,100867,Troilus and Cressida,6.0,3.2.15,TROILUS,And fly with me to Cressid!
100867,100868,Troilus and Cressida,7.0,3.2.16,PANDARUS,"Walk here i' the orchard, I'll bring her straight."
100868,100869,Troilus and Cressida,7.0,,PANDARUS,Exit
100869,100870,Troilus and Cressida,8.0,3.2.17,TROILUS,"I am giddy, expectation whirls me round."
100870,100871,Troilus and Cressida,8.0,3.2.18,TROILUS,The imaginary relish is so sweet
100871,100872,Troilus and Cressida,8.0,3.2.19,TROILUS,"That it enchants my sense: what will it be,"
100872,100873,Troilus and Cressida,8.0,3.2.20,TROILUS,When that the watery palate tastes indeed
100873,100874,Troilus and Cressida,8.0,3.2.21,TROILUS,"Love's thrice repured nectar? death, I fear me,"
100874,100875,Troilus and Cressida,8.0,3.2.22,TROILUS,"Swooning destruction, or some joy too fine,"
100875,100876,Troilus and Cressida,8.0,3.2.23,TROILUS,"Too subtle-potent, tuned too sharp in sweetness,"
100876,100877,Troilus and Cressida,8.0,3.2.24,TROILUS,For the capacity of my ruder powers:
100877,100878,Troilus and Cressida,8.0,3.2.25,TROILUS,"I fear it much, and I do fear besides,"
100878,100879,Troilus and Cressida,8.0,3.2.26,TROILUS,"That I shall lose distinction in my joys,"
100879,100880,Troilus and Cressida,8.0,3.2.27,TROILUS,"As doth a battle, when they charge on heaps"
100880,100881,Troilus and Cressida,8.0,3.2.28,TROILUS,The enemy flying.
100881,100882,Troilus and Cressida,8.0,,TROILUS,Re-enter PANDARUS
100882,100883,Troilus and Cressida,9.0,3.2.29,PANDARUS,"She's making her ready, she'll come straight: you"
100883,100884,Troilus and Cressida,9.0,3.2.30,PANDARUS,"must be witty now. She does so blush, and fetches"
100884,100885,Troilus and Cressida,9.0,3.2.31,PANDARUS,"her wind so short, as if she were frayed with a"
100885,100886,Troilus and Cressida,9.0,3.2.32,PANDARUS,sprite: I'll fetch her. It is the prettiest
100886,100887,Troilus and Cressida,9.0,3.2.33,PANDARUS,villain: she fetches her breath as short as a
100887,100888,Troilus and Cressida,9.0,3.2.34,PANDARUS,new-ta'en sparrow.
100888,100889,Troilus and Cressida,9.0,,PANDARUS,Exit
100889,100890,Troilus and Cressida,10.0,3.2.35,TROILUS,Even such a passion doth embrace my bosom:
100890,100891,Troilus and Cressida,10.0,3.2.36,TROILUS,"My heart beats thicker than a feverous pulse,"
100891,100892,Troilus and Cressida,10.0,3.2.37,TROILUS,"And all my powers do their bestowing lose,"
100892,100893,Troilus and Cressida,10.0,3.2.38,TROILUS,Like vassalage at unawares encountering
100893,100894,Troilus and Cressida,10.0,3.2.39,TROILUS,The eye of majesty.
100894,100895,Troilus and Cressida,10.0,,TROILUS,Re-enter PANDARUS with CRESSIDA
100895,100896,Troilus and Cressida,11.0,3.2.40,PANDARUS,"Come, come, what need you blush? shame's a baby."
100896,100897,Troilus and Cressida,11.0,3.2.41,PANDARUS,Here she is now: swear the oaths now to her that
100897,100898,Troilus and Cressida,11.0,3.2.42,PANDARUS,"you have sworn to me. What, are you gone again?"
100898,100899,Troilus and Cressida,11.0,3.2.43,PANDARUS,"you must be watched ere you be made tame, must you?"
100899,100900,Troilus and Cressida,11.0,3.2.44,PANDARUS,"Come your ways, come your ways, an you draw backward,"
100900,100901,Troilus and Cressida,11.0,3.2.45,PANDARUS,we'll put you i' the fills. Why do you not speak to
100901,100902,Troilus and Cressida,11.0,3.2.46,PANDARUS,"her? Come, draw this curtain, and let's see your"
100902,100903,Troilus and Cressida,11.0,3.2.47,PANDARUS,"picture. Alas the day, how loath you are to offend"
100903,100904,Troilus and Cressida,11.0,3.2.48,PANDARUS,"daylight! an 'twere dark, you'ld close sooner."
100904,100905,Troilus and Cressida,11.0,3.2.49,PANDARUS,"So, so, rub on, and kiss the mistress. How now!"
100905,100906,Troilus and Cressida,11.0,3.2.50,PANDARUS,"a kiss in fee-farm! build there, carpenter, the air"
100906,100907,Troilus and Cressida,11.0,3.2.51,PANDARUS,"is sweet. Nay, you shall fight your hearts out ere"
100907,100908,Troilus and Cressida,11.0,3.2.52,PANDARUS,"I part you. The falcon as the tercel, for all the"
100908,100909,Troilus and Cressida,11.0,3.2.53,PANDARUS,"ducks i' the river: go to, go to."
100909,100910,Troilus and Cressida,12.0,3.2.54,TROILUS,"You have bereft me of all words, lady."
100910,100911,Troilus and Cressida,13.0,3.2.55,PANDARUS,"Words pay no debts, give her deeds: but she'll"
100911,100912,Troilus and Cressida,13.0,3.2.56,PANDARUS,"bereave you o' the deeds too, if she call your"
100912,100913,Troilus and Cressida,13.0,3.2.57,PANDARUS,"activity in question. What, billing again? Here's"
100913,100914,Troilus and Cressida,13.0,3.2.58,PANDARUS,'In witness whereof the parties interchangeably'--
100914,100915,Troilus and Cressida,13.0,3.2.59,PANDARUS,"Come in, come in: I'll go get a fire."
100915,100916,Troilus and Cressida,13.0,,PANDARUS,Exit
100916,100917,Troilus and Cressida,14.0,3.2.60,CRESSIDA,"Will you walk in, my lord?"
100917,100918,Troilus and Cressida,15.0,3.2.61,TROILUS,"O Cressida, how often have I wished me thus!"
100918,100919,Troilus and Cressida,16.0,3.2.62,CRESSIDA,"Wished, my lord! The gods grant,--O my lord!"
100919,100920,Troilus and Cressida,17.0,3.2.63,TROILUS,What should they grant? what makes this pretty
100920,100921,Troilus and Cressida,17.0,3.2.64,TROILUS,abruption? What too curious dreg espies my sweet
100921,100922,Troilus and Cressida,17.0,3.2.65,TROILUS,lady in the fountain of our love?
100922,100923,Troilus and Cressida,18.0,3.2.66,CRESSIDA,"More dregs than water, if my fears have eyes."
100923,100924,Troilus and Cressida,19.0,3.2.67,TROILUS,"Fears make devils of cherubims, they never see truly."
100924,100925,Troilus and Cressida,20.0,3.2.68,CRESSIDA,"Blind fear, that seeing reason leads, finds safer"
100925,100926,Troilus and Cressida,20.0,3.2.69,CRESSIDA,footing than blind reason stumbling without fear: to
100926,100927,Troilus and Cressida,20.0,3.2.70,CRESSIDA,fear the worst oft cures the worse.
100927,100928,Troilus and Cressida,21.0,3.2.71,TROILUS,"O, let my lady apprehend no fear: in all Cupid's"
100928,100929,Troilus and Cressida,21.0,3.2.72,TROILUS,pageant there is presented no monster.
100929,100930,Troilus and Cressida,22.0,3.2.73,CRESSIDA,Nor nothing monstrous neither?
100930,100931,Troilus and Cressida,23.0,3.2.74,TROILUS,"Nothing, but our undertakings, when we vow to weep"
100931,100932,Troilus and Cressida,23.0,3.2.75,TROILUS,"seas, live in fire, eat rocks, tame tigers, thinking"
100932,100933,Troilus and Cressida,23.0,3.2.76,TROILUS,it harder for our mistress to devise imposition
100933,100934,Troilus and Cressida,23.0,3.2.77,TROILUS,enough than for us to undergo any difficulty imposed.
100934,100935,Troilus and Cressida,23.0,3.2.78,TROILUS,"This is the monstruosity in love, lady, that the will"
100935,100936,Troilus and Cressida,23.0,3.2.79,TROILUS,"is infinite and the execution confined, that the"
100936,100937,Troilus and Cressida,23.0,3.2.80,TROILUS,desire is boundless and the act a slave to limit.
100937,100938,Troilus and Cressida,24.0,3.2.81,CRESSIDA,They say all lovers swear more performance than they
100938,100939,Troilus and Cressida,24.0,3.2.82,CRESSIDA,are able and yet reserve an ability that they never
100939,100940,Troilus and Cressida,24.0,3.2.83,CRESSIDA,"perform, vowing more than the perfection of ten and"
100940,100941,Troilus and Cressida,24.0,3.2.84,CRESSIDA,discharging less than the tenth part of one. They
100941,100942,Troilus and Cressida,24.0,3.2.85,CRESSIDA,"that have the voice of lions and the act of hares,"
100942,100943,Troilus and Cressida,24.0,3.2.86,CRESSIDA,are they not monsters?
100943,100944,Troilus and Cressida,25.0,3.2.87,TROILUS,Are there such? such are not we: praise us as we
100944,100945,Troilus and Cressida,25.0,3.2.88,TROILUS,"are tasted, allow us as we prove, our head shall go"
100945,100946,Troilus and Cressida,25.0,3.2.89,TROILUS,bare till merit crown it: no perfection in reversion
100946,100947,Troilus and Cressida,25.0,3.2.90,TROILUS,shall have a praise in present: we will not name
100947,100948,Troilus and Cressida,25.0,3.2.91,TROILUS,"desert before his birth, and, being born, his addition"
100948,100949,Troilus and Cressida,25.0,3.2.92,TROILUS,shall be humble. Few words to fair faith: Troilus
100949,100950,Troilus and Cressida,25.0,3.2.93,TROILUS,shall be such to Cressid as what envy can say worst
100950,100951,Troilus and Cressida,25.0,3.2.94,TROILUS,"shall be a mock for his truth, and what truth can"
100951,100952,Troilus and Cressida,25.0,3.2.95,TROILUS,speak truest not truer than Troilus.
100952,100953,Troilus and Cressida,26.0,3.2.96,CRESSIDA,"Will you walk in, my lord?"
100953,100954,Troilus and Cressida,26.0,,CRESSIDA,Re-enter PANDARUS
100954,100955,Troilus and Cressida,27.0,3.2.97,PANDARUS,"What, blushing still? have you not done talking yet?"
100955,100956,Troilus and Cressida,28.0,3.2.98,CRESSIDA,"Well, uncle, what folly I commit, I dedicate to you."
100956,100957,Troilus and Cressida,29.0,3.2.99,PANDARUS,"I thank you for that: if my lord get a boy of you,"
100957,100958,Troilus and Cressida,29.0,3.2.100,PANDARUS,you'll give him me. Be true to my lord: if he
100958,100959,Troilus and Cressida,29.0,3.2.101,PANDARUS,"flinch, chide me for it."
100959,100960,Troilus and Cressida,30.0,3.2.102,TROILUS,"You know now your hostages, your uncle's word and my"
100960,100961,Troilus and Cressida,30.0,3.2.103,TROILUS,firm faith.
100961,100962,Troilus and Cressida,31.0,3.2.104,PANDARUS,"Nay, I'll give my word for her too: our kindred,"
100962,100963,Troilus and Cressida,31.0,3.2.105,PANDARUS,"though they be long ere they are wooed, they are"
100963,100964,Troilus and Cressida,31.0,3.2.106,PANDARUS,"constant being won: they are burs, I can tell you,"
100964,100965,Troilus and Cressida,31.0,3.2.107,PANDARUS,they'll stick where they are thrown.
100965,100966,Troilus and Cressida,32.0,3.2.108,CRESSIDA,"Boldness comes to me now, and brings me heart."
100966,100967,Troilus and Cressida,32.0,3.2.109,CRESSIDA,"Prince Troilus, I have loved you night and day"
100967,100968,Troilus and Cressida,32.0,3.2.110,CRESSIDA,For many weary months.
100968,100969,Troilus and Cressida,33.0,3.2.111,TROILUS,Why was my Cressid then so hard to win?
100969,100970,Troilus and Cressida,34.0,3.2.112,CRESSIDA,"Hard to seem won: but I was won, my lord,"
100970,100971,Troilus and Cressida,34.0,3.2.113,CRESSIDA,With the first glance that ever--pardon me--
100971,100972,Troilus and Cressida,34.0,3.2.114,CRESSIDA,"If I confess much, you will play the tyrant."
100972,100973,Troilus and Cressida,34.0,3.2.115,CRESSIDA,"I love you now, but not, till now, so much"
100973,100974,Troilus and Cressida,34.0,3.2.116,CRESSIDA,"But I might master it: in faith, I lie,"
100974,100975,Troilus and Cressida,34.0,3.2.117,CRESSIDA,"My thoughts were like unbridled children, grown"
100975,100976,Troilus and Cressida,34.0,3.2.118,CRESSIDA,"Too headstrong for their mother. See, we fools!"
100976,100977,Troilus and Cressida,34.0,3.2.119,CRESSIDA,"Why have I blabb'd? who shall be true to us,"
100977,100978,Troilus and Cressida,34.0,3.2.120,CRESSIDA,When we are so unsecret to ourselves?
100978,100979,Troilus and Cressida,34.0,3.2.121,CRESSIDA,"But, though I loved you well, I woo'd you not,"
100979,100980,Troilus and Cressida,34.0,3.2.122,CRESSIDA,"And yet, good faith, I wish'd myself a man,"
100980,100981,Troilus and Cressida,34.0,3.2.123,CRESSIDA,Or that we women had men's privilege
100981,100982,Troilus and Cressida,34.0,3.2.124,CRESSIDA,"Of speaking first. Sweet, bid me hold my tongue,"
100982,100983,Troilus and Cressida,34.0,3.2.125,CRESSIDA,For in this rapture I shall surely speak
100983,100984,Troilus and Cressida,34.0,3.2.126,CRESSIDA,"The thing I shall repent. See, see, your silence,"
100984,100985,Troilus and Cressida,34.0,3.2.127,CRESSIDA,"Cunning in dumbness, from my weakness draws"
100985,100986,Troilus and Cressida,34.0,3.2.128,CRESSIDA,My very soul of counsel! stop my mouth.
100986,100987,Troilus and Cressida,35.0,3.2.129,TROILUS,"And shall, albeit sweet music issues thence."
100987,100988,Troilus and Cressida,36.0,3.2.130,PANDARUS,"Pretty, i' faith."
100988,100989,Troilus and Cressida,37.0,3.2.131,CRESSIDA,"My lord, I do beseech you, pardon me,"
100989,100990,Troilus and Cressida,37.0,3.2.132,CRESSIDA,"'Twas not my purpose, thus to beg a kiss:"
100990,100991,Troilus and Cressida,37.0,3.2.133,CRESSIDA,I am ashamed. O heavens! what have I done?
100991,100992,Troilus and Cressida,37.0,3.2.134,CRESSIDA,"For this time will I take my leave, my lord."
100992,100993,Troilus and Cressida,38.0,3.2.135,TROILUS,"Your leave, sweet Cressid!"
100993,100994,Troilus and Cressida,39.0,3.2.136,PANDARUS,"Leave! an you take leave till to-morrow morning,--"
100994,100995,Troilus and Cressida,40.0,3.2.137,CRESSIDA,"Pray you, content you."
100995,100996,Troilus and Cressida,41.0,3.2.138,TROILUS,"What offends you, lady?"
100996,100997,Troilus and Cressida,42.0,3.2.139,CRESSIDA,"Sir, mine own company."
100997,100998,Troilus and Cressida,43.0,3.2.140,TROILUS,You cannot shun Yourself.
100998,100999,Troilus and Cressida,44.0,3.2.141,CRESSIDA,Let me go and try:
100999,101000,Troilus and Cressida,44.0,3.2.142,CRESSIDA,"I have a kind of self resides with you,"
101000,101001,Troilus and Cressida,44.0,3.2.143,CRESSIDA,"But an unkind self, that itself will leave,"
101001,101002,Troilus and Cressida,44.0,3.2.144,CRESSIDA,To be another's fool. I would be gone:
101002,101003,Troilus and Cressida,44.0,3.2.145,CRESSIDA,Where is my wit? I know not what I speak.
101003,101004,Troilus and Cressida,45.0,3.2.146,TROILUS,Well know they what they speak that speak so wisely.
101004,101005,Troilus and Cressida,46.0,3.2.147,CRESSIDA,"Perchance, my lord, I show more craft than love,"
101005,101006,Troilus and Cressida,46.0,3.2.148,CRESSIDA,"And fell so roundly to a large confession,"
101006,101007,Troilus and Cressida,46.0,3.2.149,CRESSIDA,"To angle for your thoughts: but you are wise,"
101007,101008,Troilus and Cressida,46.0,3.2.150,CRESSIDA,"Or else you love not, for to be wise and love"
101008,101009,Troilus and Cressida,46.0,3.2.151,CRESSIDA,"Exceeds man's might, that dwells with gods above."
101009,101010,Troilus and Cressida,47.0,3.2.152,TROILUS,O that I thought it could be in a woman--
101010,101011,Troilus and Cressida,47.0,3.2.153,TROILUS,"As, if it can, I will presume in you--"
101011,101012,Troilus and Cressida,47.0,3.2.154,TROILUS,"To feed for aye her ramp and flames of love,"
101012,101013,Troilus and Cressida,47.0,3.2.155,TROILUS,"To keep her constancy in plight and youth,"
101013,101014,Troilus and Cressida,47.0,3.2.156,TROILUS,"Outliving beauty's outward, with a mind"
101014,101015,Troilus and Cressida,47.0,3.2.157,TROILUS,That doth renew swifter than blood decays!
101015,101016,Troilus and Cressida,47.0,3.2.158,TROILUS,"Or that persuasion could but thus convince me,"
101016,101017,Troilus and Cressida,47.0,3.2.159,TROILUS,That my integrity and truth to you
101017,101018,Troilus and Cressida,47.0,3.2.160,TROILUS,Might be affronted with the match and weight
101018,101019,Troilus and Cressida,47.0,3.2.161,TROILUS,"Of such a winnow'd purity in love,"
101019,101020,Troilus and Cressida,47.0,3.2.162,TROILUS,"How were I then uplifted! but, alas!"
101020,101021,Troilus and Cressida,47.0,3.2.163,TROILUS,I am as true as truth's simplicity
101021,101022,Troilus and Cressida,47.0,3.2.164,TROILUS,And simpler than the infancy of truth.
101022,101023,Troilus and Cressida,48.0,3.2.165,CRESSIDA,In that I'll war with you.
101023,101024,Troilus and Cressida,49.0,3.2.166,TROILUS,"O virtuous fight,"
101024,101025,Troilus and Cressida,49.0,3.2.167,TROILUS,When right with right wars who shall be most right!
101025,101026,Troilus and Cressida,49.0,3.2.168,TROILUS,True swains in love shall in the world to come
101026,101027,Troilus and Cressida,49.0,3.2.169,TROILUS,"Approve their truths by Troilus: when their rhymes,"
101027,101028,Troilus and Cressida,49.0,3.2.170,TROILUS,"Full of protest, of oath and big compare,"
101028,101029,Troilus and Cressida,49.0,3.2.171,TROILUS,"Want similes, truth tired with iteration,"
101029,101030,Troilus and Cressida,49.0,3.2.172,TROILUS,"As true as steel, as plantage to the moon,"
101030,101031,Troilus and Cressida,49.0,3.2.173,TROILUS,"As sun to day, as turtle to her mate,"
101031,101032,Troilus and Cressida,49.0,3.2.174,TROILUS,"As iron to adamant, as earth to the centre,"
101032,101033,Troilus and Cressida,49.0,3.2.175,TROILUS,"Yet, after all comparisons of truth,"
101033,101034,Troilus and Cressida,49.0,3.2.176,TROILUS,"As truth's authentic author to be cited,"
101034,101035,Troilus and Cressida,49.0,3.2.177,TROILUS,"'As true as Troilus' shall crown up the verse,"
101035,101036,Troilus and Cressida,49.0,3.2.178,TROILUS,And sanctify the numbers.
101036,101037,Troilus and Cressida,50.0,3.2.179,CRESSIDA,Prophet may you be!
101037,101038,Troilus and Cressida,50.0,3.2.180,CRESSIDA,"If I be false, or swerve a hair from truth,"
101038,101039,Troilus and Cressida,50.0,3.2.181,CRESSIDA,"When time is old and hath forgot itself,"
101039,101040,Troilus and Cressida,50.0,3.2.182,CRESSIDA,"When waterdrops have worn the stones of Troy,"
101040,101041,Troilus and Cressida,50.0,3.2.183,CRESSIDA,"And blind oblivion swallow'd cities up,"
101041,101042,Troilus and Cressida,50.0,3.2.184,CRESSIDA,And mighty states characterless are grated
101042,101043,Troilus and Cressida,50.0,3.2.185,CRESSIDA,"To dusty nothing, yet let memory,"
101043,101044,Troilus and Cressida,50.0,3.2.186,CRESSIDA,"From false to false, among false maids in love,"
101044,101045,Troilus and Cressida,50.0,3.2.187,CRESSIDA,Upbraid my falsehood! when they've said 'as false
101045,101046,Troilus and Cressida,50.0,3.2.188,CRESSIDA,"As air, as water, wind, or sandy earth,"
101046,101047,Troilus and Cressida,50.0,3.2.189,CRESSIDA,"As fox to lamb, as wolf to heifer's calf,"
101047,101048,Troilus and Cressida,50.0,3.2.190,CRESSIDA,"Pard to the hind, or stepdame to her son,'"
101048,101049,Troilus and Cressida,50.0,3.2.191,CRESSIDA,"'Yea,' let them say, to stick the heart of falsehood,"
101049,101050,Troilus and Cressida,50.0,3.2.192,CRESSIDA,'As false as Cressid.'
101050,101051,Troilus and Cressida,51.0,3.2.193,PANDARUS,"Go to, a bargain made: seal it, seal it, I'll be the"
101051,101052,Troilus and Cressida,51.0,3.2.194,PANDARUS,"witness. Here I hold your hand, here my cousin's."
101052,101053,Troilus and Cressida,51.0,3.2.195,PANDARUS,"If ever you prove false one to another, since I have"
101053,101054,Troilus and Cressida,51.0,3.2.196,PANDARUS,"taken such pains to bring you together, let all"
101054,101055,Troilus and Cressida,51.0,3.2.197,PANDARUS,pitiful goers-between be called to the world's end
101055,101056,Troilus and Cressida,51.0,3.2.198,PANDARUS,"after my name, call them all Pandars, let all"
101056,101057,Troilus and Cressida,51.0,3.2.199,PANDARUS,"constant men be Troiluses, all false women Cressids,"
101057,101058,Troilus and Cressida,51.0,3.2.200,PANDARUS,"and all brokers-between Pandars! say, amen."
101058,101059,Troilus and Cressida,52.0,3.2.201,TROILUS,Amen.
101059,101060,Troilus and Cressida,53.0,3.2.202,CRESSIDA,Amen.
101060,101061,Troilus and Cressida,54.0,3.2.203,PANDARUS,Amen. Whereupon I will show you a chamber with a
101061,101062,Troilus and Cressida,54.0,3.2.204,PANDARUS,"bed, which bed, because it shall not speak of your"
101062,101063,Troilus and Cressida,54.0,3.2.205,PANDARUS,"pretty encounters, press it to death: away!"
101063,101064,Troilus and Cressida,54.0,3.2.206,PANDARUS,And Cupid grant all tongue-tied maidens here
101064,101065,Troilus and Cressida,54.0,3.2.207,PANDARUS,"Bed, chamber, Pandar to provide this gear!"
101065,101066,Troilus and Cressida,54.0,,PANDARUS,Exeunt
101066,101067,Troilus and Cressida,54.0,,PANDARUS,SCENE III. The Grecian camp. Before Achilles' tent.
101067,101068,Troilus and Cressida,54.0,,PANDARUS,"Enter AGAMEMNON, ULYSSES, DIOMEDES, NESTOR, AJAX, MENELAUS, and CALCHAS"
101068,101069,Troilus and Cressida,1.0,3.3.1,CALCHAS,"Now, princes, for the service I have done you,"
101069,101070,Troilus and Cressida,1.0,3.3.2,CALCHAS,The advantage of the time prompts me aloud
101070,101071,Troilus and Cressida,1.0,3.3.3,CALCHAS,To call for recompense. Appear it to your mind
101071,101072,Troilus and Cressida,1.0,3.3.4,CALCHAS,"That, through the sight I bear in things to love,"
101072,101073,Troilus and Cressida,1.0,3.3.5,CALCHAS,"I have abandon'd Troy, left my possession,"
101073,101074,Troilus and Cressida,1.0,3.3.6,CALCHAS,"Incurr'd a traitor's name, exposed myself,"
101074,101075,Troilus and Cressida,1.0,3.3.7,CALCHAS,"From certain and possess'd conveniences,"
101075,101076,Troilus and Cressida,1.0,3.3.8,CALCHAS,"To doubtful fortunes, sequestering from me all"
101076,101077,Troilus and Cressida,1.0,3.3.9,CALCHAS,"That time, acquaintance, custom and condition"
101077,101078,Troilus and Cressida,1.0,3.3.10,CALCHAS,"Made tame and most familiar to my nature,"
101078,101079,Troilus and Cressida,1.0,3.3.11,CALCHAS,"And here, to do you service, am become"
101079,101080,Troilus and Cressida,1.0,3.3.12,CALCHAS,"As new into the world, strange, unacquainted:"
